#CODE;ENGLISH;;;;;;;;;;;RUSSIAN;;x
EVTDESC7040;I apparently visited the local tavern yesterday, which would explain the hangover... What is worse though, is they tell me I may have blabbered about a certain 'plot'...;;;;;;;;;;;Ïîõîæå, â÷åðà ÿ áûë[Root.GetEndA] â òàâåðíå, ýòî ìîãëî áû êàê-òî îáúÿñíèòü ñåãîäíÿøíåå ïîõìåëüå. È ÷òî õóæå âñåãî, ãîâîðÿò, ÿ áîëòàë[Root.GetEndA] ÷òî-òî î çàãîâîðå...;;x
EVTDESC7045;[From.GetTitledName] let everyone know about my plot to [Root.GetPlot] during a drunken stupor at the local tavern. I never should have included that drunken blabbermouth in a plot this delicate!;;;;;;;;;;;[From.GetTitledName] ñïüÿíó âçáîëòíóë[From.GetEndA] â òàâåðíå î ìî¸ì çàãîâîðå ñ öåëüþ [Root.GetPlot]. Îá ýòîì òåïåðü çíàþò âñå. È çà÷åì òîëüêî ÿ ïîñâÿòèë[Root.GetEndA] â ñâîè ïëàíû ýò[From.GetUOgo] ïüÿíèöó...;;x
EVTOPTA7040;This won't be popular...;;;;;;;;;;;Ýòî ìàëî êîìó ïîíðàâèòñÿ...;;x
EVTOPTA7045;My reputation is ruined!;;;;;;;;;;;Ñ ìîåé ðåïóòàöèåé ïîêîí÷åíî!;;x
EVTDESC7250;My spymaster tells me that information about my plot to [Root.GetPlot] might have leaked to someone outside the conspiracy. We do not know who yet, but maybe we will hear from him...;;;;;;;;;;;"Ìîé [Root.GetSpymasterName] ñîîáùàåò ìíå, ÷òî èíôîðìàöèÿ î ìî¸ì çàãîâîðå ""[Root.GetPlot]"" ìîãëà ïðîñî÷èòüñÿ ê êîìó-òî, íå âêëþ÷¸ííîìó â çàãîâîð. Ìû åù¸ íå çíàåì, ê êîìó òî÷íî, íî, âîçìîæíî, ìû î í¸ì ñêîðî óñëûøèì.";;x
EVTDESC7255;I have learned that [From.GetTitledName] has started a plot to [From.GetPlot]. What should I do with this information?;;;;;;;;;;;ß óçíàë, ÷òî [From.GetTitledName] îðãàíèçîâàë çàãîâîð ñ öåëüþ [From.GetPlot]. Êàê ìíå ïîñòóïèòü ñ ýòîé èíôîðìàöèåé?;;x
EVTDESC7260;It has come to my attention that you are the leader of a plot to [Root.GetPlot]. I find this most fascinating, and I bet that others would too... I suspect that you wish to keep this a secret, but my silence comes with a price.\n\nSigned,\n[From.GetTitledName];;;;;;;;;;;Ìíå ñîîáùèëè, ÷òî Âû âîçãëàâëÿåòå çàãîâîð ñ öåëüþ [Root.GetPlot]. ß íàõîæó ýòî óâëåêàòåëüíûì âðåìÿïðîâîæäåíèåì, íî âîò äðóãèå, áîþñü, íå ðàçäåëÿò ìîåãî ìíåíèÿ... Ïîäîçðåâàþ, ÷òî Âû áû õîòåëè ñîõðàíèòü ýòî â òàéíå, íî ìî¸ ìîë÷àíèå èìååò öåíó.\n\nÏîäïèñü,\n[From.GetTitledName];;x
EVTDESC7265;I have no choice but to accept your despicable blackmail attempt. You have been given payment in full, and I expect your silence in this matter from now on.;;;;;;;;;;;Âû íå îñòàâëÿåòå ìíå âûáîðà. Âû ïîëó÷èòå äåíüãè è, ÿ íàäåþñü, ñäåðæèòå ñâî¸ îáåùàíèå î ìîë÷àíèè.;;x
EVTDESC7270;I will never succumb to blackmail! I rather face the embarrassment of having my plot exposed than giving you a single coin.;;;;;;;;;;;ß íèêîãäà íå ïîääàìñÿ íà øàíòàæ! ß ñòåðïëþ ïîçîð îò îòêðûâøåãîñÿ çàãîâîðà, íî Âû íå ïîëó÷èòå îò ìåíÿ íè ìîíåòû!;;x
EVTOPTA7250;Can my spymaster never bring me good news?;;;;;;;;;;;À ìîé [Root.GetSpymasterName] ìîæåò ìíå èíîãäà è õîðîøèå íîâîñòè ïðèíîñèòü?;;x
EVTOPTA7255;A little blackmail can't hurt, can it?;;;;;;;;;;;Íåáîëüøîé øàíòàæ íå ïîâðåäèò, ïðàâäà?;;x
EVTOPTA7260;Bastard! But I don't have a choice...;;;;;;;;;;;Óáëþäîê! Íî âûáîðà ó ìåíÿ, ïîõîæå, íåò.;;x
EVTOPTA7270;Damn;;;;;;;;;;;Ïðîêëÿòüå!;;x
EVTOPTB7255;It does not concern me. Let it be.;;;;;;;;;;;Ýòî íå ìî¸ äåëî.;;x
EVTOPTB7260;I won't tolerate blackmail!;;;;;;;;;;;ß íå ïîòåðïëþ øàíòàæà!;;x
EVTTOOLTIP7260;Receives a letter;;;;;;;;;;;Ïîëó÷åíî ïèñüìî.;;x
EVTDESC7700;[Root.PlotTarget.GetTitledName] is due to tour [Root.PlotTarget.Location.GetName] in an open carriage to receive the accolades and adulation of the common folk. There is bound be an escort, but what if a few archers were placed on the [Root.PlotTarget.GetTitle]'s path on certain key rooftops...;;;;;;;;;;;[Root.PlotTarget.GetTitledName] îòïðàâèòñÿ â ïîåçäêó ïî [Root.PlotTarget.Location.County.GetAdjective]ñêèì çåìëÿì â îòêðûòîì ýêèïàæå, ÷òîáû íàñëàäèòüñÿ ñëàâîé è ëþáîâüþ íàðîäà. Çà íèìè áóäåò ñëåäîâàòü ýñêîðò, íî ÷òî, åñëè íà êðûøàõ äîìîâ, ìèìî êîòîðûõ áóäåò åõàòü [Root.PlotTarget.GetTitle], ïîñòàâèòü íåñêîëüêî ëó÷íèêîâ?;;x
EVTDESC7701;Through my sources I have learned that our mutual problem will be touring a city in an open carriage. The guards will keep a close watch on the streets, but will they expect bowmen on the rooftops?;;;;;;;;;;;Ñ ïîìîùüþ ìîèõ èñòî÷íèêîâ ìíå óäàëîñü óçíàòü, ÷òî íàøà âçàèìíàÿ ïðîáëåìà ïðîåäåòñÿ ïî ãîðîäó â îòêðûòîì ýêèïàæå. Ñòðàæíèêè áóäóò âíèìàòåëüíî ñëåäèòü çà óëèöàìè, íî îæèäàþò ëè îíè ëó÷íèêà íà êðûøå?;;x
EVTDESC7702;My co-conspirator, [From.GetTitledName], has asked for coin to hire some bowmen to ambush [Root.PlotTarget.GetTitledName] as [Root.PlotTarget.GetSheHe] tours [Root.PlotTarget.Location.GetName] in an open carriage...;;;;;;;;;;;Âàø[From.GetEndA] ñîîáùíè[From.GetTsaK], [From.GetTitledName], ïðîñèò îïëàòèòü íàéì íåñêîëüêèõ ëó÷íèêîâ äëÿ ïîêóøåíèÿ íà Âàøó öåëü ([Root.PlotTarget.GetTitledName]) âî âðåìÿ [Root.PlotTarget.GetHersHis] ïóòåøåñòâèÿ ïî [Root.PlotTarget.Location.County.GetAdjective]ñêèì çåìëÿì.;;x
EVTDESC7703;[From.GetTitledFirstName] has sent me sufficient coin to hire some skilled archers to greet [From.PlotTarget.GetTitledFirstName] with as [From.PlotTarget.GetSheHe] tours the streets of [Root.PlotTarget.Location.GetName].;;;;;;;;;;;[From.GetTitledFirstName] ïðèñëàë[From.GetEndA] Âàì äîñòàòî÷íî äåíåã äëÿ íàéìà îïûòíûõ ëó÷íèêîâ. Îíè óñòðîÿò äîñòîéíóþ âñòðå÷ó. [From.PlotTarget.GetTitledFirstName] íå âåðí¸òñÿ èç ñâîåé ïîåçäêè.;;x
EVTDESC7704;[From.GetTitledFirstName] has refused to grant me the coin necessary to hire skilled bowmen to skewer [From.PlotTarget.GetTitledFirstName].;;;;;;;;;;;[From.GetTitledFirstName] îòêàçàë[From.GetEndA] Âàì â äåíüãàõ íà íàéì ëó÷íèêîâ äëÿ ïîêóøåíèÿ íà Âàøó öåëü ([From.PlotTarget.GetTitledFirstName]).;;x
EVTDESC7705;I decided to tour [Root.Location.GetName] to receive the adulation of my subjects, but as my open carriage took a turn past the scroll depository I suddenly heard the whizzing sound of an arrow flying past mere inches from my head.;;;;;;;;;;;Âû îòïðàâèëèñü â ïîåçäêó ïî [Root.Location.County.GetAdjective]ñêèì çåìëÿì, ÷òîáû íàñëàäèòüñÿ ñëàâîé è ëþáîâüþ ñâîåãî íàðîäà, íî êàê òîëüêî Âàø îòêðûòûé ýêèïàæ ïðîåõàë ìèìî õðàíèëèùà äîêóìåíòîâ, Âû óñëûøàëè ñâèñò ñòðåëû âñåãî â íåñêîëüêèõ ñàíòèìåòðàõ îò ñâîåé ãîëîâû.;;x
EVTDESC7706;I have been caught in a deadly crossfire! One of the arrows digs into my shoulder, and as I struggle to remove it, the final blow is delivered - an arrow strikes my temple, and my head is thrown back and to the left...;;;;;;;;;;;Âû ïîïàëè â ïåðåñòðåëêó! Ñòðåëà òîð÷èò èç Âàøåãî ïëå÷à è Âû èçî âñåõ ñèë ïûòàåòåñü âûòàùèòü å¸. Íî çà íåé ñëåäóåò íîâàÿ - íà ýòîò ðàç â ãîëîâó...;;x
EVTDESC7708;My carriage was bombarded with arrows, but thanks to what must surely have been the intervention of [Root.Religion.GetRandomGodName], I miraculously emerged unscathed!;;;;;;;;;;;Âàø ýêèïàæ áóêâàëüíî çàñûïàí ñòðåëàìè, íî [Root.Religion.GetHighGodName] çàùèòèë[Root.GetHGodEndA] Âàñ, è Âû èçáåæàëè ñìåðòè!;;x
EVTDESC7710;I have received word from my co-conspirator, [From.GetTitledFirstName], that the bowmen are in place and waiting for the right moment to strike at [Root.PlotTarget.GetTitledFirstName].;;;;;;;;;;;Èçâåñòèå ïðèøëî îò Âàøå[From.GetYGo] ñîîáùíè[From.GetTsyKa]. [From.GetTitledFirstName] ãîâîðèò, ÷òî ëó÷íèêè íàõîäÿòñÿ íà ìåñòå è æäóò ïîäõîäÿùåãî ìîìåíòà, ÷òîáû íàíåñòè óäàð ïî Âàøåé öåëè ([Root.PlotTarget.GetTitledFirstName]).;;x
EVTDESC7711;[From.GetTitledFirstName] approves of my plan to ambush [From.PlotTarget.GetTitledFirstName] with archers from the rooftops of [From.PlotTarget.Location.GetName]. May [Root.Religion.GetRandomGodName] forgive me!;;;;;;;;;;;[From.GetTitledFirstName] îäîáðèë[From.GetEndA] Âàø ïëàí çàñàäû ñ èñïîëüçîâàíèåì ëó÷íèêîâ íà êðûøàõ. [From.PlotTarget.GetTitledFirstName] íå ïåðåæèâ¸ò ýòó ïîåçäêó. Äà ïðîñòèò Âàñ [Root.Religion.GetHighGodName]!;;x
EVTDESC7712;[From.GetTitledFirstName] has let me know that the plot to kill [From.PlotTarget.GetTitledFirstName] is proceeding well. [From.PlotTarget.GetSubjectPronounCap] will soon be skewered by arrows while touring [From.PlotTarget.Location.GetName].;;;;;;;;;;;[From.GetTitledFirstName] ñîîáùèë[From.GetEndA] ìíå, ÷òî íàø ïëàí ïðîäâèãàåòñÿ óñïåøíî. [From.PlotTarget.GetTitledFirstName] âî âðåìÿ ïóòåøåñòâèÿ ïî [From.PlotTarget.Location.County.GetAdjective]ñêèì çåìëÿì íåñîìíåííî ïîïàä¸ò ïîä äîæäü... èç ñòðåë.;;x
EVTDESC7712_B;[From.GetTitledFirstName] has let me know that the plot to kill [From.PlotTarget.GetTitledFirstName] is proceeding well. [From.PlotTarget.GetSubjectPronounCap] will soon be tracked down and skewered by arrows.;;;;;;;;;;;[From.GetTitledFirstName] ñîîáùèë[From.GetEndA] ìíå, ÷òî íàø ïëàí ïðîäâèãàåòñÿ óñïåøíî. [From.PlotTarget.GetTitledFirstName] ñêîðî ïîïàä¸ò ïîä äîæäü... èç ñòðåë.;;x
EVTDESC7713;Success! [From.GetTitledFirstName] was caught in a deadly arrow crossfire between the scroll depository and a grassy knoll. Unfortunately, the scapegoat we had arranged to take the blame spilled my name.;;;;;;;;;;;Ãîòîâî! [From.GetTitledFirstName] óñûïàí[From.GetEndA] äåñÿòêàìè ñòðåë ïî ïóòè ìåæäó õðàíèëèùåì è õîëìîì. Ê ñîæàëåíèþ, êîçëîì îòïóùåíèÿ áûëî ðåøåíî âûáðàòü Âàñ.;;x
EVTDESC7714;"Success! [From.GetTitledFirstName] was caught in a deadly arrow crossfire between the scroll depository and a grassy knoll. The story we concocted about a ""lone bowman"" seems to be working perfectly.";;;;;;;;;;;Ãîòîâî! [From.GetTitledFirstName] óñûïàí[From.GetEndA] äåñÿòêàìè ñòðåë ïî ïóòè ìåæäó õðàíèëèùåì è õîëìîì. Èñòîðèÿ î ëó÷íèêå-îäèíî÷êå ðàáîòàåò îòëè÷íî.;;x
EVTDESC7715;Failure! [From.GetTitledFirstName] escaped the arrow barrage unharmed, and one of the captured bowmen revealed my name.;;;;;;;;;;;Ïðîâàë! [From.GetTitledFirstName] èçáåæàë[From.GetEndA] çàñàäû. Îäèí èç çàõâà÷åííûõ ëó÷íèêîâ ïîêàçàë íà Âàñ.;;x
EVTDESC7716;Failure! [From.GetTitledFirstName] escaped the arrow barrage unharmed, but at least all of the hired bowmen made a quiet escape and the conspiracy remains uncovered.;;;;;;;;;;;Ïðîâàë! [From.GetTitledFirstName] èçáåæàë[From.GetEndA] çàñàäû. Áëàãî âñå ëó÷íèêè ñìîãëè óéòè îò ïîãîíè, çàãîâîð îñòàëñÿ íåðàñêðûòûì.;;x
EVTDESC7720;Watching the animal pens outside [Root.Location.GetName] gave me an idea in how to deal with [Root.PlotTarget.GetTitledName]. Concentrated manure can be a very explosive substance, and if enough is gathered in a single place and ignited, the blast could prove lethal...;;;;;;;;;;;Íàáëþäåíèå çà çàãîíîì äëÿ ñêîòà äàëî Âàì èäåþ, êàê [Root.PlotTarget.GetTitledName] ìîæåò áûòü óñòðàíåí[Root.PlotTarget.GetEndA]. Ñîñðåäîòî÷åííûé â îäíîì ìåñòå íàâîç ìîæåò áûòü î÷åíü âçðûâîîïàñíûì, åñëè ñîáðàòü åãî â äîñòàòî÷íîì êîëè÷åñòâå è ïîäæå÷ü. Âçðûâ ìîæåò îêàçàòüñÿ ñìåðòåëüíûì.;;x
EVTDESC7721;Watching the animal pens outside [Root.Location.GetName] gave me an idea. Concentrated manure can be a very explosive substance, and if enough is gathered in a single place and ignited, the blast could prove lethal...;;;;;;;;;;;Íàáëþäåíèå çà çàãîíàìè äëÿ ñêîòà îêðóãà [Root.Location.GetName] äàëî ìíå èäåþ. Îáðàáîòàííûé íàâîç ìîæåò áûòü î÷åíü âçðûâ÷àòîé ñóáñòàíöèåé, è åñëè ñîáðàòü åãî äîñòàòî÷íî â îäíîì ìåñòå è ïîäæå÷ü, âçðûâ ìîæåò îêàçàòüñÿ ñìåðòåëüíûì...;;x
EVTDESC7722;My co-conspirator, [From.GetTitledName], has asked for coin to buy copious amounts of explosive manure with which to blow [Root.PlotTarget.GetTitledName] sky high.;;;;;;;;;;;Âàø[From.GetEndA] ñîîáùíè[From.GetTsaK], [From.GetTitledName], ïðîñèò îïëàòèòü ïîêóïêó íàâîçà, ÷òîáû âçîðâàòü Âàøó öåëü ([Root.PlotTarget.GetTitledName]);;x
EVTDESC7723;[From.GetTitledFirstName] has provided the money I need to procure enough manure to see to the end of [From.PlotTarget.GetTitledFirstName]...;;;;;;;;;;;[From.GetTitledFirstName] äàë[From.GetEndA] äîñòàòî÷íî äåíåã äëÿ ïîêóïêè íàâîçà.;;x
EVTDESC7724;"[From.GetTitledFirstName] has refused to provide enough money to procure the manure needed for an explosion, calling it a ""hare-brained scheme.""";;;;;;;;;;;[From.GetTitledFirstName] îòêàçàë[From.GetEndA] Âàì â äåíüãàõ íà ïîêóïêó íàâîçà, íàçâàâ ïëàí áåçóìíûì.;;x
EVTDESC7725;Riding through the countryside together with my escort, I come upon a lonely inn. It is empty aside from a nervous-looking innkeeper who nevertheless promises food and wine at a very reasonable price. My party and I sit down at a table.;;;;;;;;;;;Ïðîåõàâøèñü ïî îòäàëåííîé ìåñòíîñòè ñî ñâîèì ýñêîðòîì, ÿ ïðèáûë[Root.GetEndA] â óåäèí¸ííûé òðàêòèð. Ýòî îïóñòåâøåå çàâåäåíèå, ñ íåðâíûìè õîçÿåâàìè, ïðåäëàãàþùèìè âèíî è åäó çà ñêðîìíóþ ïëàòó. ß ñåë[Root.GetEndA] çà ñòîë.;;x
EVTDESC7726;Soon after the innkeeper disappears into the kitchen, we notice a foul odor emanating from somewhere below the floorboards. One of my escort pulls open a loose board to reveal... a massive manure pit. Before we can react further to this bizarre find, the floor explodes beneath my feet...;;;;;;;;;;;Âñêîðå ïîñëå òîãî, êàê õîçÿèí ïðîïàë íà êóõíå, ìû çàìåòèëè íåïðèÿòíûé çàïàõ, èñõîäÿùèé îòêóäà-òî ñíèçó. Îäèí èç ìîèõ ñîïðîâîæäàþùèõ îòîäâèíóë äîñêó è îáíàðóæèë îãðîìíóþ ÿìó íàâîçà. Ìû íå óñïåëè äàæå ñðåàãèðîâàòü íà ýòó íàõîäêó, êàê ïîë âçîðâàëñÿ ïðÿìî ïîäî ìíîé.;;x
EVTDESC7728;My guards detain the innkeeper and pull open the floorboards to reveal a massive pit of manure beneath the inn. The innkeeper confesses to having been paid to ignite the manure once we were seated, blowing everyone to kingdom come.;;;;;;;;;;;Îõðàíà çàäåðæàëà õîçÿèíà, è ïîêàçàëà åìó ÿìó íàâîçà. Îí ïðèçíàëñÿ, ÷òî äîëæåí áûë ïîäæå÷ü íàâîç, âçîðâàâ íàñ âñåõ.;;x
EVTDESC7729;My guards detain the innkeeper and pull open the floorboards to reveal a massive pit of manure beneath the inn. The innkeeper confesses to having been paid to ignite the manure once we were seated, blowing everyone to kingdom come, but his employer concealed his or her identity.;;;;;;;;;;;Îõðàíà çàäåðæàëà õîçÿèíà, è ïîêàçàëà åìó ÿìó íàâîçà. Îí ïðèçíàëñÿ, ÷òî äîëæåí áûë ïîäæå÷ü íàâîç, âçîðâàâ íàñ âñåõ. Ê ñîæàëåíèþ, çàêàç÷èêó, óäàëîñü îñòàòüñÿ èíêîãíèòî.;;x
EVTDESC7730;[From.GetTitledFirstName], my co-conspirator, has sent word that a massive pit of manure has been prepared under the floorboards of an abandoned inn on a path [Root.PlotTarget.GetTitledFirstName] will travel with [Root.PlotTarget.GetHerHis] escort. Once they are seated at a table...;;;;;;;;;;;[From.GetTitledFirstName], Âàø[From.GetEndA] ñîîáùíè[From.GetTsaK], ãîâîðèò î çàêëàäêå íàâîçà ïîä ïîëîâèöû â ïðèäîðîæíîé çàáåãàëîâêå, ñòîÿùåé íà ïóòè, ïî êîòîðîìó åäåò [Root.PlotTarget.GetTitledFirstName] ñî ñâîèì ýñêîðòîì. Êîãäà îíè ñÿäóò çà ñòîë...;;x
EVTDESC7731;[From.GetTitledFirstName] approves of my plan to blow [From.PlotTarget.GetTitledFirstName] sky high with copious amounts of manure. May [Root.Religion.GetRandomGodName] forgive me!;;;;;;;;;;;[From.GetTitledFirstName] îäîáðèë[From.GetEndA] ïëàí âçðûâà ñ ïîìîùüþ íàâîçà, [From.PlotTarget.GetTitledFirstName] ñêîðî ïîãèáíåò. Äà ïðîñòèò Âàñ [Root.Religion.GetHighGodName]!;;x
EVTDESC7732;[From.GetTitledFirstName] informs me that [From.PlotTarget.GetTitledFirstName] will soon perish. A pit of manure has been prepared under the floorboards of an abandoned inn where [From.PlotTarget.GetSheHe] will soon be dining. A single spark will send our little problem kingdom come...;;;;;;;;;;;[From.GetTitledFirstName] ñîîáùèë[From.GetEndA], ÷òî [From.PlotTarget.GetTitledFirstName] ñêîðî ïîãèáíåò. ßìà ñ íàâîçîì ïîäãîòîâëåíà â ãîñòèíèöå, ãäå [From.PlotTarget.GetSheHe] îñòàíîâèòñÿ. Îäíîé èñêðîé Âàøà ïðîáëåìà îòïðàâèòñÿ íà òîò ñâåò.;;x
EVTDESC7733;Success! [From.GetTitledFirstName] perished in the manure explosion! Unfortunately, the farmer who provided the manure revealed my name...;;;;;;;;;;;Ñäåëàíî! [From.GetTitledFirstName] âçîðâà[From.GetLasLsya]. Ê ñîæàëåíèþ, ôåðìåð, ïðåäîñòàâèâøèé íàâîç, óêàçàë íà Âàñ.;;x
EVTDESC7734;Success! [From.GetTitledFirstName] perished in the manure explosion! There is no trace of my complicity to be found amongst the rubble.;;;;;;;;;;;Ñäåëàíî! [From.GetTitledFirstName] âçîðâà[From.GetLasLsya]. Íå îñòàëîñü íèêàêèõ óëèê, óêàçûâàþùèõ íà Âàñ.;;x
EVTDESC7735;Failure! [From.GetTitledFirstName] discovered the manure and avoided the explosion. My complicity was revealed.;;;;;;;;;;;Ïðîâàë! Îõðàíà îáíàðóæèëà íàâîç è ïðåäîòâðàòèëà âçðûâ. Âàñ ðàñêðûëè.;;x
EVTDESC7736;Failure! [From.GetTitledFirstName] discovered the manure and avoided the explosion. Thankfully, my role in this remains unknown...;;;;;;;;;;;Ïðîâàë! Îõðàíà îáíàðóæèëà íàâîç è ïðåäîòâðàòèëà âçðûâ. Âàì óäàëîñü èçáåæàòü ðàñêðûòèÿ.;;x
EVTDESC7740;If that whelp [Root.PlotTarget.GetTitledName] is to die, we will need to buy the loyalty of someone unscrupulous nearby, like a maid or a guard.;;;;;;;;;;;[Root.PlotTarget.GetTitledName] îòïðàâèòñÿ íà òîò ñâåò, íî äëÿ ýòîãî íàì íåîáõîäèìî ïîäêóïèòü êîãî-òî èç îêðóæåíèÿ, íàïðèìåð, ãîðíè÷íóþ èëè îõðàíó.;;x
EVTDESC7741;If that whelp we are plotting against is to die, we will need to buy the loyalty of someone unscrupulous nearby, like a maid or a guard.;;;;;;;;;;;Åñëè òîò, ïðîòèâ êîòîðîãî ìû ïëåò¸ì çàãîâîð, äîëæåí óìåðåòü, íàì íóæíî áóäåò êóïèòü âåðíîñòü êîãî-òî èç íåäîáðîñîâåñòíûõ ëþäåé ïîáëèçîñòè, âðîäå ñòðàæíèêà èëè ãîðíè÷íîé.;;x
EVTDESC7742;My co-conspirator, [From.GetTitledName], has requested funds to buy the loyalty of a serving maid close to [Root.PlotTarget.GetTitledFirstName]. She will see to it that the child ceases to be a problem... ceases to be altogether, in fact.;;;;;;;;;;;Âàø[From.GetEndA] ñîîáùíè[From.GetTsaK] [From.GetTitledName] ïðîñèò äåíåã äëÿ ïîäêóïà ãîðíè÷íîé. Îíà ïðîñëåäèò, ÷òîáû ðåá¸íîê ([Root.PlotTarget.GetTitledFirstName]) ïåðåñòàë áûòü ïðîáëåìîé... íàâñåãäà ïåðåñòàë, íåñîìíåííî.;;x
EVTDESC7743;[From.GetTitledFirstName] has given me the coin I need to bribe one of the serving maids working near [Root.PlotTarget.GetTitledFirstName].;;;;;;;;;;;[From.GetTitledFirstName] äàë[From.GetEndA] Âàì äåíüãè íà ïîäêóï ãîðíè÷íûõ (öåëü - [Root.PlotTarget.GetTitledFirstName]).;;x
EVTDESC7744;[From.GetTitledFirstName] will not give me the coin I need to bribe one of the serving maids working near [Root.PlotTarget.GetTitledFirstName].;;;;;;;;;;;[From.GetTitledFirstName] íå äàë[From.GetEndA] Âàì äåíåã íà ïîäêóï ãîðíè÷íûõ (öåëü - [Root.PlotTarget.GetTitledFirstName]).;;x
EVTDESC7745;As you lie in your crib, staring up at the ceiling and contemplating your future exploits, an adult enters the room. You recognize her as one of the maids, but this time there is something very cold and distant in her eyes. She approaches you with a pillow in her hands...;;;;;;;;;;;Âû ëåæèòå â êðîâàòêå, ãëÿäÿ â ïîòîëîê è ðàçìûøëÿÿ î Âàøèõ áóäóùèõ ïîäâèãàõ, êòî-òî èç âçðîñëûõ âõîäèò â êîìíàòó. Âû óçíàëè å¸, ýòî îäíà èç ñëóæàíîê, íî íà ýòîò ðàç åñòü ÷òî-òî î÷åíü õîëîäíîå è äàë¸êîå â å¸ ãëàçàõ. Îíà ïîäõîäèò ê Âàì ñ ïîäóøêîé â ðóêàõ...;;x
EVTDESC7746;The maid puts the pillow over your face and the world grows dark. With luck perhaps you will be reborn in a gentler era...;;;;;;;;;;;Ñëóæàíêà íàêðûëà ëèöî ïîäóøêîé è âîêðóã ñòàëî òåìíî. Âîçìîæíî, â äðóãîé ðàç Âû ðîäèòåñü â ìåíåå æåñòîêóþ ýïîõó...;;x
EVTDESC7748;As the maid draws near, you take a deep breath and produce a piercing wail that echoes through the nearby hallways. The startled maid drops the pillow and runs away before someone comes to investigate.;;;;;;;;;;;Íå óñïåëà ñëóæàíêà ïîäîéòè, êàê Âû âçäîõíóâ ïîãëóáæå, èçäàëè ïðîíçèòåëüíûé êðèê. Áðîñèâ ïîäóøêó îíà ñáåæàëà, îñòàâèâ Âàñ â áåçîïàñíîñòè.;;x
EVTDESC7750;My co-conspirator, [From.GetTitledFirstName], has managed to get to one of the maids near [Root.PlotTarget.GetTitledFirstName]. For a princely sum, she has agreed to solve our little problem for us.;;;;;;;;;;;Âàø[From.GetEndA] ñîîáùíè[From.GetTsaK] [From.GetTitledFirstName] ñêàçàë[From.GetEndA], ÷òî [Root.PlotTarget.GetTitledFirstName] ñêîðî ïîãèáíåò. Çà îïðåäåë¸ííóþ ñóììó ñëóæàíêà ðåøèò Âàøó ìàëåíüêóþ ïðîáëåìó.;;x
EVTDESC7751;[From.GetTitledFirstName] approves of my efforts to bribe a maid to end the life of young [From.PlotTarget.GetTitledFirstName].;;;;;;;;;;;[From.GetTitledFirstName] îäîáðèë[From.GetEndA] Âàø ïëàí ïîäêóïà ñëóæàíêè è óáèéñòâà ðåá¸íêà ([From.PlotTarget.GetTitledFirstName]).;;x
EVTDESC7752;[From.GetTitledFirstName] tells me that the short life of young [From.PlotTarget.GetTitledFirstName] will soon come to an end. A maid close to the child has been bought, and will be solving our mutual problem.;;;;;;;;;;;[From.GetTitledFirstName] ñîîáùèë[From.GetEndA], ÷òî [From.PlotTarget.GetTitledFirstName] ñêîðî ïîãèáíåò. Ãîðíè÷íàÿ ðåøèò Âàøè ïðîáëåìû.;;x
