#CODE;ENGLISH;;;;;;;;;;;RUSSIAN;;x
EVTOPTA30088;A trip to the lake is always nice;;;;;;;;;;;Ïðîãóëêà ê îçåðó âñåãäà ïðèÿòíà;;x
EVTOPTA30089;But the skies opened up and drenched us!;;;;;;;;;;;Íî íåáåñà ðàçâåðçëèñü, è ìû ïðîìîêëè äî íèòêè.;;x
EVTOPTA30090;Ants ate our picnic!;;;;;;;;;;;Ìóðàâüè âñ¸ ñúåëè!;;x
EVTOPTA30091;There were plenty of game in the forest, and now a lot less;;;;;;;;;;;Â ëåñó áûëî ìíîãî äè÷è, à òåïåðü - ãîðàçäî ìåíüøå;;x
EVTOPTA30092;Dinner was pleasant and with great company!;;;;;;;;;;;Óæèí óäàëñÿ, êîìïàíèÿ áûëà ïðèÿòíîé.;;x
EVTOPTA30095;I think I'll find someone else to befriend;;;;;;;;;;;Äóìàþ, ÿ ïîäðóæóñü ñ êåì-íèáóäü äðóãèì;;x
EVTOPTA30096;I think I have found a new friend;;;;;;;;;;;Äóìàþ, ÿ íàø¸ë íîâîãî äðóãà;;x
EVTOPTA30100;I want to take [Root.Spouse.GetFirstName] on a 'wild ride';;;;;;;;;;;"[Root.Spouse.GetFirstName] óçíàåò, ÷òî ÿ íàçûâàþ ""äèêîé ñêà÷êîé"".";;x
EVTOPTA30101;It was... exhilarating!;;;;;;;;;;;Ýòî áûëî... âîëíóþùèì!;;x
EVTOPTA30102;Love, how I have missed thee!;;;;;;;;;;;Ëþáèìàÿ, êàê æå ÿ ñîñêó÷èëñÿ ïî òåáå;;x
EVTOPTA30103;I hope [Root.Spouse.GetFirstName] is in Heaven now...;;;;;;;;;;;ß íàäåþñü, [Root.Spouse.GetSheHe] òåïåðü íà Íåáåñàõ...;;x
EVTOPTA30104;May he be happy in Heaven;;;;;;;;;;;Ìîæåò, [Root.Spouse.GetSheHe] áóäåò ñ÷àñòëèâ íà Íåáåñàõ.;;x
EVTOPTA30105;I do have someone in mind...;;;;;;;;;;;Åñòü ó ìåíÿ êîå-êòî íà ïðèìåòå...;;x
EVTOPTB30000;Let us rekindle our love!;;;;;;;;;;;Íàäî ïîïðîáîâàòü âîçðîäèòü íàøó ëþáîâü!;;x
EVTOPTB30001;No, wait! I changed my mind...;;;;;;;;;;;Íåò, ïîäîæäèòå! ß ïåðåäóìàë...;;x
EVTOPTB30003;Never!;;;;;;;;;;;Íèêîãäà!;;x
EVTOPTB30004;This is below me!;;;;;;;;;;;Äà êàê Âû ìîãëè ïîäóìàòü!;;x
EVTOPTB30005;Off with her head!;;;;;;;;;;;Îòðóáèòü åé ãîëîâó!;;x
EVTOPTB30006;Whatever it is he wants, he'll get it!;;;;;;;;;;;×åãî áû îí íè õîòåë, îí ýòî ïîëó÷èò!;;x
EVTOPTB30007;A life for a life...;;;;;;;;;;;Æèçíü çà æèçíü...;;x
EVTOPTB30011;I will not show her any mercy!;;;;;;;;;;;[Root.Spouse.GetSheHeCap] íå çàñëóæèâàåò ìèëîñåðäèÿ.;;x
EVTOPTB30020;May she rot in Hell!;;;;;;;;;;;Ïóñòü [Root.Spouse.GetSheHe] ãîðèò â àäó!;;x
EVTOPTB30021;I have no mercy for poisoners!;;;;;;;;;;;Îòðàâèòåëè íå äîñòîéíû æàëîñòè.;;x
EVTOPTB30025;I need to talk to someone, see if someone else has noticed this!;;;;;;;;;;;Ìíå íóæíî ïîãîâîðèòü ñ êåì-íèáóäü, âîçìîæíî êòî-òî ýòî âèäåë!;;x
EVTOPTB30027;Who I decide to shower with attention is none of your business!;;;;;;;;;;;Íå Âàøå äåëî, ñ êåì è êàê ÿ ïðîâîæó ñâî¸ âðåìÿ.;;x
EVTOPTB30028;[From.GetFirstName] refused to even consider paying me more attention!;;;;;;;;;;;[From.GetFirstName] íàîòðåç îòêàçûâàåòñÿ óäåëÿòü ìíå áîëüøå âíèìàíèÿ!;;x
EVTOPTB30030;I try to get in contact with [outside_spouse.GetHerHim], ordering [outside_spouse.GetHerHim] to speed things up;;;;;;;;;;;ß ïûòàþñü âîéòè â êîíòàêò ñ [outside_spouse.GetHerHim], ïðèêàç [outside_spouse.GetHerHim] óñêîðèò äåëî.;;x
EVTOPTB30031;Fine! But I want the gold to be delivered immediately!;;;;;;;;;;;Ïðåêðàñíî! Íî ÿ õî÷ó, ÷òîáû çîëîòî äîñòàâèëè íåìåäëåííî!;;x
EVTOPTB30032;I will send a firm but respectful letter to [prisoner_spouse.GetHerHis] captor;;;;;;;;;;;ß ïîøëþ áåññìûñëåííîå, íî âåæëèâîå ïèñüìî [prisoner_spouse.GetHersHis] ïîõèòèòåëþ;;x
EVTOPTB30033;Stupid [prisoner_spouse.GetManWoman]! Here I am trying to save [prisoner_spouse.GetHerHim], how dare [prisoner_spouse.GetSheHe] die on me?;;;;;;;;;;;Òóïèöà! ß ïûòàþñü [prisoner_spouse.GetHersHis] ñïàñòè, êàê [prisoner_spouse.GetSheHe] ñìååò óìèðàòü?;;x
EVTOPTB30036;Just empty threats!;;;;;;;;;;;Ïðîñòî ïóñòûå óãðîçû!;;x
EVTOPTB30037;Guards! Make sure the prisoner won't escape;;;;;;;;;;;Ñòðàæà! Óáåäèòåñü, ÷òî çàêëþ÷¸ííûé íå ñìîæåò ñáåæàòü;;x
EVTOPTB30040;If possible I'll have [annoying_courtier.GetHerHim] fired.;;;;;;;;;;;Ïóñòü [Root.Spouse.GetHusbandWife] óâîëèò [annoying_courtier.GetHersHis];;x
EVTOPTB30041;She should stay out of this!;;;;;;;;;;;Êòî ðàçðåøèë [Root.Spouse.GetHerHim] âñòðåâàòü â ìîè äåëà?;;x
EVTOPTB30042;She did the right thing!;;;;;;;;;;;[Root.Spouse.GetSheHeCap] ñäåëàë[Root.Spouse.GetEndA] âñå ïðàâèëüíî!;;x
EVTOPTB30045;... order [annoying_courtier.GetHerHim] to be quiet.;;;;;;;;;;;Ïðèêàçàòü [chosen_courtier.GetHerHim] çàòêíóòüñÿ.;;x
EVTOPTB30046;I shall tell the public what happened;;;;;;;;;;;ß ðàññêàæó âñåì êàê ýòî ïðîèçîøëî íà ñàìîì äåëå;;x
EVTOPTB30050;A cameo of myself perhaps?;;;;;;;;;;;Êàê íàñ÷¸ò êàìåè ñ ìîèì ïðîôèëåì?;;x
EVTOPTB30051;The white mare is a bit frisky, but she'll be fine.;;;;;;;;;;;Áåëàÿ âûãëÿäèò ðåçâîé, íî âñ¸ áóäåò â ïîðÿäêå;;x
EVTOPTB30052;A falcon would serve you well!;;;;;;;;;;;Ñîêîë ïîñëóæèò òåáå âåðíî!;;x
EVTOPTB30055;I can work this out myself, thank you very much!;;;;;;;;;;;ß ñàì ïðåêðàñíî ñïðàâëþñü, áîëüøîå òåáå ñïàñèáî!;;x
EVTOPTB30056;This is no business for a woman!;;;;;;;;;;;Íå æåíñêîå ýòî äåëî!;;x
EVTOPTB30057;I can tame those numbers!;;;;;;;;;;;ß óêðîùó ýòè öèôåðêè!;;x
EVTOPTB30058;I would invoke people's wrath if I follow my wife's advice!;;;;;;;;;;;ß íàâëåêó ãíåâ íàðîäà, åñëè ÿ ïîñëåäóþ ñîâåòà ñâîåé æåíû?! Íó ÷òî æå, ïóñòü.;;x
EVTOPTB30059;[Root.job_spiritual.GetFullName] suggests I try to scare them into submission;;;;;;;;;;;[Root.job_spiritual.GetFullName] ïðåäëàãàåò çàïóãàòü èõ è òåì çàñòàâèòü ïîä÷èíÿòüñÿ;;x
EVTOPTB30061;Her 'friend' is not good enough to become [Root.GetMyChancellorName];;;;;;;;;;;"Å¸ ""äðóã"" íåäîñòàòî÷íî õîðîø, [Root.GetMyChancellorName] îñòàíåòñÿ íà ñâî¸ì ïîñòó";;x
EVTOPTB30064;No matter what you say I will not make your friend Marshal!;;;;;;;;;;;Íå èìååò çíà÷åíèÿ, ÷òî òû ñêàæåøü, ÿ íå íàçíà÷ó òâîåãî ïðîòåæå íà ýòó äîëæíîñòü!;;x
EVTOPTB30067;I will keep [Root.job_treasurer.GetFullName] as my Steward!;;;;;;;;;;;[Root.GetTreasurerName] - ïî ïðåæíåìó [Root.job_treasurer.GetFullName]!;;x
EVTOPTB30070;Nothing you say or do will make me change my mind!;;;;;;;;;;;Íèêàêèå òâîè ñëîâà è äåéñòâèÿ íå èçìåíÿò ìî¸ ìíåíèå!;;x
EVTOPTB30073;[Root.job_spiritual.GetFullName] will keep his job;;;;;;;;;;;[Root.job_spiritual.GetFullName] ñîõðàíèò äîëæíîñòü.;;x
EVTOPTB30076;I should tell my husband [Root.Spouse.GetFirstName] the truth;;;;;;;;;;;ß äîëæíà ðàññêàçàòü ìîåìó ìóæó ïðàâäó;;x
EVTOPTB30078;The child is ours, but the courtier must be punished;;;;;;;;;;;Ýòî íàø ðåá¸íîê, íî ïðèäâîðíûé äîëæåí áûòü íàêàçàí;;x
EVTOPTB30080;Execute the adulterer!;;;;;;;;;;;Êàçíèòü çà ïðåëþáîäåÿíèå!;;x
EVTOPTB30081;Execute the adulterer and the adulteress!;;;;;;;;;;;Êàçíèòü èõ îáîèõ!;;x
EVTOPTB30085;Honey, I have obligations I must take care of;;;;;;;;;;;Ãîëóáóøêà, ó ìåíÿ åñòü íåîòëîæíûå îáÿçàòåëüñòâà.;;x
EVTOPTB30088;Let's have a picnic!;;;;;;;;;;;Óñòðîèì ïèêíèê!;;x
EVTOPTB30089;The clouds departed and the sun shone down on us;;;;;;;;;;;Òó÷è ðàññåÿëèñü è ñîëíöå âîññèÿëî;;x
EVTOPTB30090;The food was nice but the company better!;;;;;;;;;;;Åäà áûëà õîðîøà, à êîìïàíèÿ - åù¸ ëó÷øå!;;x
EVTOPTB30091;We became the game, a family of bears hunted us!;;;;;;;;;;;Íà íàñ íà÷àëà îõîòó öåëàÿ ñåìüÿ ìåäâåäåé;;x
EVTOPTB30092;Dinner was quiet, we had nothing to say to each other;;;;;;;;;;;Óæèí ïðîø¸ë â òèøèíå. Íàì áûëî íå÷åãî ñêàçàòü äðóã äðóãó.;;x
EVTOPTB30100;I will be gentle to him;;;;;;;;;;;ß áóäó íåæíà ñ íèì.;;x
EVTOPTB30101;It was a wild ride!;;;;;;;;;;;Ýòî áûëà äèêàÿ ñêà÷êà!;;x
EVTOPTB30102;Gently, we woke the passion between us once again;;;;;;;;;;;Ìû íåæíî ïðîáóäèëè ñòðàñòü ìåæäó íàìè... åù¸ ðàçîê;;x
EVTOPTB30105;I will not have an affair!;;;;;;;;;;;Íå ñòàíó ÿ çàâîäèòü èíòðèæåê!;;x
EVTOPTC30000;Whatever you say, honey;;;;;;;;;;;Êàê ñêàæåøü, ñîëíûøêî;;x
EVTOPTC30005;I will forgive her this little mishap;;;;;;;;;;;ß ïðîùó åé ýòîò íåáîëüøîé ïðîñòóïîê;;x
EVTOPTC30006;I still have some poison left...;;;;;;;;;;;Ó ìåíÿ åù¸ îñòàëîñü íåìíîãî ÿäà...;;x
EVTOPTC30007;Surely she didn't understand what she did?;;;;;;;;;;;Êîíå÷íî, [Root.Spouse.GetSheHe] íå ïîíèìàë[Root.Spouse.GetEndA] ÷òî äåëàåò!;;x
EVTOPTC30011;She clearly did not know what she was doing...;;;;;;;;;;;[Root.Spouse.GetSheHeCap] íå çíàë[Root.GetEndA], ÷òî äåëàåò.;;x
EVTOPTC30020;May she one day realize what she has done;;;;;;;;;;;Êîãäà íèáóäü [Root.Spouse.GetSheHe] ïîéì¸ò, ÷òî íàòâîðèë[Root.Spouse.GetEndA]!;;x
EVTOPTC30021;[Root.Spouse.GetSheHeCap] would never do such a thing!;;;;;;;;;;;[Root.Spouse.GetSheHeCap] áîëüøå òàêîãî íå ñîâåðøèò!;;x
EVTOPTC30025;I should confront my [Root.Spouse.GetFirstName];;;;;;;;;;;Ìíå íóæíî ïðîòèâèòüñÿ [Root.Spouse.GetFirstName];;x
EVTOPTC30030;Who cares? It's not like [outside_spouse.GetSheHe]'ll succeed;;;;;;;;;;;Êîãî ýòî âîëíóåò? Íå ïîõîæå, ÷òî [outside_spouse.GetSheHe] äîáü¸òñÿ óñïåõà.;;x
EVTOPTC30031;Your insolence bores me. Into the dungeon with you!;;;;;;;;;;;Âàøà äåðçîñòü óòîìèëà ìåíÿ. Îòïðàâëÿéòåñü îáà â òåìíèöó!;;x
EVTOPTC30033;I blame [prisoner_spouse.GetHerHis] family for this! They did nothing!;;;;;;;;;;;Ñåìüÿ [prisoner_spouse.GetHersHis] âèíîâíà â ïðîèçîøåäøåì! Îíè è ïàëåö î ïàëåö íå óäàðèëè!;;x
EVTOPTC30037;I did warn [outside_spouse.GetHerHim], didn't I?;;;;;;;;;;;ß ïðåäóïðåæäàë [outside_spouse.GetHersHis], íå ïðàâäà ëè?;;x
EVTOPTC30040;I have the [annoying_courtier.GetManWoman] punished for [annoying_courtier.GetHerHis] insolence.;;;;;;;;;;;ß íàéäó ñïîñîá íàêàçàòü [annoying_courtier.GetHersHis] çà äåðçîñòü;;x
EVTOPTC30045;... ignore [annoying_courtier.GetHerHis] annoying comments.;;;;;;;;;;;Íå îáðàùàòü íà í[chosen_courtier.GetHersHis] âíèìàíèÿ;;x
EVTOPTC30046;I never meant for this to happen!;;;;;;;;;;;Ìíå î÷åíü æàëü..;;x
EVTOPTC30050;Ruby earrings are exactly what she wants!;;;;;;;;;;;Ðóáèíîâûå ñåðüãè — ýòî òî, ÷òî [Root.Spouse.GetHerHim] íàäî!;;x
EVTOPTC30051;The black one is magnificent, the only suitable match for my [Root.Spouse.GetHusbandWife]...!;;;;;;;;;;;Âîðîíàÿ âåëèêîëåïíà, ïðåêðàñíî ïîäîéä¸ò ìî[Root.Spouse.GetHerHim] [Root.Spouse.GetHusbandWifeDAT];;x
EVTOPTC30052;Too dangerous, my love. I don't want you to overexert yourself.;;;;;;;;;;;Ýòî ñëèøêîì îïàñíî, ëþáîâü ìîÿ. ß íå õî÷ó ÷òîáû òû ïåðåíàïðÿãà[my_spouse.GetLasLsya].;;x
EVTOPTC30076;If my husband suspects anything, I will blame the courtier!;;;;;;;;;;;Åñëè ìîé ìóæ ÷òî-ëèáî çàïîäîçðèò, ÿ îáâèíþ ïðèäâîðíîãî!;;x
EVTOPTC30078;How could you do this to me?;;;;;;;;;;;Êàê òû ìîãëà òàê ïîñòóïèòü ñî ìíîé?;;x
EVTOPTC30080;Banish the adulterer!;;;;;;;;;;;Èçãíàòü çà ïðåëþáîäåÿíèå!;;x
EVTOPTC30081;Banish the adulterer and the adulteress!;;;;;;;;;;;Èçãíàòü èõ îáîèõ!;;x
EVTOPTC30088;Hunting is always fun!;;;;;;;;;;;Îõîòà - ýòî âñåãäà âåñåëî!;;x
EVTOPTC30089;I did not like the company;;;;;;;;;;;Ìíå íå ïîíðàâèëàñü êîìïàíèÿ;;x
EVTOPTC30100;We will make sweet, sweet love...;;;;;;;;;;;Ìû çàéìåìñÿ íåæíîé-íåæíîé ëþáîâüþ...;;x
EVTOPTC30101;[Root.Spouse.GetFirstName] woke my lust for her!;;;;;;;;;;;[Root.Spouse.GetSheHeCap] ðàçáóäèë[Root.Spouse.GetEndA] ñòðàñòíîãî çâåðÿ âî ìíå;;x
EVTOPTC30102;Sweet love unfroze this old heart;;;;;;;;;;;Ñëàäêàÿ ëþáîâü ðàñòîïèëà ýòî ñòàðîå ëåäÿíîå ñåðäöå;;x
EVTOPTD30031;No more letters!;;;;;;;;;;;Áîëüøå íèêàêèõ ïèñåì!;;x
EVTOPTD30046;Anyone speaking of the event will be punished;;;;;;;;;;;Ëþáîé, êòî ðàñïðîñòðàíÿåò ñëóõè, áóäåò íàêàçàí;;x
EVTOPTD30050;I think I'll just keep the gold...;;;;;;;;;;;Ïîæàëóé, ÿ îñòàâëþ çîëîòî ñåáå...;;x
EVTOPTD30051;I'm sorry, honey, but all these will be breeders.;;;;;;;;;;;Ïðîñòè, äîðîã[Root.Spouse.GetAyaOy], âñå îíè ñòàíóò ïðîèçâîäèòåëÿìè.;;x
EVTOPTD30080;The taste of vengeance is foul, I will do nothing;;;;;;;;;;;Âêóñ ìåñòè íå÷åñòèâ, ÿ íè÷åãî íå ñäåëàþ;;x
EVTOPTD30081;I have changed my mind, I will only punish the courtier;;;;;;;;;;;ß ïåðåäóìàë, ÿ íàêàæó òîëüêî ïðèäâîðíîãî;;x
EVTOPTD30088;A quiet dinner together would be perfect!;;;;;;;;;;;Òèõèé ñîâìåñòíûé óæèí - ÷òî åù¸ íóæíî?;;x
EVTOPTD30100;Make sure [Root.Spouse.GetFirstName] knows who is the boss in the bedchamber;;;;;;;;;;;Ïóñòü [Root.Spouse.GetSheHe] óçíàåò, êòî ãëàâíûé â ïîñòåëè.;;x
EVTOPTD30101;[Root.Spouse.GetFirstName] showed who is the boss in the bedchamber!;;;;;;;;;;;[Root.Spouse.GetSheHeCap] ïîêàçàë[Root.Spouse.GetEndA] ìíå, êòî ãëàâíûé â ïîñòåëè;;x
EVTOPTD30102;This is a night I will remember, forever;;;;;;;;;;;Ýòî - íî÷ü, êîòîðóþ ÿ çàïîìíþ íàâñåãäà;;x
EVTOPTE30051;You already have me!;;;;;;;;;;;Ó òåáÿ óæå åñòü ÿ!;;x
EVTOPTE30088;I will never be bored again with [target_courtier.GetFirstName] by my side!;;;;;;;;;;;[From.GetFirstName] íèêîãäà íå äàñò ìíå çàñêó÷àòü!;;x
EVTTOOLTIP30002;The spouse fights the annulment;;;;;;;;;;;Ñóïðóã[Root.GetEndAOpp] ñîïðîòèâëÿåòñÿ ðàçâîäó;;x
EVTTOOLTIP30003;My [Root.Religion.GetName] father hear my prayer!;;;;;;;;;;;[Root.GetTrueReligionHighGodVOC], óñëûøü ìîþ ìîëèòâó!;;x
EVTTOOLTIP30005;Your husband finds out about the poisoning;;;;;;;;;;;Âàø ìóæ óçíàåò îá îòðàâëåíèè;;x
EVTTOOLTIP30006;A courtier finds out about the poisoning;;;;;;;;;;;Ïðèäâîðíûé óçíàåò îá îòðàâëåíèè;;x
EVTTOOLTIP30007;Your husband accuses you of the death of his heir;;;;;;;;;;;Âàø ìóæ îáâèíÿåò Âàñ â ñìåðòè åãî íàñëåäíèêà;;x
EVTTOOLTIP30008;[This.GetTitledFirstName] accuses you of the death of heir's death;;;;;;;;;;;[This.GetTitledFirstName] îáâèíÿåò Âàñ â ñìåðòè íàñëåäíèêà.;;x
EVTTOOLTIP30009;[Root.Spouse.GetTitledFirstName] will be imprisoned!;;;;;;;;;;;[Root.Spouse.GetTitledFirstName] ñÿäåò â òþðüìó!;;x
EVTTOOLTIP30010;[Root.Spouse.GetTitledFirstName] will be pardoned!;;;;;;;;;;;[Root.Spouse.GetTitledFirstName] áóäåò ïîìèëîâàíà!;;x
EVTTOOLTIP30011;[Root.Spouse.GetTitledFirstName] knows about the poisoning;;;;;;;;;;;[Root.Spouse.GetTitledFirstName] óçíàåò îá îòðàâëåíèè.;;x
EVTTOOLTIP30026;[Root.GetTitledFirstName] finds someone to talk to;;;;;;;;;;;[Root.GetTitledFirstName] íàéä¸ò ñ êåì ïîãîâîðèòü;;x
EVTTOOLTIP30027;[Root.GetTitledFirstName] talks to [Root.Spouse.GetFirstName];;;;;;;;;;;[Root.GetTitledFirstName] ïåðåãîâîðèò ñ [Root.Spouse.GetFirstName];;x
EVTTOOLTIP30029;[Root.GetTitledFirstName] talks about the gossip with [Root.Spouse.GetFirstName];;;;;;;;;;;[Root.GetTitledFirstName] ðàñïóñêàåò ñïëåòíè î [Root.Spouse.GetFirstName];;x
EVTTOOLTIP30031;Try to talk to [prisoner_host.GetTitledFirstName];;;;;;;;;;;Ïîïðîáîâàòü ïîãîâîðèòü ñ ïåðñîíàæåì [prisoner_host.GetTitledFirstName];;x
EVTTOOLTIP30032;Send a letter to [outside_spouse.GetFirstName];;;;;;;;;;;Îòïðàâèòü ïèñüìî ïåðñîíàæó [outside_spouse.GetFirstName];;x
EVTTOOLTIP30033;[prisoner_spouse.GetTitledName] is executed;;;;;;;;;;;[prisoner_spouse.GetTitledName] áóäåò êàçíåí[prisoner_spouse.GetEndA];;x
EVTTOOLTIP30034;[This.GetTitledFirstName] is released;;;;;;;;;;;[This.GetTitledFirstName] áóäåò îòïóùåí[ThisgetEndA] íà âîëþ.;;x
EVTTOOLTIP30035;[This.GetTitledFirstName] is thrown into the dungeon;;;;;;;;;;;[This.GetTitledFirstName] áóäåò áðîøåí[ThisGetEndA] â òåìíèöó.;;x
EVTTOOLTIP30036;[outside_spouse.GetTitledFirstName] will be warned about the consequences of freeing [prisoner_spouse.GetTitledFirstName];;;;;;;;;;;[outside_spouse.GetTitledFirstName] áóäåò ïðåäóïðåæäåí[outside_spouse.GetEndA] î ïîñëåäñòâèÿõ òîãî, ÷òî áóäåò, êîãäà [prisoner_spouse.GetTitledFirstName] áóäåò îñâîáîæäåí[prisoner_spouse.GetEndA];;x
EVTTOOLTIP30040;I ask my [Root.Spouse.GetFirstName] to fire the annoying [annoying_courtier.GetManWoman].;;;;;;;;;;;Ïîïðîñèòü [Root.Spouse.GetHusbandWifeACC] îòîñëàòü [annoying_courtier.GetHersHis] ïîäàëüøå îò äâîðà;;x
EVTTOOLTIP30042;[Root.Spouse.GetTitledFirstName] becomes aware of [Root.GetTitledFirstName]'s distaste for the courtier;;;;;;;;;;;[Root.Spouse.GetTitledFirstName] óçíàåò, ÷òî [Root.GetTitledFirstName] èñïûòûâàåò íåïðèÿçíü â îòíîøåíèè ïðèäâîðí[annoying_courtier.GetOyOgo];;x
EVTTOOLTIP30046;[This.GetTitledFirstName] drowns;;;;;;;;;;;óòîíåò;;x
EVTTOOLTIP30047;[This.GetTitledFirstName] survives;;;;;;;;;;;ñïàñ¸òñÿ;;x
EVTTOOLTIP30077;I will deny everything!;;;;;;;;;;;ß áóäó âñ¸ îòðèöàòü!;;x
EVTTOOLTIP30078;I will tell him... soon;;;;;;;;;;;ß åìó ðàññêàæó... Ñêîðî;;x
EVTTOOLTIP30079;Suspicion will always arise;;;;;;;;;;;Ïîäîçðåíèå âñåãäà èìååò ñâîéñòâî âîçíèêàòü;;x
EVTTOOLTIP30080;[Root.GetFirstName] decides what to do with the courtier;;;;;;;;;;;[Root.GetFirstName] ðåøàåò, ÷òî äåëàòü ñ ïðèäâîðíûì;;x
EVTTOOLTIP30081;[Root.GetFirstName] decides what to do with the courtier and [Root.Spouse.GetFirstName];;;;;;;;;;;[Root.GetFirstName] ðåøàåò, ÷òî äåëàòü ñ ïðèäâîðíûì è [Root.Spouse.GetFirstName];;x
EVTTOOLTIP30086;[Root.Spouse.GetFirstName] befriends a courtier;;;;;;;;;;;[Root.Spouse.GetFirstName] çàâîäèò äðóæáó ñ ïðèäâîðíûì;;x
EVTTOOLTIP30089;[target_courtier.GetBestName] and [Root.GetBestName] go to the lake;;;;;;;;;;;[This.GetBestName] è [Root.GetBestName] èäóò âìåñòå ê îçåðó;;x
EVTTOOLTIP30090;[target_courtier.GetBestName] and [Root.GetBestName] have a picnic;;;;;;;;;;;[This.GetBestName] è [Root.GetBestName] îòïðàâèëèñü íà ïèêíèê;;x
EVTTOOLTIP30091;[target_courtier.GetBestName] and [Root.GetBestName] go hunting;;;;;;;;;;;[This.GetBestName] è [Root.GetBestName] îòïðàâèëèñü íà îõîòó;;x
EVTTOOLTIP30092;[Root.GetBestName] invites [From.GetBestName] to dinner;;;;;;;;;;;[From.GetBestName] ïðèãëàøàåòñÿ íà óæèí;;x
EVTTOOLTIP30103;The [Root.GetTitle]'s heart could not take the excitement;;;;;;;;;;;Ìî¸ ñåðäöå àæ âûïðûãèâàëî èç ãðóäè îò óäîâîëüñòâèÿ;;x
EVTTOOLTIP30104;The passion overwhelmed [Root.GetFirstName]'s heart;;;;;;;;;;;Ñòðàñòü ïåðåïîëíèëà ìî¸ ñåðäöå;;x
EVTTOOLTIPA30028;[This.GetFirstName] is showered with attention from [Root.GetFirstName];;;;;;;;;;;[This.GetFirstName] ìèëî îáùàåòñÿ ñ [Root.GetFirstName];;x
EVTTOOLTIPA30037;[This.GetTitledFirstName] get a letter from [Root.GetTitledFirstName];;;;;;;;;;;[This.Host.GetTitledFirstName] ïîëó÷èò ïèñüìî îò ÷åëîâåêà ïî èìåíè [Root.GetTitledFirstName].;;x
EVTTOOLTIPA30062;[Root.Spouse.GetFirstName] is thrilled!;;;;;;;;;;;[Root.Spouse.GetFirstName] äîâîëüíà!;;x
EVTTOOLTIPA30065;[Root.Spouse.GetFirstName] is more than happy with your decision;;;;;;;;;;;[Root.Spouse.GetFirstName] âîñõèùåíà Âàøèì ðåøåíèåì;;x
EVTTOOLTIPA30067;[Root.Spouse.GetFirstName] is pleased with your decision;;;;;;;;;;;[Root.Spouse.GetFirstName] äîâîëüíà Âàøèì ðåøåíèåì;;x
EVTTOOLTIPA30071;Your decision has pleased [Root.Spouse.GetFirstName];;;;;;;;;;;Âàøå ðåøåíèå ïîíðàâèëîñü [Root.Spouse.GetFirstName];;x
EVTTOOLTIPA30074;[Root.Spouse.GetFirstName] is overjoyed!;;;;;;;;;;;[Root.Spouse.GetFirstName] âîñõèùåíà!;;x
EVTTOOLTIPA30093;A failed trip to the lake;;;;;;;;;;;Ïóòåøåñòâèå ê îçåðó íå óäàëîñü;;x
EVTTOOLTIPA30094;A perfect trip to the lake;;;;;;;;;;;Ïóòåøåñòâèå ê îçåðó áûëî ïðåêðàñíûì;;x
EVTTOOLTIPA30101;The wild ride takes [This.GetFirstName] with surprise;;;;;;;;;;;"[This.GetFirstName] áóäåò çàñòèãíóò âðàñïëîõ ""äèêîé ñêà÷êîé"".";;x
EVTTOOLTIPA30102;Gentle lovemaking will make [Root.Spouse.GetFirstName] relive your honeymoon;;;;;;;;;;;[Root.Spouse.GetFirstName] çàíîâî ïåðåæèâåò ìåäîâûé ìåñÿö, åñëè íàøè çàíÿòèÿ ëþáîâüþ áóäóò íåæíûìè.;;x
EVTTOOLTIPB30028;[This.GetFirstName] is ignored;;;;;;;;;;;[This.GetFirstName] îñòà¸òñÿ áåç âíèìàíèÿ;;x
EVTTOOLTIPB30037;Ask [This.GetTitledFirstName] to release [Root.Spouse.GetTitledFirstName];;;;;;;;;;;Ïîïðîñèòå [This.GetTitledFirstName] îñâîáîäèòü [Root.Spouse.GetTitledFirstName];;x
EVTTOOLTIPB30062;[Root.Spouse.GetFirstName] does not like your decision;;;;;;;;;;;Âàøåé ñóïðóãå [Root.Spouse.GetFirstName] íå íðàâèòñÿ Âàøå ðåøåíèå;;x
EVTTOOLTIPB30065;[Root.Spouse.GetFirstName] is not happy, not happy at all;;;;;;;;;;;[Root.Spouse.GetFirstName] ðàññòðîåíà, êðàéíå ðàññòðîåíà;;x
EVTTOOLTIPB30067;Your decision upsets [Root.Spouse.GetFirstName];;;;;;;;;;;[Root.Spouse.GetFirstName] îãîð÷åíà Âàøèì ðåøåíèåì;;x
EVTTOOLTIPB30071;Your decision to keep your spymaster displeases [Root.Spouse.GetFirstName];;;;;;;;;;;Âàøå ðåøåíèå ïîääåðæàòü íûíåøíåãî Òàéíîãî ñîâåòíèêà âûçâàëî íåäîâîëüñòâî ó [Root.Spouse.GetFirstName];;x
EVTTOOLTIPB30074;[Root.Spouse.GetFirstName] accepts your decision but does not approve of it;;;;;;;;;;;[Root.Spouse.GetFirstName] ïðèíèìàåò Âàøå ðåøåíèå, íî íå îäîáðÿåò åãî;;x
EVTTOOLTIPB30093;Unwanted guests spoiled the picnic;;;;;;;;;;;Ïèêíèê èñïîð÷åí íåçâàíûìè ãîñòÿìè;;x
EVTTOOLTIPB30094;Fabulous picnic in the wild;;;;;;;;;;;Ñêàçî÷íûé ïèêíèê íà äèêîé ïðèðîäå;;x
EVTTOOLTIPB30101;[Root.Spouse.GetFirstName] is sure to beg for mercy when [Root.GetFirstName] is done with him;;;;;;;;;;;[Root.Spouse.GetSheHeCap] åù¸ ïîïðîñèò ïîùàäû, êîãäà ÿ çàêîí÷ó ñ íèì.;;x
EVTTOOLTIPB30102;[Root.Spouse.GetFirstName] and [Root.GetFirstName] makes sweet love;;;;;;;;;;;[Root.Spouse.GetFirstName] è [Root.GetFirstName] çàéìóòñÿ ëþáîâüþ.;;x
EVTTOOLTIPC30093;The hunter became the hunted, and did not enjoy it;;;;;;;;;;;Îõîòíèê ñòàë äîáû÷åé, ê ñâîåìó íåñ÷àñòüþ;;x
EVTTOOLTIPC30094;Hunting was a pleasure;;;;;;;;;;;Îõîòà äîñòàâèëà îãðîìíîå óäîâîëüñòâèå;;x
EVTTOOLTIPD30093;The food, the drink, the company... all was perfect tonight;;;;;;;;;;;Åäà, íàïèòêè è îáùåñòâî - ñåãîäíÿ âñå áûëî íà âûñîòå;;x
EVTTOOLTIPD30094;The conversation at dinner lacked substance;;;;;;;;;;;Ðàçãîâîðó çà óæèíîì íå äîñòàâàëà ñîäåðæàíèÿ;;x
# CleanSlate: No longer used
