#CODE;ENGLISH;;;;;;;;;;;RUSSIAN;;x
EVTDESC30057;Gold pours from my hands but never finds its way back! The numbers and sums make no sense, twirling numbers mocking me appear every time I close my eyes. My wife [Root.Spouse.GetFirstName] has offered to help me, but I have refused every time she brings it up.;;;;;;;;;;;Çîëîòî ëü¸òñÿ èç ìîèõ ðóê, íî íèêîãäà íå íàõîäèò ïóòè îáðàòíî! ×èñëà è ñóììû íå èìåþò íèêàêîãî ñìûñëà, öèôðû êðóæàùèåñÿ è ñìåþùèåñÿ íàäî ìíîé ïîÿâëÿþòñÿ êàæäûé ðàç êàê ÿ çàêðûâàþ ãëàçà. Ìîÿ æåíà [Root.Spouse.GetFirstName] ïðåäëàãàëà ìíå ïîìî÷ü, íî ÿ âñ¸ îòêàçûâàëñÿ.;;x
EVTDESC30058;I have my eyes set on a title, but my Spymaster [Root.job_spymaster.GetFullName] has advised me to forget about the title, saying I would invoke too much wrath if I try to claim it. My wife [Root.Spouse.GetFirstName], however, is doing everything but telling me outright that I should pursue the title.;;;;;;;;;;;ß ïîëîæèë ãëàç íà îäèí òèòóë, íî ìîé [Root.GetSpymasterName] [Root.job_spymaster.GetFullName] ïîñîâåòîâàë çàáûòü îá ýòîì òèòóëå, ãîâîðÿ ÷òî ÿ íàâëåêó íà ñåáÿ ÷ðåçìåðíîå êîëè÷åñòâî ãíåâà çà ïîïûòêè ïðèñâîèòü òèòóë. Ìîÿ æåíà æå [Root.Spouse.GetFirstName], íàïðîòèâ, ïðÿìî è íàñòîé÷èâî ìíå çàÿâëÿåò ÷òîáû ÿ äîáèâàëñÿ òèòóëà.;;x
EVTDESC30059;The [Root.Religion.GetPriestTitle]s are not always easy to deal with. I need to make sure I have their approval and I have both my wife [Root.Spouse.GetFirstName] and my [Root.GetMyLordSpiritualName] [Root.job_spiritual.GetFullName] giving me advice on how to earn the [Root.Religion.GetPriestTitle]s' approval.;;;;;;;;;;;[Root.GetReligionFullName] è åãî ïîñëåäîâàòåëè íå âñåãäà èäóò íàâñòðå÷ó. Ìíå íóæíî óáåäèòüñÿ, ÷òî îíè îäîáðÿþò ìîè ïîñòóïêè. Ì[Root.Spouse.GetOyaOy] [Root.Spouse.GetHusbandWife] [Root.Spouse.GetFirstName] è [Root.GetLordSpiritualName] [Root.job_spiritual.GetFullName] äàäóò ìíå ïàðó ñîâåòîâ î òîì, êàê çàâîåâàòü ðàñïîëîæåíèå ýòèõ ëþäåé.;;x
EVTDESC30061;My sweet [Root.Spouse.GetFirstName] is terrifying when she wants something, there is nothing she wouldn't do to make me bend to her will. Now she wants me to make one of her friends [Root.GetMyChancellorName], but [Root.GetMyChancellorName] [Root.job_chancellor.GetFullName] is a very competent man...;;;;;;;;;;;Ìîÿ äîðîãàÿ [Root.Spouse.GetFirstName] ïðîñòî óæàñàþùà, êîãäà îíà õî÷åò ÷åãî-ëèáî, è íå ñóùåñòâóåò òîãî, ÷åãî áû îíà íå ñäåëàëà â ïîïûòêå äîáèòüñÿ ñâîåãî. Ñåé÷àñ îíà õî÷åò ââåñòè å¸ äðóãà â ñîâåò, íî [Root.GetMyChancellorName] [Root.job_chancellor.GetFullName] î÷åíü êîìïåòåíòíûé ÷åëîâåê...;;x
EVTDESC30064;No matter how many times I try to point out the virtues of Marshal [Root.job_marshal.GetFullName], my wife [Root.Spouse.GetFirstName] won't listen. She cannot take no for an answer, not when she has decided that her friend should be Marshal.;;;;;;;;;;;"Íåñìîòðÿ íà ìîè çàìå÷àíèÿ î òîì, ÷òî [Root.GetMarshalName] [Root.job_marshal.GetFullName] - äîñòîéíûé êàíäèäàò, ìîÿ ñóïðóãà [Root.Spouse.GetFirstName] èõ íå ñëûøèò. Ðåøèâ, ÷òî å¸ ëþáèì÷èê - ëó÷øèé [Root.GetMarshalName], îíà íå æåëàåò ïðèíÿòü îòâåò ""íåò"".";;x
EVTDESC30067;[Root.Spouse.GetFirstName] is adamant, she tries to make me appoint one of her male friends, who might mean more to her than I earlier suspected, Steward. No matter how well our current Steward [Root.job_treasurer.GetFullName] does his job I need to decide whether I should make [Root.Spouse.GetFirstName] happy by or if the current Steward will get to keep his job.;;;;;;;;;;;"[Root.Spouse.GetFirstName] íåïðèìèðèìà. Îíà ïûòàåòñÿ îáÿçàòü ìåíÿ íàçíà÷èòü íà äîëæíîñòü ""[Root.GetTreasurerName]"" îäíîãî èç å¸ äðóçåé, êîòîðûé âèäèìî çíà÷èò äëÿ íå¸ áîëüøå, ÷åì ÿ ðàíåå ïîëàãàë. Êàê áû íè áûë êîìïåòåíòåí íûíåøíèé [Root.GetTreasurerName] [Root.job_treasurer.GetFullName], íàäî ðåøèòü: äîñòàâèòü ëè [Root.Spouse.GetHerHim] óäîâîëüñòâèå ëèáî íûíåøíèé [Root.GetTreasurerName] ñîõðàíèò ñâîþ äîëæíîñòü.";;x
EVTDESC30070;I cannot get any rest from [Root.Spouse.GetFirstName] pestering me about making her good friend Spymaster. She does not care that our Spymaster [Root.job_spymaster.GetFullName] is competent, skilled and a great Spymaster.;;;;;;;;;;;[Root.Spouse.GetFirstName] ïîñòîÿííî áåñïîêîèò ìåíÿ, íàñòàèâàÿ, ÷òîáû ÿ íàçíà÷èë òàéíûì ñîâåòíèêîì å¸ õîðîøåãî äðóãà. Å¸ íå çàáîòèò, ÷òî íàø òàéíûé ñîâåòíèê [Root.job_spymaster.GetFullName] ñâåäóù, îïûòåí è âîîáùå - âåëèêèé øïèîí.;;x
EVTDESC30073;I have noticed [Root.Spouse.GetFirstName]'s affection for one of the courtiers and heard her praise his [Player.Religion.GetPietyName], so it did not surprise me when she approached me and tried to convince me to appoint him as [Root.GetLordSpiritualName]. Trouble is, [Root.job_spiritual.GetFullName] is well respected and many would disapprove if I were to fulfill [Root.Spouse.GetFirstName]'s wish.;;;;;;;;;;;ß çàìåòèë[Root.GetEndA], êàê ì[Root.Spouse.GetOyaOy] [Root.Spouse.GetHusbandWife] [Root.Spouse.GetFirstName] ñìîòðèò íà îäí[Root.Spouse.GetUOgoOpp] èç ïðèäâîðíûõ, êàê [Root.Spouse.GetSheHe] âîñõâàëÿåò [Root.Spouse.GetHersHisOpp] áëàãî÷åñòèå è íå óäèâè[Root.GetLasLsya], êîãäà [Root.Spouse.GetSheHe] ïîäîøëà êî ìíå, ÷òîáû ñêàçàòü, ÷òî [Root.GetLordSpiritualName] - ñàìàÿ ïîäõîäÿùàÿ äîëæíîñòü äëÿ [Root.Spouse.GetHersHis] äðóãà. Íî [Root.job_spiritual.GetFullName] õîðîøî ñïðàâëÿåòñÿ, è ìíîãèå íå îäîáðÿò, åñëè ÿ ïîéäó ó í[Root.Spouse.GetHersHis] íà ïîâîäó.;;x
EVTDESC30075;My husband [Root.Spouse.GetFirstName] and I long for children, but despite our best efforts and the time we spend together in the bedchamber I have failed to conceive. The suspicion of being barren makes me seek consolation in another man's arms.;;;;;;;;;;;Ìîé ìóæ [Root.Spouse.GetFirstName] è ÿ äàâíî õîòèì çàâåñòè äåòåé, íî íåñìîòðÿ íà íàøè óñèëèÿ è êîëè÷åñòâî âðåìåíè ïðîâåä¸ííîãî â îïî÷èâàëüíå, ÿ òàê è íå ñìîãëà çàáåðåìåíåòü. Ïîäîçðåíèå î áåñïëîäèè çàñòàâëÿåò ìåíÿ èñêàòü óòåøåíèå â ðóêàõ äðóãîãî ìóæ÷èíû.;;x
EVTDESC30076;The pregnancy is starting to show and my husband [Root.Spouse.GetFirstName]'s happiness shows no bounds. I should be happy as well, but in my heart I know my husband [Root.Spouse.GetFirstName] isn't the father of my child.;;;;;;;;;;;Áåðåìåííîñòü ñòàíîâèòñÿ çàìåòíîé, è ðàäîñòè ìîåãî ìóæà íåò ïðåäåëà. ß äîëæíà áûòü òîæå ñ÷àñòëèâà, îäíàêî óâåðåíà, ÷òî ìîé ìóæ [Root.Spouse.GetFirstName] - íå îòåö ðåá¸íêà.;;x
EVTDESC30077;My happiness when my wife [Root.Spouse.GetFirstName] told me I was about to be a father made me almost blind to her feelings, she smiled and seemed happy but something was amiss...;;;;;;;;;;;Êîãäà ìîÿ æåíà [Root.Spouse.GetFirstName] ñêàçàëà ìíå, ÷òî ÿ ñêîðî áóäó îòöîì, ñ÷àñòüå åäâà íå îñëåïèëî ìåíÿ. Îäíàêî, ïðèñìîòðåâøèñü òùàòåëüíåå ê å¸ ýìîöèÿì, ÿ ïî÷óâñòâîâàë ÷òî-òî íåëàäíîå…;;x
EVTDESC30078;The bigger her belly gets, the thinner and more heavy-hearted my wife [Root.Spouse.GetFirstName] seems. Her appearance made me worry and I finally asked her what was wrong. It was as if [Root.Spouse.GetFirstName] had just waited to tell me about her indiscretion with the courtier and her belief that it is the courtier who is the father of the child she carries.;;;;;;;;;;;×åì áîëüøå å¸ æèâîò, òåì áîëåå òóñêëîé è óãíåò¸ííîé âûãëÿäèò ìîÿ æåíà [Root.Spouse.GetFirstName]. Å¸ âèä çàñòàâëÿë ìåíÿ áåñïîêîèòüñÿ, è íàêîíåö, ÿ ñïðîñèë å¸, ÷òî æå íå òàê? Âñ¸ áûëî òàê, êàê áóäòî [Root.Spouse.GetFirstName] òîëüêî è æäàëà, ÷òîáû ïîâåäàòü ìíå î å¸ íåîñìîòðèòåëüíîì ïîñòóïêå ñ ïðèäâîðíûì, êîòîðûé è ÿâëÿåòñÿ íàñòîÿùèì îòöîì ðåá¸íêà.;;x
EVTDESC30079;The look on my pregnant wife's face whenever she sees one of the male courtiers has made me suspicious. It is a weird mixture of guilt, gratefulness and a warning of some sorts. I confronted my wife and, after awhile, she confessed to having had an affair with the courtier but blamed him for seducing her and impregnating her.;;;;;;;;;;;Âçãëÿä ìîåé áåðåìåííîé æåíû, êàæäûé ðàç, êîãäà îíà âèäèò îäíîãî èç ïðèäâîðíûõ, âûçûâàåò âî ìíå ïîäîçðåíèÿ. Ýòî ñòðàííàÿ ïîìåñü âèíû, ïðèçíàòåëüíîñòè è íå÷òî âðîäå ïðåäîñòåðåæåíèÿ. ß çàâ¸ë ðàçãîâîð ëèöîì ê ëèöó ñ ìîåé æåíîé, è ïîñëå íåäîëãîãî ñîïðîòèâëåíèÿ, îíà ñîçíàëàñü, ÷òî èìåëà ñâÿçü ñ ïðèäâîðíûì, îäíàêî çàÿâèëà, ÷òî ýòî ïðèäâîðíûé å¸ ñîáëàçíèë è îïîðî÷èë.;;x
EVTDESC30080;I need to set an example with the courtier who impregnated my wife. I could throw him into prison, execute him or banish him, making sure no one will ever dare touch my wife again!;;;;;;;;;;;ß äîëæåí çàäàòü óðîê ýòîìó ïðèäâîðíîìó, êîòîðûé îïîðî÷èë ìîþ æåíó. ß ìîãó êèíóòü åãî â òåìíèöó, êàçíèòü èëè èçãíàòü åãî, ñäåëàâ òàê, ÷òîáû íèêòî è íèêîãäà áîëåå íå ñìåë ïðèêàñàòüñÿ ê ìîåé æåíå!;;x
EVTDESC30081;The child my wife [Root.Spouse.GetFirstName] carry is not mine. The pain of her betrayal is still fresh in my mind, I will punish her in the same way I will punish the courtier who impregnated her and made her an adulteress.;;;;;;;;;;;Ðåá¸íîê, êîòîðîãî ìîÿ æåíà, [Root.Spouse.GetFirstName], âûíàøèâàåò - íå ìîé. Áîëü îò å¸ ïðåäàòåëüñòâà âñ¸ åù¸ ñâåæà, ÿ íàêàæó å¸ òåì æå ñïîñîáîì ÷òî è ïðèäâîðíîãî, êîòîðûé òîëêíóë å¸ íà ïðåëþáîäåÿíèå è îñêâåðíèë.;;x
EVTDESC30085;My lovely young wife [Root.Spouse.GetFirstName] has expressed her boredom several times, in several ingenious ways. The court is boring, hunting is boring, embroidery is boring, her ladies-in-waiting are boring and she wants me to 'make the boredom go away'.;;;;;;;;;;;"Ìîÿ ïðåêðàñíàÿ ìîëîäàÿ æåíà [Root.Spouse.GetFirstName] íåñêîëüêî ðàç æàëîâàëàñü íà ñêóêó, ïðè÷¸ì, äîâîëüíî èçîáðåòàòåëüíî. Äâîð - óíûë, îõîòà - ñêó÷íà, âûøèâàíèå - íåâûíîñèìî, å¸ ïðèäâîðíûå äàìû - çàíóäíû è îíà õî÷åò ÷òîáû ÿ ""ðàçâåÿë ñêóêó"".";;x
EVTDESC30086;My boring old husband [Root.Spouse.GetFirstName] told me his obligations is more important than my well-being! He might be right though, I should probably try to find a friend among the courtiers.;;;;;;;;;;;Ìîé ñêó÷íûé ñòàðûé ìóæ [Root.Spouse.GetFirstName] ñêàçàë, ÷òî åãî íåîòëîæíûå äåëà âàæíåå ìîåãî ñàìî÷óâñòâèÿ! Âîçìîæíî, îí ïðàâ, âîçìîæíî, ìíå ñòîèò íàéòè äðóçåé ñðåäè ïðèäâîðíûõ.;;x
EVTDESC30088;[target_courtier.GetBestName] and I agreed to do something together the next morning, so I am currently planning what we should do.;;;;;;;;;;;[From.GetBestName] è ÿ äîãîâîðèëèñü ïîäåëàòü ÷òî-íèáóäü íàêàíóíå óòðîì, è ÿ ïëàíèðóþ, ÷åì áû íàì âìåñòå çàíÿòüñÿ.;;x
EVTDESC30089;Despite the threatening clouds in the sky we started walking to the lake.;;;;;;;;;;;Íåñìîòðÿ íà õìóðûå òó÷è â íåáå ìû îòïðàâèëèñü ê îçåðó.;;x
EVTDESC30090;The cook had packed a perfect picnic, with some roast lamb, bread, cheese and wine.;;;;;;;;;;;Ïîâàð ïîñòàðàëñÿ íà ñëàâó äëÿ ïèêíèêà: áûëè æàðåíûå ÿãíÿòà, õëåá, ñûð è âèíî.;;x
EVTDESC30091;The dogs were excited, the horses willing and the day had barely begun. My friend and I set out to hunt some serious game.;;;;;;;;;;;Ñîáàêè áûëè âîçáóæäåíû, ëîøàäè - ðâàëèñü âïåð¸ä, à äåíü òîëüêî íà÷èíàëñÿ. ß è ìîé äðóã îòïðàâèëèñü îõîòèòüñÿ íà êðóïíóþ äè÷ü.;;x
EVTDESC30092;I was just making the last arrangements to the dinner table when my guest arrived. We would not go starving from this table!;;;;;;;;;;;ß êàê ðàç çàâåðøàë ïðèãîòîâëåíèÿ ê ñòîëó, êîãäà ïðèáûëè ãîñòè. Ñ òàêèì ñòîëîì íàì òî÷íî ãîëîäàòü íå ïðèä¸òñÿ!;;x
EVTDESC30095;[From.GetBestName] has avoided me for some time now, probably because we do not have anything in common.;;;;;;;;;;;[From.GetBestName] èçáåãàåò ìåíÿ óæå íåêîòîðîå âðåìÿ âîçìîæíî ïîòîìó, ÷òî ó íàñ íè÷åãî îáùåãî íåò.;;x
EVTDESC30096;We fit together, [From.GetBestName] and I. No matter what we do together, we always have a good time and we can talk for hours without getting bored with each other.;;;;;;;;;;;Ìû äðóã äðóãó ïîäõîäèì, [From.GetBestName] è ÿ. Íåâàæíî, ÷åì ìû çàíÿòû, íàì âñåãäà âåñåëî. Ìû ìîæåì ãîâîðèòü ÷àñàìè, íå óñòàâàÿ äðóã îò äðóãà.;;x
EVTDESC30100;The attraction between me and my husband [Root.Spouse.GetFirstName] has slowly started to fade. I realized this had been happening for some time when we week after week used the bedchamber to sleep in instead of having all the fun we used to have there.;;;;;;;;;;;Ìîé ìóæ [Root.Spouse.GetFirstName] è ÿ ñòàëè îõëàäåâàòü äðóã ê äðóãó. ß ïîíÿëà, ÷òî ýòî ïðîèçîøëî ïîñëå òîãî, êàê íåäåëÿ çà íåäåëåé íàøà ñïàëüíÿ áûëà ìåñòîì íàøåãî ñíà, à íå òåõ ñëàäîñòðàñòíûõ óòåõ, êîèì ìû ïðåäàâàëèñü ðàíüøå.;;x
EVTDESC30101;The passion between [Root.Spouse.GetFirstName] and myself was still there, only slumbering beneath our skins, and easily reawakened by a lover's touch. It was hot, fierce, wonderful lovemaking such as we used to have.;;;;;;;;;;;Îêàçàëîñü, íàøè ñ [Root.Spouse.GetHusbandWifeINS] ÷óâñòâà âîâñå íå óãàñëè, îíè äðåìàëè ãäå-òî ãëóáîêî âíóòðè è ìîìåíòàëüíî ïðîáóäèëèñü îò ë¸ãêèõ ïðèêîñíîâåíèé. Ìû ïðîâåëè íåçàáûâàåìóþ íî÷ü â ïîðûâå æàðêîé è áåçóäåæíîé ñòðàñòè.;;x
EVTDESC30102;Sweetly, gently we molded our bodies together and re-created the familiar feel of us embracing, touching, loving...;;;;;;;;;;;Ñëàäêî è íåæíî ìû ñïëåëèñü òåëàìè, ïðîáóæäàÿ â ïàìÿòè ïåðâûå ïîöåëóé è îáúÿòèÿ... êàê æå òÿæåëî äàëàñü ìíå çàñòåæêà å¸ ëèô÷èêà.;;x
EVTDESC30103;The wild ride which showed [Root.Spouse.GetFirstName] who was the boss in the bedchamber killed him. He died with a smile on his lips, so maybe this was the perfect way of leaving this world.;;;;;;;;;;;"Ýòà ""äèêàÿ ñêà÷êà"", ïîõîæå, îêàçàëàñü ÷ðåçìåðíîé. Êîãäà ÿ ïîêàçàëà ñâîåìó ìóæó, êòî ãëàâíûé â ïîñòåëè, ýòî óáèëî åãî. Îí ñêîí÷àëñÿ ñ óëûáêîé íà ãóáàõ, òàê ÷òî âîçìîæíî ýòî áûëî ëó÷øèì ñïîñîáîì óéòè èç ýòîãî ìèðà.";;x
EVTDESC30104;I wanted to show [Root.Spouse.GetFirstName] the passion between us had never died out, but even the sweetest, gentlest lovemaking was too passionate for his heart.;;;;;;;;;;;ß õîòåëà ïîêàçàòü ìîåìó ìóæó, ÷òî ñòðàñòü ìåæäó íàìè äî ñèõ ïîð æèâà, íî äàæå ñàìûå íåæíûå å¸ ïðîÿâëåíèÿ áûëè ÷åðåc÷óð... ñòðàñòíû äëÿ åãî ñåðäöà.;;x
EVTDESC30105;I suspect that my husband [Root.Spouse.GetFirstName] is unable to sire children. If my husband is infertile, then maybe I need to find someone who is!;;;;;;;;;;;ß ïîäîçðåâàþ, ÷òî ìîé ìóæ [Root.Spouse.GetFirstName] íå ìîæåò èìåòü äåòåé. Åñëè îí áåñïëîäåí, òî, âîçìîæíî, ìíå íàäî íàéòè êîãî-òî åù¸...;;x
EVTOPTA30000;Separate bedchambers? Sure!;;;;;;;;;;;Ñïàòü ðàçäåëüíî? Êîíå÷íî!;;x
EVTOPTA30001;I don't ever want to see you again!;;;;;;;;;;;ß íèêîãäà áîëüøå íå õî÷ó òåáÿ âèäåòü!;;x
EVTOPTA30002;O holy father, help me!;;;;;;;;;;;Áîæå, ïîìîãè ìíå!;;x
EVTOPTA30003;Fine!;;;;;;;;;;;Õîðîøî!;;x
EVTOPTA30004;By poison!;;;;;;;;;;;ßäîì!;;x
EVTOPTA30005;Imprison her!;;;;;;;;;;;Ïîñàäèòü [Root.Spouse.GetHersHis] â òþðüìó!;;x
EVTOPTA30006;No one will believe him!;;;;;;;;;;;Íèêòî íå ïîâåðèò åìó!;;x
EVTOPTA30007;Remove her from my sight!;;;;;;;;;;;Óáåðèòå [Root.Spouse.GetHersHis] ñ ìîèõ ãëàç äîëîé!;;x
EVTOPTA30009;This is not how it should end!;;;;;;;;;;;Âñå íå òàê, êàê äîëæíî áûëî áûòü!;;x
EVTOPTA30010;I knew I would get away with it;;;;;;;;;;;ß çíàë[Root.GetEndA], ÷òî ìíå âñ¸ ñîéä¸ò ñ ðóê.;;x
EVTOPTA30011;Then she will spend the rest of her life imprisoned!;;;;;;;;;;;[Root.Spouse.GetSheHeCap] ïðîâåä¸ò âñþ æèçíü â òåìíèöå.;;x
EVTOPTA30020;May she rot in the Dungeon!;;;;;;;;;;;Ïóñòü [Root.Spouse.GetSheHe] ãíè¸ò â òåìíèöå!;;x
EVTOPTA30021;To the dungeon with [Root.Spouse.GetHerHim]!;;;;;;;;;;;Â òåìíèöó [Root.Spouse.GetHersHis]!;;x
EVTOPTA30025;Mayhap I read too much into this, surely [Root.Spouse.GetFirstName] loves me!;;;;;;;;;;;Áûòü ìîæåò, ÿ çàãëÿäûâàþ ñëèøêîì äàëåêî, íî ìíå êàæåòñÿ, ÷òî [Root.Spouse.GetFirstName] ëþáèò ìåíÿ!;;x
EVTOPTA30026;[Root.Spouse.GetFirstName], what have you done?;;;;;;;;;;;[Root.Spouse.GetFirstName], ÷òî Âû íàäåëàëè?;;x
EVTOPTA30027;I will show you that no one matters as much to me as you do!;;;;;;;;;;;ß äîêàæó Âàì, êàê ìíîãî Âû çíà÷èòå äëÿ ìåíÿ! Áîëüøå ÷åì âñå îñòàëüíûå!;;x
EVTOPTA30028;[From.GetFirstName] promised to pay me more attention!;;;;;;;;;;;[From.GetFirstName] îáåùàåò îêàçûâàòü ìíå áîëüøå âíèìàíèÿ!;;x
EVTOPTA30029;I don't know if [From.GetHerHim] will ever forgive me...;;;;;;;;;;;ß íå çíàþ, ÷òî áóäó äåëàòü, åñëè [From.GetSheHe] íå ïðîñòèò ìåíÿ...;;x
EVTOPTA30030;I do anything I can to make [outside_spouse.GetHerHis] work easier;;;;;;;;;;;ß äåëàþ âñ¸, ÷òîáû îáëåã÷èòü [outside_spouse.GetHersHis] ðàáîòó;;x
EVTOPTA30031;This is not negotiable;;;;;;;;;;;Îá ýòîì íåëüçÿ âåñòè ïåðåãîâîðû.;;x
EVTOPTA30032;I don't think I dare...;;;;;;;;;;;ß íå íàäåþñü, ÿ ðàññ÷èòûâàþ…;;x
EVTOPTA30033;I'll never be able to stop blaming myself;;;;;;;;;;;ß íèêîãäà íå ïåðåñòàíó âèíèòü ñåáÿ çà ýòî.;;x
EVTOPTA30034;I'm so happy I could cry!;;;;;;;;;;;Ñ÷àñòüå ïåðåïîëíÿåò ìåíÿ äî ñë¸ç.;;x
EVTOPTA30035;What a failure!;;;;;;;;;;;Êàêîé ïðîâàë!;;x
EVTOPTA30036;But... Fine;;;;;;;;;;;Íî… ïðîñòî ïðåêðàñíî.;;x
EVTOPTA30037;I have tired of this. Here, have your [prisoner_spouse.GetManWoman] back;;;;;;;;;;;Êàê æå ÿ óñòàë îò ýòîãî. Ëàäíî, çàáèðàéòå [prisoner_spouse.GetManWoman]ó íàçàä;;x
EVTOPTA30040;I'll do my best to ignore [annoying_courtier.GetHerHim] and trust my husbands decision.;;;;;;;;;;;Ïðîñòî ïîñòàðàþñü íå çàìå÷àòü [annoying_courtier.GetHersHis];;x
EVTOPTA30041;My [Root.Spouse.GetFirstName]'s happiness is more important to me;;;;;;;;;;;Ñ÷àñòüå ìîå[Root.Spouse.GetYGo] [Root.Spouse.GetHusbandWifeGEN] âàæíî äëÿ ìåíÿ;;x
EVTOPTA30042;What on earth was she thinking?!;;;;;;;;;;;Î ÷¸ì [Root.Spouse.GetSheHe] äóìàåò!?;;x
EVTOPTA30045;... jokingly push [annoying_courtier.GetHerHim] into the river.;;;;;;;;;;;Îêóíóòü [chosen_courtier.GetHussyInsolentACC] â ðåêó, ïóñòü íåìíîãî îõëàäèò ïûë.;;x
EVTOPTA30046;I'll send gifts to his family;;;;;;;;;;;ß ïîøëþ [chosen_courtier.GetHersHis] ñåìüå íåìíîãî äåíåã;;x
EVTOPTA30047;I'm s-s-sorry... Hahahaha!;;;;;;;;;;;Ìíå æàëü... Õà-õà-õà!;;x
EVTOPTA30050;This bracelet would really bring out the... color in her eyes;;;;;;;;;;;Ýòîò áðàñëåò î÷åíü ïîäîéä¸ò... ïîä öâåò [Root.Spouse.GetHersHis] ãëàç.;;x
EVTOPTA30051;The skewbald one looks a bit old, but sweet!;;;;;;;;;;;Ïåãàÿ âûãëÿäèò íåìíîãî ñòàðîâàòîé, íî ìèëîé;;x
EVTOPTA30052;Will a buzzard do?;;;;;;;;;;;Ïîäîéä¸ò ëè ãðèô?;;x
EVTOPTA30055;... I hope she can save me now!;;;;;;;;;;;...ÿ íàäåþñü îíà ïîìîæåò è ñåé÷àñ!;;x
EVTOPTA30056;I trust my wife more than my gut;;;;;;;;;;;ß äîâåðÿþ æåíå áîëüøå, ÷åì ñâîåìó ïðåä÷óâñòâèþ;;x
EVTOPTA30057;I give up! Honey, please help me!;;;;;;;;;;;ß ñäàþñü! Ãîëóáóøêà, ïîæàëóéñòà, ïîìîãè ìíå!;;x
EVTOPTA30058;My wife [Root.Spouse.GetFirstName] is right, I should pursue the title!;;;;;;;;;;;Æåíà ïðàâà. Ýòîò òèòóë äîëæåí ïðèíàäëåæàòü ìíå!;;x
EVTOPTA30059;[Root.Spouse.GetFirstName] suggests I should offer to rebuild the [Root.Religion.GetHouseOfWorship];;;;;;;;;;;[Root.Spouse.GetFirstName] ïðåäëàãàåò âîññòàíîâèòü èõ öåðêîâü;;x
EVTOPTA30061;I will let her have her way just this once;;;;;;;;;;;ß ñäåëàþ, êàê îíà õî÷åò, íî òîëüêî â ýòîò ðàç;;x
EVTOPTA30064;Enough! Fine, your 'special' friend will be Marshal!;;;;;;;;;;;"Äîâîëüíî! Òåïåðü òâîé ""áëèçêèé"" äðóã - [Root.GetMarshalName]!";;x
EVTOPTA30065;[Root.Spouse.GetFirstName] accepted my friend as Marshal!;;;;;;;;;;;"[Root.Spouse.GetFirstName] óòâåðäèë ìîåãî äðóãà íà äîëæíîñòü ""[Root.Spouse.GetMarshalName]""!";;x
EVTOPTA30067;[Root.Spouse.GetFirstName]'s happiness is important to me;;;;;;;;;;;Äîñòàâèòü ñ÷àñòüå [Root.Spouse.GetFirstName] âàæíî äëÿ ìåíÿ;;x
EVTOPTA30070;Stop pestering me and I'll make your friend Spymaster;;;;;;;;;;; Ïðåêðàòè ïðèñòàâàòü êî ìíå è ÿ ñäåëàþ òâîåãî ïðîòåæå òàéíûì ñîâåòíèêîì;;x
EVTOPTA30073;I will make [Root.Spouse.GetFirstName]'s friend [Root.GetLordSpiritualName];;;;;;;;;;;Ïîéäó [Root.Spouse.GetHerHim] íàâñòðå÷ó. Íàäåþñü, [Root.Spouse.GetHersHis] äðóã òîãî ñòîèò.;;x
EVTOPTA30075;The consolation came with a price - I'm pregnant!;;;;;;;;;;;Óòåøåíèå ÿâèëîñü ïîä ðóêó ñ ðàñïëàòîé - ÿ áåðåìåííà!;;x
EVTOPTA30076;My husband [Root.Spouse.GetFirstName] will never know the truth!;;;;;;;;;;;Ìîé ìóæ [Root.Spouse.GetFirstName] íèêîãäà íå óçíàåò ïðàâäó!;;x
EVTOPTA30077;Maybe it's nothing...;;;;;;;;;;;Âîçìîæíî, ÷òî è íè÷åãî...;;x
EVTOPTA30078;This child is ours, no matter who fathered it;;;;;;;;;;;Ýòî íàø ðåá¸íîê, íå âàæíî, êòî åãî íàñòîÿùèé îòåö;;x
EVTOPTA30080;Imprison the adulterer!;;;;;;;;;;;Çàêëþ÷èòü â òþðüìó çà ïðåëþáîäåÿíèå!;;x
EVTOPTA30081;Imprison the adulterer and the adulteress!;;;;;;;;;;;Çàêëþ÷èòü èõ îáîèõ!;;x
EVTOPTA30085;Fine, I'll humor you;;;;;;;;;;;Çàìå÷àòåëüíî, ÿ ðàçâåñåëþ òåáÿ;;x
EVTOPTA30086;Please be my friend!;;;;;;;;;;;Ïîæàëóéñòà, áóäü ìîèì äðóãîì!;;x
