#CODE;ENGLISH;;;;;;;;;;;RUSSIAN;;x
# EVTDESC30110;The imams are not always easy to deal with. I need to make sure I have their approval and I have both my wife [Root.Spouse.GetFirstName] and my [Root.GetMyLordSpiritualName] [Root.job_spiritual.GetFullName] giving me advice on how to earn the imam's approval.;;;;;;;;;;;Ñ èìàìàìè íå âñåãäà ëåãêî èìåòü äåëî. Ìíå íóæíî óáåäèòüñÿ, ÷òî ÿ ñìîã[Root.GetNoneE] çàðó÷èòüñÿ èõ îäîáðåíèåì. Ì[Root.Spouse.GetOyaOy] [Root.Spouse.GetHusbandWife] [Root.Spouse.GetFirstName] è [Root.GetMyLordSpiritualName] [Root.job_spiritual.GetFullName] äàþò ìíå ñîâåòû, êàê çàðó÷èòüñÿ ïîääåðæêîé èìàìîâ.;;x
# EVTOPTA30110;[Root.Spouse.GetFirstName] suggests I should offer to rebuild the mosque;;;;;;;;;;;[Root.Spouse.GetFirstName] ñ÷èòàåò, ÷òî ÿ äîëæ[Root.GetNaEn] ïðåäëîæèòü âîññòàíîâèòü ìå÷åòü;;x
# EVTOPTB30110;[Root.job_spiritual.GetFullName] suggests I try to scare the imams into submission;;;;;;;;;;;[Root.job_spiritual.GetFullName] ïðåäëàãàåò ìíå ïîïûòàòüñÿ ïðèâåñòè èìàìîâ â ïîâèíîâåíèå;;x
# EVTDESC30060;[Root.Spouse.job_chancellor.GetFullName] is doing a somewhat good job as a [Root.GetMyChancellorName] but there is a contender for the title, one of my special male friends. I am slowly but stubbornly trying to make [Root.Spouse.GetFirstName] realize the potential of my friend, and now I am prepared to use the final and best argument to make him do as I want.;;;;;;;;;;;[Root.Spouse.job_chancellor.GetFullName] íåïëîõî ñïðàâëÿåòñÿ, êàê [Root.GetMyChancellorName], íî åñòü åù¸ îäèí ïðåòåíäåíò íà ýòîò òèòóë, îäèí èç ìîèõ ëþáîâíèêîâ. ß ïîñòåïåííî, íî íàñòîé÷èâî ïûòàþñü ñäåëàòü òàê, ÷òîáû [Root.Spouse.GetFirstName] îñîçíàë ïîòåíöèàë ìîåãî äðóãà. Ñåé÷àñ ÿ ïðèãîòîâèëà ôèíàëüíûé è ëó÷øèé àðãóìåíò, ÷òîáû îí ïîñòóïèë èìåííî òàê, êàê ÿ õî÷ó.;;x
# EVTDESC30062;When I presented my ultimatum to my husband [Root.Spouse.GetFirstName], trying to make him choose my friend to be the new [Root.GetMyChancellorName], he reacted as I had anticipated. [Root.Spouse.GetFirstName] tried to argue with me, plead with me and even tried to scare me into submission, but I saw in his eyes that he had already made his decision.;;;;;;;;;;;Êîãäà ÿ ïðåäúÿâèëà ñâîé óëüòèìàòóì ñóïðóãó [Root.Spouse.GetFirstName], óòâåðæäàÿ, ÷òî ìîé äðóã - èäåàëüíûé [Root.GetMyChancellorName], îí îòðåàãèðîâàë èìåííî òàê, êàê ÿ è îæèäàëà. [Root.Spouse.GetFirstName] ïûòàëñÿ ñïîðèòü ñî ìíîé, ìîëèë ìåíÿ è äàæå ïûòàëñÿ çàïóãàòü, íî ÿ âèäåëà â åãî ãëàçàõ, ÷òî îí óæå ïðèíÿë îêîí÷àòåëüíîå ðåøåíèå.;;x
# EVTDESC30063;I have a very special male friend who would be an excellent Marshal! Too bad my husband thinks highly of Marshal [Root.Spouse.job_marshal.GetFullName], making it hard for me to convince him of my friend's superiority.;;;;;;;;;;;Ó ìåíÿ åñòü ëþáîâíèê, èç êîòîðîãî âûøåë áû ïðåêðàñíûé [Root.Spouse.GetMarshalName]! Ê ñîæàëåíèþ, [Root.Spouse.job_marshal.GetFullName] ìîåãî ñóïðóãà óñòðàèâàåò ãîðàçäî áîëüøå, ÷òî äåëàåò ñëîæíûì äëÿ ìåíÿ ïîïûòàòüñÿ óáåäèòü åãî â ïðåâîñõîäñòâå ìîåãî äðóãà.;;x
# EVTDESC30065;My husband [Root.Spouse.GetFirstName] and I argued about who should be Marshal, my special friend or the current one. As I made my arguments, threatened to shun [Root.Spouse.GetFirstName] from my bed and stressed my friend superiority over [Root.Spouse.job_marshal.GetFullName], my husband finally took a decision.;;;;;;;;;;;" ß è ìîé ìóæ [Root.Spouse.GetFirstName] ãîðÿ÷î îáñóæäàëè: ïîëó÷èò ëè äîëæíîñòü ""[Root.Spouse.GetMarshalName]"" ìîé áëèçêèé äðóã èëè îñòàíåòñÿ äåéñòâóþùèé. Ïðåäñòàâèâ àðãóìåíòû, ÷òî ìîé ïðîòåæå ïðåâîñõîäèò íûíåøíåãî, è íàìåêíóâ, ÷òî îòêàæó â áëèçîñòè, ìóæ íàêîíåö ïðèíÿë ðåøåíèå.";;x
# EVTDESC30066;I have tried to make my husband [Root.Spouse.GetFirstName] discharge his Steward [Root.Spouse.job_treasurer.GetFullName] in favour of my close friend whom I cannot deny anything. The stubbornness of my husband is convincing me I need to do something drastic in order for him to listen to me.;;;;;;;;;;;ß ïûòàëàñü óáåäèòü ñâîåãî ìóæà ïî èìåíè [Root.Spouse.GetFirstName], ÷òî [Root.GetTreasurerName] [Root.Spouse.job_treasurer.GetFullName] äîëæåí óñòóïèòü ñâîé ïîñò ìîåìó áëèçêîìó äðóãó. Óïðÿìñòâî ìîåãî ñóïðóãà çàñòàâëÿåò ìåíÿ ïðèíÿòü ðàäèêàëüíûå ìåðû, ÷òîáû îí óäîâëåòâîðèë ìîþ ïðîñüáó.;;x
# EVTDESC30068;I am getting tired of fighting for my friend, though I still feel he would make a better Steward than [Root.job_treasurer.GetFullName]. One last effort and whatever my husband [Root.Spouse.GetFirstName] decides, I have to accept that.;;;;;;;;;;;ß óòîìèëàñü ñîäåéñòâîâàòü ñâîåìó äðóãó, íî ïî-ïðåæíåìó ñ÷èòàþ, ÷òî îí - ëó÷øèé [Root.GetTreasurerName], ÷åì [Root.job_treasurer.GetFullName]. Ïîñëåäíåå óñèëèå è ÿ ïðèìó òî, ÷òî ðåøèò ìîé ñóïðóã [Root.Spouse.GetFirstName].;;x
# EVTDESC30069;I couldn't care less if our current Spymaster [Root.Spouse.job_spymaster.GetFullName] is competent as a Spymaster or not, my very good friend would truly overtrumph [Root.Spouse.job_spymaster.GetHerHim] as Spymaster! I only have to convince my husband [Root.Spouse.GetFirstName] to discharge [Root.Spouse.job_spymaster.GetFullName] and then appoint my friend.;;;;;;;;;;;Ìíå ïëåâàòü, êîìïåòåíòåí èëè íåò íûíåøíèé [Root.GetSpymasterName] [Root.Spouse.job_spymaster.GetFullName]. Ìîé î÷åíü õîðîøèé äðóã ïðåâçîø¸ë áû [Root.Spouse.job_spymaster.GetHerHim] íà ýòîì ïîñòó ðàçóìååòñÿ! ß òîëüêî äîëæíà óáåäèòü ñâîåãî ñóïðóãà [Root.Spouse.GetFirstName] ñìåñòèòü [Root.Spouse.job_spymaster.GetFullName] è íàçíà÷èòü ìîåãî ïðîòåæå.;;x
# EVTDESC30071;My husband [Root.Spouse.GetFirstName] asked me to give him a couple of days to think about this, he promised me a decision if only I stopped pestering him. I could hardly restrain myself and waited impatiently until my husband declared that he had made a decision.;;;;;;;;;;;Ìîé ñóïðóã [Root.Spouse.GetFirstName] ïðîñèë ìåíÿ î íåñêîëüêèõ äíÿõ íà ðàçìûøëåíèå è ïîîáåùàë ïðèíÿòü ðåøåíèå, ëèøü áû ÿ ïðåêðàòèëà êàïàòü åìó íà ìîçãè. Ìíå òÿæåëî ñäåðæèâàòü ñåáÿ, ÿ âñÿ â íåòåðïåíèè, êîãäà æå ìóæ îáúÿâèò î ïðèíÿòèè ðåøåíèÿ.;;x
# EVTDESC30072;The friendship between me and a male courtier is very special, but I fear I might lose him if I cannot find a way to make my husband [Root.Spouse.GetFirstName] get rid of the old [Root.GetLordSpiritualName] [Root.Spouse.job_spiritual.GetFullName] and appoint my friend as [Root.GetLordSpiritualName] in his stead.;;;;;;;;;;;Äðóæáà ìåæäó ìíîé è ïðèäâîðí[Root.GetOyYmOpp] îñîáåííàÿ. Îäíàêî, ÿ áîþñü ÷òî ïîòåðÿþ å¸, åñëè íå ñìîãó íàéòè ñïîñîá, ÷òîáû ì[Root.Spouse.GetOyaOy] [Root.Spouse.GetHusbandWife] [Root.Spouse.GetFirstName] ñäåëàë[Root.Spouse.GetEndA] òàê, ÷òîáû [Root.GetLordSpiritualName] [Root.Spouse.job_spiritual.GetFullName] ïîêèíóë[Root.Spouse.job_spiritual.GetEndA] ñâîé ïîñò, à ì[Root.GetOyaOyOpp] [Root.GetFriendMFOpp] çàíÿë[Root.GetEndAOpp] âàêàíòíóþ äîëæíîñòü.;;x
# EVTDESC30074;I know [Root.GetLordSpiritualName] [Root.Spouse.job_spiritual.GetFullName] is well respected, many would disapprove and reproach my husband [Root.Spouse.GetFullName] if he chooses to appoint my friend as the [Root.GetLordSpiritualName], but I don't care. I need a friend at court!;;;;;;;;;;;ß çíàþ, ÷òî [Root.GetLordSpiritualName] [Root.Spouse.job_spiritual.GetFullName] î÷åíü óâàæàåì[Root.Spouse.job_spiritual.GetEndA] è ìíîãèå íå ïîéìóò, åñëè ì[Root.Spouse.GetOyaOy] [Root.Spouse.GetHusbandWife] [Root.Spouse.GetFullName], âñ¸-òàêè ðåøèò, ÷òî èç ìîåãî äðóãà âûéäåò òîëêîâûé [Root.GetLordSpiritualName], íî ìíå ïëåâàòü. ß íå ìîãó ïîòåðÿòü äðóãà!;;x
# EVTOPTA30060;Do as I want or else...;;;;;;;;;;;Ñäåëàé êàê ÿ õî÷ó, à íå òî…;;x
# EVTOPTA30062;[Root.Spouse.GetFirstName] agreed to make my friend [Root.GetMyChancellorName]!;;;;;;;;;;;[Root.Spouse.GetFirstName] ñîãëàñèëñÿ, ÷òî ìîé äðóã ëó÷øèé [Root.GetMyChancellorName]!;;x
# EVTOPTA30063;I will keep arguing until [Root.Spouse.GetFirstName] agrees with me!;;;;;;;;;;;ß áóäó ñïîðèòü ïîêà [Root.Spouse.GetFirstName] íå ñîãëàñèòñÿ ñî ìíîé!;;x
# EVTOPTA30066;It's now or never!;;;;;;;;;;;Ñåé÷àñ èëè íèêîãäà!;;x
# EVTOPTA30068;My friend has been appointed Steward!;;;;;;;;;;;Ìîé ïðîòåæå òåïåðü [Root.GetTreasurerName]!;;x
# EVTOPTA30069;That should be easy!;;;;;;;;;;;Ýòîãî ëåãêî äîáèòüñÿ!;;x
# EVTOPTA30071;He will make my friend Spymaster!;;;;;;;;;;;Îí ñîáèðàåòñÿ íàçíà÷èòü ìîåãî ïðîòåæå òàéíûì ñîâåòíèêîì!;;x
# EVTOPTA30072;[Root.Spouse.GetFirstName] must listen to me, if only this once!;;;;;;;;;;;[Root.Spouse.GetFirstName] äîëæåí ïðèñëóøàòüñÿ êî ìíå, ïî êðàéíåé ìåðå ýòîò ðàç!;;x
# EVTOPTA30074;Joyous news! My friend is [Root.GetLordSpiritualName]!;;;;;;;;;;;Ðàäîñòíûå âåñòè! Ì[Root.GetOyaOyOpp] [Root.GetFriendMFOpp] - [Root.GetLordSpiritualName]!;;x
# EVTOPTB30062;[Root.Spouse.GetFirstName] refused to make my friend Chancellor!;;;;;;;;;;;[Root.Spouse.GetFirstName] íå ñîãëàñåí, ÷òî ìîé äðóã ëó÷øèé [Root.GetMyChancellorName]!;;x
# EVTOPTB30065;[Root.Spouse.GetFirstName] told me he would never make my friend Marshal!;;;;;;;;;;;"[Root.Spouse.GetFirstName] âûñêàçàë, ÷òî íèêîãäà íå ïîñòàâèò ìîåãî ïðîòåæå íà äîëæíîñòü ""[Root.Spouse.GetMarshalName]"".";;x
# EVTOPTB30068;My husband decided to keep the current Steward...;;;;;;;;;;;Ìîé áëàãîâåðíûé ïîääåðæàë íûíåøíåãî ñîâåòíèêà.;;x
# EVTOPTB30071;He decided to keep the old Spymaster;;;;;;;;;;;Îí ðåøèë ñîõðàíèòü äîëæíîñòü çà íûíåøíèì òàéíûì ñîâåòíèêîì;;x
# EVTOPTB30074;I have to respect [Root.Spouse.GetFirstName]'s decision;;;;;;;;;;;Ìíå ïðèä¸òñÿ óâàæàòü ðåøåíèå [Root.Spouse.GetFirstName];;x
# EVTTOOLTIP30061;[Root.Spouse.GetFirstName] gets the ultimatum;;;;;;;;;;;[Root.Spouse.GetFirstName] ïîëó÷àåò óëüòèìàòóì;;x
# EVTTOOLTIP30064;[Root.Spouse.GetFirstName] makes a decision;;;;;;;;;;;[Root.Spouse.GetFirstName] ïîðà ïðèíÿòü ðåøåíèå;;x
# EVTTOOLTIP30067;[Root.Spouse.GetFirstName] is forced to make a decision;;;;;;;;;;;[Root.Spouse.GetFirstName] âûíóæäåí ïðèíèìàòü ðåøåíèå.;;x
# EVTTOOLTIP30070;[Root.Spouse.GetFirstName] is pestered into making a decision;;;;;;;;;;;[Root.Spouse.GetFirstName] äîêó÷àåò, òðåáóÿ ìîåãî ðåøåíèÿ;;x
# EVTTOOLTIP30073;The future of [Root.GetFirstName]'s friend lies on [Root.Spouse.GetFirstName];;;;;;;;;;;Ñóäüáà ìîåãî äðóãà â ðóêàõ æåíû;;x
