#CODE;ENGLISH;;;;;;;;;;;RUSSIAN;;x
EVTDESC8175;I love the thrill of heights, running on the castle walls and looking down at the little people below. If I reach out, maybe I can reach that bird's nest...;;;;;;;;;;;Ìíå íðàâèòñÿ âîëíóþùåå ÷óâñòâî âûñîòû, êîãäà ÿ ïðîãóëèâàþñü ïî ñòåíàì è ñìîòðþ íà ìàëåíüêèõ ëþäåé âíèçó. Åñëè ÿ ïðîòÿíó ðóêó, ìîæåò áûòü, ÿ ñìîãó äîñòàòü äî ïòè÷üèõ ãí¸çä.;;x
EVTDESC8176;AAAH, someone pushed me! I'm falling! NOOO!;;;;;;;;;;;Aààà, êòî-òî òîëêíóë ìåíÿ! ß ïàäàþ! Íåååò!;;x
EVTDESC8178;He was going to push me! I will find out who bribed him and why!;;;;;;;;;;;Îí ñîáèðàëñÿ òîëêíóòü ìåíÿ! ß óçíàþ, êòî ïîäêóïèë åãî!;;x
EVTDESC8179;Was that scullery maid going to push me off the wall? Who would want me dead?;;;;;;;;;;;Ñîáèðàëàñü ëè êóõàðêà ñòîëêíóòü ìåíÿ ñî ñòåíû? Êòî áû ìîã õîòåòü ìîåé ñìåðòè?;;x
EVTDESC8180;Good news! My co-conspirator, [From.GetTitledName], has let me know that [Root.PlotTarget.GetTitledName] will soon have a tragic fall off the castle parapets...;;;;;;;;;;;Õîðîøèå íîâîñòè! Âàø[From.GetEndA] ñîîáùíè[From.GetTsaK] [From.GetTitledName] ñêàçàë[From.GetEndA], ÷òî [Root.PlotTarget.GetTitledName] ñêîðî óïàä¸ò ñî ñòåíû.;;x
EVTDESC8181;[From.GetTitledName] approves of my scheme to push [From.PlotTarget.GetTitledName] of a wall. May [Root.Religion.GetRandomGodName] forgive me!;;;;;;;;;;;[From.GetTitledName] ñîãëàñè[From.GetLasLsya] ñ Âàøèì ïëàíîì. [From.PlotTarget.GetTitledName] óïàä¸ò ñî ñòåíû. Äà ïðîñòèò Âàñ [Root.Religion.GetHighGodName]!;;x
EVTDESC8182;[From.GetTitledName] has let me know that the plot to kill [From.PlotTarget.GetTitledName] is proceeding well. [From.PlotTarget.GetSubjectPronounCap] will soon fall off the castle walls. Such tragedy!;;;;;;;;;;;[From.GetTitledName] ñîîáùèë[From.GetEndA] Âàì, ÷òî çàãîâîð ñ öåëüþ óáèéñòâà ïðîäâèãàåòñÿ õîðîøî. [From.PlotTarget.GetTitledName] ñêîðî óïàä¸ò ñî ñòåíû. Êàêàÿ òðàãåäèÿ!;;x
EVTDESC8183;Success! [From.GetTitledName] flew off those walls like an ostrich! Unfortunately, the assassin was caught and my complicity was discovered.;;;;;;;;;;;Óñïåõ! [From.GetTitledName] ïîëåòåë[From.GetEndA] ñî ñòåíû âíèç, êàê ñòðàóñ! Ê ñîæàëåíèþ, óáèéöó ïîéìàëè è Âàøå ñîó÷àñòèå áûëî ðàñêðûòî.;;x
EVTDESC8184;Success! It seems little [From.GetTitledName] had not yet learned how to fly. [From.GetSubjectPronounCap] died a quick and presumably painless death.;;;;;;;;;;;Óñïåõ! Êàæåòñÿ, [From.GetTitledName] åù¸ íå óìååò ëåòàòü. Ýòî áûëà áûñòðàÿ è, ïî-âèäèìîìó, áåçáîëåçíåííàÿ ñìåðòü.;;x
EVTDESC8185;Failure! [From.GetTitledName] dodged the assassin and ran off. My complicity was discovered.;;;;;;;;;;;Ïðîâàë! [From.GetTitledName] óâåðíó[From.GetLasLsya] îò óáèéö è ñáåæàë[From.GetEndA]. Ìî¸ ñîó÷àñòèå îáíàðóæåíî.;;x
EVTDESC8186;Failure! The hired assassin did not get a chance to push [From.GetTitledName] off the walls, and will likely not get another. At least the plot remains unknown...;;;;;;;;;;;Ïðîâàë! Ó íà¸ìíîãî óáèéöû íå áûëî äàæå øàíñà è, ñêîðåå âñåãî, íå áóäåò. Ïî êðàéíåé ìåðå, çàãîâîð îñòàëñÿ â òàéíå...;;x
EVTDESC8200;Your shameful backing of a false Pope must end now. The Holy Father has agreed that the throne of [Root.PrimaryTitle.GetName] should pass to me so that the realm can be brought back into the true [From.Religion.GetName] fold. Submit to this demand peacefully or face the consequences. The righteous stand behind me!\n\nSigned,\n[From.GetTitledName];;;;;;;;;;;Âàøà ïîçîðíàÿ ïîääåðæêà ëæåïàïû äîëæíà áûòü ïðåêðàùåíà íåìåäëåííî. Ñâÿòîé Îòåö ñîãëàñåí, ÷òî [Root.PrimaryTitle.GetAdjective]ñêèé ïðåñòîë äîëæåí ïåðåéòè êî ìíå, ÷òî ïîçâîëèò ñòðàíå, èñïîâåäóþùåé [From.GetReligionFullName] âåðíóòüñÿ â ëîíî öåðêâè. Ñîãëàñèòåñü ñ òðåáîâàíèåì ìèðíî èëè ñòîëêí¸òåñü ñ íåæåëàòåëüíûìè ïîñëåäñòâèÿìè. Ïðàâäà çà ìíîé!\nÏîäïèñü:\n [From.GetTitledName];;x
EVTDESC8201;Rather than letting civil war tear the realm apart, [From.GetTitledName] has agreed to relinquish the throne to me. Your valuable support in this conflict will not be forgotten.\n\nSincerely,\n[FromFrom.GetTitledName];;;;;;;;;;;×òîáû íå ïîçâîëèòü ãðàæäàíñêîé âîéíå ðàçîðâàòü ñòðàíó íà ÷àñòè, [From.GetTitledName] ñîãëàñè[From.GetLasLsya] îòðå÷üñÿ îò ïðåñòîëà â ìîþ ïîëüçó. Âàø öåííûé âêëàä â ýòîò êîíôëèêò íå áóäåò çàáûò.\nÑ óâàæåíèåì,\n [FromFrom.GetTitledName];;x
EVTDESC8202;Under pressure from the papally sanctioned Antiking Faction, [From.GetTitledName] has agreed to relinquish the throne.;;;;;;;;;;;Ïîä äàâëåíèåì âëèÿòåëüíîé ïàïñêîé ôðàêöèè, [From.GetTitledName] îòðåê[From.GetLasSya] îò ïðåñòîëà.;;x
EVTDESC8203;Rather than risking civil war tearing the realm apart, I have decided to give in to your demand and relinquish the throne. But this treacherous act of blackmail will not be forgotten...\n\nSigned,\n[From.GetTitledName];;;;;;;;;;;×òîáû èçáàâèòü ñòðàíó îò ìó÷èòåëüíîé ãðàæäàíñêîé âîéíû, ÿ îòðåêàþñü îò ïðåñòîëà. Îäíàêî Âàø áåñ÷åñòíûé øàíòàæ íå áóäåò çàáûò...\nÏîäïèñü:\n [From.GetTitledName];;x
EVTDESC8210;You have shown yourself weak and I speak for all the clans when I say that it is time for you to hand over the bridle to someone more worthy.\n\nSigned,\n[From.GetTitledName];;;;;;;;;;;Âû ïîêàçàëè ñåáÿ íåäîñòîéíûì ÷åëîâåêîì - ýòî ÿ ãîâîðþ îò ëèöà âîæäåé âñåõ êëàíîâ. Ïîðà ïåðåäàòü áðàçäû ïðàâëåíèÿ òîìó, êòî åãî äîñòîèí.\nÑ ÷èñòîé ñîâåñòüþ,\n [From.GetTitledName];;x
EVTDESC8211;The weak Khan has agreed to our demands and have to surrender himself to us.;;;;;;;;;;;Ñëàáûé êàãàí ñîãëàñèëñÿ ñ íàøèìè òðåáîâàíèÿìè è óñòóïèâ íàì, ñäàëñÿ.;;x
EVTDESC8212;A faction led by disgruntled Clan-Chiefs have ended without bloodshed as the previous Khan surrendered.;;;;;;;;;;;Äî êðîâîïðîëèòèÿ äåëî íå äîøëî - ôðàêöèÿ, âåäîìàÿ íåäîâîëüíûìè âîæäÿìè êëàíîâ, ðàñïàëàñü, ïîñêîëüêó ïðåäûäóùèé êàãàí ñäàëñÿ.;;x
EVTDESC8213;I surrender myself to you [Root.GetTitledName] and only beg of you to have mercy upon me and my house...;;;;;;;;;;;Î âåëèêèé, [Root.GetTitledName]! ß ñäàþñü íà òâîþ ìèëîñòü. Óìîëÿþ, ïîùàäè ìåíÿ è ìîèõ ñîðîäè÷åé...;;x
EVTDESC8215;For too long, you have restricted the political influence of your vassals. The time has come to give the [Root.GetCouncilName] more power! Submit to this demand peacefully or face the consequences. Rest assure that I have gathered others who are equally upset...\n\nSigned,\n[From.GetTitledName];;;;;;;;;;;Ñëèøêîì äîëãî Âû îãðàíè÷èâàëè ïîëèòè÷åñêèå ïðàâà ñâîèõ âåðíûõ âàññàëîâ. [Root.GetCouncilName] äîëæåí ïîëó÷èòü áîëüøå ïîëíîìî÷èé, âðåìÿ ïðèøëî! Ñîãëàñèòåñü ñ òðåáîâàíèåì ìèðíî èëè ñòîëêí¸òåñü ñ íåæåëàòåëüíûìè ïîñëåäñòâèÿìè. Áóäüòå óâåðåíû, íà ìîåé ñòîðîíå íåìàëî òåõ, êòî äóìàåò òàê æå...\nÏîäïèñü:\n [From.GetTitledName];;x
EVTDESC8216;Rather than letting civil war tear the realm apart, [From.GetTitledName] has agreed to give the [Root.GetCouncilName] more powers in deciding the policies of the realm. Your valuable support in this matter will not be forgotten.\n\nSincerely,\n[FromFrom.GetTitledName];;;;;;;;;;;×òîáû íå ïîçâîëèòü ãðàæäàíñêîé âîéíå ðàçîðâàòü ñòðàíó íà ÷àñòè, [From.GetTitledName] ñîãëàøàåòñÿ ñ óñëîâèÿìè, ïî êîòîðûì [Root.GetCouncilName] ïîëó÷èò áîëüøå ïîëíîìî÷èé â óïðàâëåíèè ãîñóäàðñòâîì. Âàø öåííûé âêëàä â ýòîò êîíôëèêò íå áóäåò çàáûò.\nÑ óâàæåíèåì,\n [FromFrom.GetTitledName];;x
EVTDESC8217;Under pressure from a powerful Faction, §Y[From.GetTitledName]§! has agreed to increase the power of the [Root.GetCouncilName].;;;;;;;;;;;Ïîä äàâëåíèåì âëèÿòåëüíîé ôðàêöèè, §Y[[From.GetTitledName]§! ïðåäîñòàâëÿåò áîëüøå ïîëíîìî÷èé ñâîåìó ñîâåòó.;;x
EVTDESC8218;Rather than risking civil war tearing the realm apart, I have decided to give in to your demand and give the [Root.GetCouncilName] more powers in deciding the policies of the realm. But this treacherous act of blackmail will not be forgotten...\n\nSigned,\n[From.GetTitledName];;;;;;;;;;;×òîáû èçáàâèòü ñòðàíó îò ãðàæäàíñêîé âîéíû, ÿ óäîâëåòâîðÿþ Âàøó ïðîñüáó - [Root.GetCouncilName] îòíûíå ïîëó÷àåò áîëüøå ïîëíîìî÷èé â ýòîì ãîñóäàðñòâå. Îäíàêî Âàø áåñ÷åñòíûé øàíòàæ íå áóäåò çàáûò...\n\nÏîäïèñü:\n [From.GetTitledName];;x
EVTDESC8220;You are a tyrant and a [GetFromRootInsult]! We will no longer stand idly by as you ignore the Council and the well-being of your subjects. The time has come for you to abdicate in favor of [new_title_holder.GetFullName]! Submit to this demand peacefully or face the consequences.\n\nSigned,\n[From.GetTitledName];;;;;;;;;;;[GetFromRootInsult]! Ìû áîëåå íå íàìåðåíû ñòîÿòü â ñòîðîíå, ïîêà òàêèå òèðàíû, êàê Âû, èãíîðèðóþò ìíåíèå ñîâåòà. Îòðåêèòåñü îò ñâîåãî òèòóëà. Ìû ñ÷èòàåì, ÷òî [new_title_holder.GetFullName] - íàèáîëåå äîñòîéíûé êàíäèäàò. Ñîãëàñèòåñü ñ òðåáîâàíèåì ìèðíî èëè ñòîëêí¸òåñü ñ íåæåëàòåëüíûìè ïîñëåäñòâèÿìè.\nÏîäïèñü:\n [From.GetTitledName];;x
EVTDESC8221;Rather than letting civil war tear the realm apart, [From.GetTitledName] has agreed to give up [From.GetHerHis] title for the good of the realm. We have chosen [new_title_holder.GetFullName] as our new ruler. Your valuable support in this matter will not be forgotten.\n\nSincerely,\n[FromFrom.GetTitledName];;;;;;;;;;;×òîáû íå ïîçâîëèòü ãðàæäàíñêîé âîéíå ðàçîðâàòü ñòðàíó íà ÷àñòè, [From.GetTitledFirstName] ñîãëàñè[From.GetLasLsya] îòðå÷üñÿ îò ñâîåãî òèòóëà âî áëàãî ñòðàíû. Îòíûíå [new_title_holder.GetFullName] - íàø íîâûé ïðàâèòåëü. Âàø öåííûé âêëàä â ýòîò êîíôëèêò íå áóäåò çàáûò.\nÑ óâàæåíèåì,\n [FromFrom.GetTitledFirstName];;x
EVTDESC8222;Under pressure from a powerful Faction, §Y[From.GetTitledName]§! has agreed to abdicate the throne. Hail the new ruler, §Y[new_title_holder.GetFullName]§!!;;;;;;;;;;;Ïîä äàâëåíèåì âëèÿòåëüíîé ôðàêöèè, §Y[From.GetTitledFirstName]§! îòðåê[From.GetLasSya] îò ïðåñòîëà. Äà çäðàâñòâóåò §Y[new_title_holder.GetFullName]§!!;;x
EVTDESC8223;Rather than risking civil war tearing the realm apart, I have decided to give in to your demand and abdicate the throne. But this treacherous act of blackmail will not be forgotten...\n\nSigned,\n[From.GetTitledName];;;;;;;;;;;×òîáû èçáàâèòü ñòðàíó îò ãðàæäàíñêîé âîéíû, ÿ îòðåêàþñü îò ïðåñòîëà. Îäíàêî Âàø áåñ÷åñòíûé øàíòàæ íå áóäåò çàáûò...\n\nÏîäïèñü:\n [From.GetTitledName];;x
EVTDESC8225;I am humbled by the responsibility given to me today. I accept the title of [new_title_holder.GetTitle] to serve you every way that I can. Your efforts to make a change will be remembered.\n\n[new_title_holder.GetTitledName];;;;;;;;;;;ß ñìèðåííî ïðèíèìàþ âîçëîæåííóþ íà ìåíÿ îòâåòñòâåííîñòü è îòíûíå áóäó ñëóæèòü Âàì âåðîé è ïðàâäîé êàê [new_title_holder.GetTitle]. Âàø âêëàä â ýòî íå áóäåò çàáûò.\n [new_title_holder.GetTitledName];;x
EVTDESC8226;The faction led by [From.GetBestName] won their war and have chosen me as successor to the title of [Root.GetTitle]. In the future I am expected to show generosity towards anyone who helped make this happen.;;;;;;;;;;;Ôðàêöèÿ, êîòîðóþ âîçãëàâëÿåò [From.GetBestName], ïîáåäèëà â âîéíå, è ñîãëàñíî èõ ðåøåíèþ [Root.GetTitle] òåïåðü ÿ. Îæèäàåòñÿ, ÷òî â áóäóùåì ÿ ïðîÿâëþ ùåäðîñòü ê ëþáîìó, êòî ïîìîã ýòîìó ñëó÷èòüñÿ.;;x
EVTOPTA8150;My co-conspirators will provide...;;;;;;;;;;;Âàø ñîîáùíèê îáåñïå÷èò âñåì íåîáõîäèìûì.;;x
EVTOPTA8152;Very well - too bad I will not see it!;;;;;;;;;;;Îòëè÷íî, æàëü òîëüêî ÿ íå óâèæó ýòî!;;x
EVTOPTA8154;I will pay for it myself!;;;;;;;;;;;ß çàïëà÷ó!;;x
EVTOPTA8155;Aaah, that's the stuff!;;;;;;;;;;;Îõ, âîò ýòî âåùü!;;x
EVTOPTA8156;A million deaths for [FromFrom.GetTitledFirstName]!;;;;;;;;;;;[FromFrom.GetTitledFirstName]!;;x
EVTOPTA8157;Who would hate me so?;;;;;;;;;;;Êòî òàê ñèëüíî ìåíÿ íåíàâèäèò?;;x
EVTOPTA8158;[FromFrom.GetTitledFirstName] is surely guilty!;;;;;;;;;;;Ýòî [FromFrom.GetTitledFirstName]!;;x
EVTOPTA8159;I fear I shall never know;;;;;;;;;;;Áîþñü, ÿ íèêîãäà íå óçíàþ.;;x
EVTOPTA8160;Classic!;;;;;;;;;;;Êëàññèêà!;;x
EVTOPTA8161;Make the preparations;;;;;;;;;;;Ñäåëàéòå ïðèãîòîâëåíèÿ.;;x
EVTOPTA8162;Classic!;;;;;;;;;;;Îòëè÷íî!;;x
EVTOPTA8163;Good. But... bad.;;;;;;;;;;;Õîðîøî, íî... ïëîõî;;x
EVTOPTA8164;I think I will celebrate with... beer.;;;;;;;;;;;ß îòìå÷ó ýòî äåëî... ïèâîì.;;x
EVTOPTA8165;This is bad...;;;;;;;;;;;Ýòî ïëîõî...;;x
EVTOPTA8166;We will just have to try again;;;;;;;;;;;Ìû äîëæíû ïîïûòàòüñÿ åùå ðàç.;;x
EVTOPTA8170;My co-conspirators will know someone...;;;;;;;;;;;Ìîè ñîîáùíèêè çíàþò êîå-êîãî...;;x
EVTOPTA8172;Expensive, but worthwhile!;;;;;;;;;;;Äîðîãî, íî ýòî òîãî ñòîèò!;;x
EVTOPTA8175;Almost there...;;;;;;;;;;;Ïî÷òè ïîëó÷èëîñü...;;x
EVTOPTA8176;Death to [FromFrom.GetTitledFirstName]!;;;;;;;;;;;[FromFrom.GetTitledFirstName]!;;x
EVTOPTA8177;Why? Who? [Root.Religion.GetRandomGodNameCap]...;;;;;;;;;;;Ïî÷åìó? Êòî?;;x
EVTOPTA8178;[FromFrom.GetTitledFirstName] must be behind this!;;;;;;;;;;;Ýòî [FromFrom.GetTitledFirstName]!;;x
EVTOPTA8179;I guess I'll never know...;;;;;;;;;;;Ìíå êàæåòñÿ, ÿ íèêîãäà íå óçíàþ...;;x
EVTOPTA8180;Fly, little bird, fly!;;;;;;;;;;;Ëåòè, ïòè÷êà, ëåòè!;;x
EVTOPTA8184;Chicken for lunch today, I think;;;;;;;;;;;Äóìàþ, ñåãîäíÿ íà îáåä áóäåò öûïë¸íîê.;;x
EVTOPTA8185;Curses!;;;;;;;;;;;Ïðîêëÿòüå!;;x
EVTOPTB8150;Buy a rare poison;;;;;;;;;;;Êóïèòü ðåäêèé ÿä.;;x
EVTOPTB8151;Ask the Plot head for funds;;;;;;;;;;;Ïîïðîñèòü äåíåã ó ëèäåðà çàãîâîðà;;x
EVTOPTB8152;Even [Root.PlotTarget.GetHerHis] death is not worth it.;;;;;;;;;;;Äàæå [Root.PlotTarget.GetHersHis] ñìåðòü íå ñòîèò ñòîëüêî.;;x
EVTOPTB8154;Forget it;;;;;;;;;;;Çàáóäüòå.;;x
EVTOPTB8155;Wait, this doesn't smell right!;;;;;;;;;;;Ïîäîæäèòå, êàê-òî îíî ñòðàííî ïàõíåò.;;x
EVTOPTB8170;Bribe a guard;;;;;;;;;;;Ïîäêóïèòü ñòðàæó;;x
EVTOPTB8171;Ask the Plot head for funds;;;;;;;;;;;Ïîïðîñèòü äåíåã ó èíèöèàòîðà çàãîâîðà;;x
EVTOPTB8175;Wait, who's that behind me?!;;;;;;;;;;;Ïîäîæäèòå, êòî ýòî çà ìîåé ñïèíîé?!;;x
EVTOPTC8150;Hemlock goes well with the Red...;;;;;;;;;;;Áîëèãîëîâ õîðîøî ñî÷åòàåòñÿ ñ êðàñíûì.;;x
EVTOPTC8170;I know the perfect man for the job!;;;;;;;;;;;ß çíàþ ïîäõîäÿùåãî äëÿ ýòîé ðàáîòû ÷åëîâåêà!;;x
EVTOPTD8150;Too expensive - I will bide my time;;;;;;;;;;;Ñëèøêîì äîðîãî, ÿ ëó÷øå ïîäîæäó.;;x
EVTTOOLTIP8152;Ask §Y[This.GetTitledName]§! for funds to kill §Y[This.PlotTarget.GetTitledName]§!;;;;;;;;;;;Âîçìîæíî [This.GetTitledName] äàñò Âàì äåíåã íà óáèéñòâî ïåðñîíàæà [This.PlotTarget.GetTitledName];;x
EVTTOOLTIP8153;§Y[This.GetTitledName]§! receives the funds;;;;;;;;;;;[This.GetTitledName] ïîëó÷èò äåíüãè.;;x
EVTTOOLTIP8154;Inform §Y[This.GetTitledName]§! that I will not pay;;;;;;;;;;;Ïóñòü [This.GetTitledName] óçíàåò, ÷òî ÿ íå áóäó ïëàòèòü.;;x
EVTTOOLTIP8155;Poison §Y[This.GetTitledName]§! at the feast next month;;;;;;;;;;;[This.GetTitledName] áóäåò îòðàâëåí[This.GetEndA] íà áàëó â ñëåäóþùåì ìåñÿöå;;x
EVTTOOLTIP8160;Tell §Y[This.GetTitledName]§! of the idea to kill §Y[This.PlotTarget.GetTitledName]§!;;;;;;;;;;;[This.GetTitledName] óñëûøèò îò Âàñ î ñïîñîáå óáèéñòâà ïåðñîíàæà [This.PlotTarget.GetTitledName];;x
EVTTOOLTIP8161;Approve the plan;;;;;;;;;;;Óòâåðäèòü ïëàí;;x
EVTTOOLTIP8175;§Y[This.GetTitledName]§! will try §Y[This.GetPossPronoun]§! wings next month;;;;;;;;;;;[This.GetTitledName] èñïûòàåò ñâîè êðûëüÿ â ñëåäóþùåì ìåñÿöå;;x
EVTOPTA8213;Your clan has served us well, you shall live for now...;;;;;;;;;;;Òâîé êëàí õîðîøî ñëóæèë íàì, òû áóäåøü æèòü, ïîêà...;;x
EVTOPTA8225;Wonderful.;;;;;;;;;;;×óäåñíî.;;x
EVTOPTA8226;A great honor.;;;;;;;;;;;Ýòî áîëüøàÿ ÷åñòü.;;x
EVTOPTB8213;Cowards like you have no place among us!;;;;;;;;;;;Òðóñàì âðîäå òåáÿ íåò ìåñòà ñðåäè æèâûõ!;;x
EVTTOOLTIP7500;§Y[Root.TopLiege.GetTitledFirstName]§! receives a letter.;;;;;;;;;;;[Root.TopLiege.GetTitledFirstName] ïîëó÷èò ïèñüìî.;;x
EVTTOOLTIP7501;§Y[This.GetTitledFirstName]§! receives your positive reply.;;;;;;;;;;;Ïîëó÷åíî ñîãëàñèå.;;x
EVTTOOLTIP7502;§Y[This.GetTitledFirstName]§! receives your negative reply.;;;;;;;;;;;Ïîëó÷åí îòêàç.;;x
EVTTOOLTIP7504;§Y[Root.PlotTarget.GetTitledName]§! receives a thinly veiled ultimatum from the §Y[Root.Liege.GetTitle].;;;;;;;;;;;"[Root.PlotTarget.GetTitledName] ïîëó÷èò çàâóàëèðîâàííîå òðåáîâàíèå íà òèòóë ""[Root.Liege.GetTitle]"".";;x
EVTTOOLTIP7505;§Y[Root.PlotTarget.GetTitledName]§! receives a letter.;;;;;;;;;;;[Root.PlotTarget.GetTitledName] ïîëó÷èò ïèñüìî.;;x
EVTTOOLTIP7507;Ultimatum rejected.;;;;;;;;;;;Óëüòèìàòóì îòîçâàí.;;x
EVTTOOLTIP7509;Informed you do not agree.;;;;;;;;;;;Ïðîèíôîðìèðîâàí î Âàøåì íåñîãëàñèè.;;x
EVTDESC7500;My [Root.GetTitle], many of your faithful subjects, myself included, feel that [From.PlotTarget.GetTitledName] has amassed more power and titles than is warranted by [From.PlotTarget.GetHerHis] station. If you were to kindly advise [From.PlotTarget.GetHerHim] to abdicate the [From.PlotTargetTitle.GetFullName] to a vassal, know that this decision would enjoy our wholehearted support.\n\nSigned,\n[From.GetTitledName];;;;;;;;;;;[Root.PrimaryTitle.GetFOA].\nÌíîãèå Âàøè ïîääàííûå, âêëþ÷àÿ ìåíÿ, ñ÷èòàþò, ÷òî [From.PlotTarget.GetTitledName] èìååò áîëüøå òèòóëîâ, ÷åì ïîçâîëÿåò [From.PlotTarget.GetHersHis] ïîëîæåíèå. Ìû íèæàéøå ïðîñèì Âàñ óêàçàòü [From.PlotTarget.GetHerHim] âåðíûé ïóòü.\nÏóñòü [From.PlotTarget.GetSheHe] ïåðåäàñò ÷àñòü ñâîèõ çåìåëü ñâîåìó âàññàëó. Ëó÷øå âñåãî, íà íàø âçãëÿä, äëÿ ýòîãî ïîäõîäèò [From.PlotTargetTitle.GetFullName].\nÊîíå÷íî æå ìû âñåöåëî è åäèíîäóøíî ïîääåðæèì Âàøå ðåøåíèå!\nÏîäïèñü: \n[From.GetTitledName];;x
EVTDESC7501;We must confess to sharing in your concerns regarding the rising affluence of [Root.PlotTarget.GetTitledName]. For the good of the realm, we shall contact [Root.PlotTarget.GetHerHim] forthwith and seek the compromise you suggested.\n\nSigned,\n[From.GetTitledName];;;;;;;;;;;Ïðèçíàòüñÿ, ìû íåñêîëüêî îáåñïîêîåíû òåì, ÷òî [Root.PlotTarget.GetTitledName] òàê ñòðåìèòåëüíî ðàñøèðÿåò ñôåðó ñâîåãî âëèÿíèÿ. Äëÿ âñåîáùåãî áëàãà ìû íåçàìåäëèòåëüíî îòïðàâèì [Root.PlotTarget.GetHerHim] ñîîáùåíèå ñ ïðåäëîæåííûì Âàìè êîìïðîìèññîì.\nÏîäïèñü: \n[From.GetTitledName];;x
EVTDESC7502;Don't be a fool, [Root.GetFirstName]! I will not see this realm torn asunder by intrigue and connivery. Abandon this scheme now, or on my oath you'll come to regret it!\n\nSigned,\n[From.GetTitledName];;;;;;;;;;;Íå áóäüòå äóðàêîì, [Root.GetFirstName]! ß íå ìîãó äîïóñòèòü ðàñêîëà ñòðàíû èç-çà çàãîâîðîâ è ïîòâîðñòâà! Íåìåäëåííî ïðåêðàòèòå âñå Âàøè èíòðèãè, èëè, ÿ êëÿíóñü Âàì, Âû ïîæàëååòå îá ýòîì!\nÏîäïèñü: \n[From.GetTitledName];;x
EVTDESC7504;My dear [Root.GetTitle], we hope this letter finds you in good health. We have been urged by certain concerned parties to take steps in restoring the precarious balance of power in the realm, and we think it best if you voluntarily abdicate the [From.PlotTargetTitle] to one of your vassals. We are certain you will agree.\n\nSigned,\n[From.Liege.GetTitledName];;;;;;;;;;;"[Root.GetTitle], ìû íàäååìñÿ, ýòî ïèñüìî çàñòàíåò Âàñ â äîáðîì çäðàâèè. Îò ëèöà çàèíòåðåñîâàííûõ ñòîðîí ìû íàñòîÿòåëüíî ðåêîìåíäóåì Âàì ïðåäïðèíÿòü âñ¸ íåîáõîäèìîå äëÿ âîññòàíîâëåíèÿ áàëàíñà ñèë â ñòðàíå, ìû ïðîñèì Âàñ îòðå÷üñÿ îò òèòóëà ""[From.PlotTargetTitle]"" â ïîëüçó îäíîãî èç Âàøèõ âàññàëîâ. Ìû íàäååìñÿ, Âû ïðèñëóøàåòåñü ê íàì.\nÏîäïèñü: \n[From.Liege.GetTitledName]";;x
EVTDESC7505;You have upset the delicate balance of power in the realm, [From.PlotTarget.GetTitledFirstName]. Relinquish control of the [From.PlotTargetTitle.GetFullName] to one of your vassals for the good of all, lest my confederates and I accomplish the same through force of arms.\n\nSigned,\n[From.GetTitledName];;;;;;;;;;;Õðóïêèé áàëàíñ ñèë â ñòðàíå áûë íàðóøåí, [From.PlotTarget.GetTitledFirstName]. Îòêàæèòåñü îò Âàøåãî òèòóëà ([From.PlotTargetTitle.GetFullName]) â ïîëüçó îäíîãî èç Âàøèõ âàññàëîâ, è òàê áóäåò ëó÷øå äëÿ âñåõ, ïîêà ÿ è ìîè ëþäè íå ïîòðåáîâàëè ýòîãî ñ îðóæèåì â ðóêàõ.\n\nÏîäïèñü: \n[From.GetTitledName];;x
EVTDESC7506;Though I am sure I shall curse your name until the end of times, I will agree to your demand in the interest of peace.\n\nSigned,\n[From.GetTitledName];;;;;;;;;;;Íåñîìíåííî, ÿ íèêîãäà íå ïðîùó ýòîãî ñåáå è áóäó ïðîêëèíàòü Âàøå èìÿ äî êîíöà âðåì¸í, íî âñ¸ æå ñîãëàøóñü íà Âàøå òðåáîâàíèå äàáû ñîõðàíèòü ìèð.\nÏîäïèñü: \n[From.GetTitledName];;x
EVTDESC7507;I would no sooner surrender the [Root.PlotTargetTitle.GetFullName] than I would my right arm. If you and your little friends can muster the courage to face me, I shall gladly see you cut down to the last man. Come then!\n\nSigned,\n[From.GetTitledName];;;;;;;;;;;"×òîáû çàñòàâèòü ìåíÿ ïîäïèñàòü îòðå÷åíèå îò òèòóëà ""[Root.PlotTargetTitle.GetFullName]"", Âàì ïðèä¸òñÿ îòðóáèòü ìîþ ïðàâóþ ðóêó. È åñëè ó Âàñ è Âàøèõ äðóçåé õâàòèò ñìåëîñòè âñòðåòèòüñÿ ñî ìíîé ëèöîì ê ëèöó, ÷òî æ ÿ ñ ðàäîñòüþ ïîñìîòðþ, êàê Âàñ âûðåæóò âñåõ äî îäíîãî. Äàâàéòå æå!\nÏîäïèñü: \n[From.GetTitledName]";;x
