EVTOPTG_RoI_1005;He can do without gifts.;;;;;;;;;;;Îí îáîéä¸òñÿ áåç ïîäàðêîâ.;;x
EVTOPTG_RoI_1007;My lover is pleased with her gift.;;;;;;;;;;;Ìîÿ ëþáîâíèöà äîâîëüíà ïîäàðêîì.;;x
EVTOPTG_RoI_1160;Aaah! Get those little monsters out of here!;;;;;;;;;;;Ààà! Óáåðèòå ýòèõ ìîíñòðîâ îòñþäà!;;x
EVTOPTH_RoI_1005;I will spend money on my lover instead...;;;;;;;;;;;Ëó÷øå ÿ ïîòðà÷ó äåíüãè íà ìîåãî ëþáîâíèêà...;;x
EVTOPTH_RoI_1007;My lover is disappointed because I didn't get her anything.;;;;;;;;;;;Ìîÿ ëþáîâíèöà ðàçî÷àðîâàíà - ÿ íè÷åãî íå ïîäàðèë.;;x
EVTOPTI_RoI_1007;My husband is overjoyed with the magnificent gift!;;;;;;;;;;;Ìîé ìóæ áåçóìíî ðàä ïîäàðêó!;;x
EVTOPTJ_RoI_1007;My husband is pleased with his gift.;;;;;;;;;;;Ìîé ìóæ äîâîëåí ïîäàðêîì.;;x
EVTOPTK_RoI_1007;My husband is upset because I didn't get him anything.;;;;;;;;;;;Ìîé ìóæ ðàññòðîåí, ïîòîìó ÷òî ÿ íè÷åãî íå ïîäàðèëà.;;x
EVTOPTL_RoI_1007;My lover is overjoyed with his gift! But my husband isn't happy...;;;;;;;;;;;Ìîé ëþáîâíèê áåçóìíî ðàä ïîäàðêó! Íî ìóæ ðàññòðîåí...;;x
EVTOPTM_RoI_1007;My lover is overjoyed with his gift!;;;;;;;;;;;Ìîé ëþáîâíèê áåçóìíî ðàä ïîäàðêó!;;x
EVTOPTN_RoI_1007;My lover is pleased with his gift. But my husband isn't happy...;;;;;;;;;;;Ìîé ëþáîâíèê äîâîëåí ïîäàðêîì. Íî ìóæ ðàññòðîåí...;;x
EVTOPTO_RoI_1007;My lover is pleased with his gift.;;;;;;;;;;;Ìîé ëþáîâíèê äîâîëåí ïîäàðêîì.;;x
EVTOPTP_RoI_1007;My lover is disappointed because I didn't get him anything.;;;;;;;;;;;Ìîé ëþáîâíèê ðàññòðîåí - ÿ íè÷åãî íå ïîäàðèëà.;;x
EVTTITLE_RoI_1051;The Mage;;;;;;;;;;;Âîëøåáíèê;;x
EVTTITLE_RoI_1060;The Duel;;;;;;;;;;;Ñðàæåíèå;;x
EVTTITLE_RoI_1183;A celebration in blood;;;;;;;;;;;Êðîâàâîå òîðæåñòâî;;x
EVTTOOLTIP1_RoI_1000;Invitations are sent.;;;;;;;;;;;Ïðèãëàøåíèÿ ðàçîñëàíû.;;x
