EVTDESC_ZE_22650;To [Root.GetTitledFirstName],\n\nKnow that I asked out of curiosity and not malice, but even so I apologize for what I did.\nSincerely,\n\n[From.GetTitledName];;;;;;;;;;;Ìî¸ ïî÷òåíèå, [Root.GetTitledFirstName].\nß õî÷ó, ÷òîáû Âû çíàëè, â ìîåé ïðîñüáå íå áûëî çëîãî óìûñëà, òîëüêî âîñõèùåíèå è ëþáîïûòñòâî, íî äàæå â ýòîì ñëó÷àå, ÿ ïðîøó ïðîùåíèÿ çà ñâî¸ ïîâåäåíèå.\nÑ óâàæåíèåì,\n [From.GetTitledName];;x
EVTDESC_ZE_22660;To the [GetFromRootInsult] [Root.GetFirstName],\n\nYou dare to refuse me help? Know that I will not soon forget this insult to my honor.\n\nSigned,\n[From.GetTitledName];;;;;;;;;;;[Root.GetInsultAdjective] [Root.GetFirstName].\nÄà êàê Âû ñìååòå îñêîðáëÿòü ìåíÿ? Áóäüòå óâåðåíû, ÿ ýòîãî íå çàáóäó!\nÏîäïèñü:\n [From.GetTitledName];;x
EVTDESC_ZE_22670;To the [GetFromRootCompliment] [Root.GetFirstName],\n\nI excuse my forward request. Perhaps some gold would make you reconsider my offer?\n\nSigned,\n[From.GetTitledName];;;;;;;;;;;[Root.GetComplimentAdjectiveCap] [Root.GetFirstName].\nÏðîøó ïðîñòèòü ìíå ìîþ äåðçîñòü. Âîçìîæíî, ìû ìîãëè áû äîãîâîðèòüñÿ. Êàê Âû ñìîòðèòå íà òàêîé âàðèàíò - ÿ çàïëà÷ó Âàì çîëîòîì, à Âû ïåðåñìîòðèòå ñâî¸ ïðåäëîæåíèå?\nÑ óâàæåíèåì,\n [From.GetTitledName];;x
EVTDESC_ZE_22680;To the [GetFromRootCompliment] [Root.GetFirstName],\n\nI excuse my previous behavior! Along with this letter I have enclosed a book which treatise my own experience as a [From.GetJobTitle], I hope its contents will serve you well!\n\nRegards,\n[From.GetTitledName];;;;;;;;;;;"[Root.GetComplimentAdjectiveCap] [Root.GetFirstName],\nß ïðîøó ïðîùåíèÿ çà ñâî¸ ïðîøëîå ïîâåäåíèå. Ê ýòîìó ïèñüìó ÿ ïðèëàãàþ íåáîëüøóþ êíèãó. ""[From.GetLordLadyCap] [From.GetJobTitle]"" îïèñûâàåò ìîé ëè÷íûé îïûò â äîëæíîñòè ñîâåòíè[From.GetTsyKa]. Íàäåþñü, ýòî ïîìîæåò Âàì íà ñëóæáå.\nÑ óâàæåíèåì,\n [From.GetTitledName]";;x
EVTDESC_ZE_22690;To the [GetFromRootInsult] [Root.GetFirstName],\n\nDid you really think that I could be bought? Take your money back and leave me be, you will never partake of my secrets!\n\nSigned,\n[From.GetTitledName];;;;;;;;;;;Ïðèâåòñòâóþ, [Root.GetTitledFirstName].\nÌåíÿ ïðèÿòíî óäèâëÿåò, ÷òî [Root.GetJobTitle] ñ ïîñðåäñòâåííûìè íàâûêàìè îáëàäàåò òàêîé öåëåóñòðåìë¸ííîñòüþ. Íî ó ìåíÿ ê Âàì âñòðå÷íîå ïðåäëîæåíèå - Âû çàáèðàåòå ñâî¸ çîëîòî è êàòèòåñü êî âñåì ÷åðòÿì.\nÑ óâàæåíèåì,\n [From.GetTitledName];;x
EVTDESC_ZE_22702;Your friend, [target_unlanded_friend.GetTitledFirstName], does not stand to inherit any land of [target_unlanded_friend.GetHerHis] own. You have always considered [target_unlanded_friend.GetHerHim] a [GetRootFromCompliment], and as such it would be a shame to see [target_unlanded_friend.GetHerHim] fade into irrelevance. If you were to offer [target_unlanded_friend.GetHerHim] the [target_friend_land.GetFullName] it would not only bring your friend closer, but you would also gain a vassal your entire family could trust!;;;;;;;;;;;Ïîõîæå, ÷òî Âàø[target_unlanded_friend.GetEndA] [target_unlanded_friend.GetFriendMF], [target_unlanded_friend.GetTitledFirstName], íå óíàñëåäóåò çåìëþ. Âû âñåãäà ñ÷èòàëè, ÷òî [GetRootFromCompliment] âðîäå í[target_unlanded_friend.GetHersHis] çàñëóæèâàåò ëó÷øåãî. [target_friend_land.GetFullName] - õîðîøåå ïðåäëîæåíèå ñ Âàøåé ñòîðîíû, ê òîìó æå âñÿ Âàøà ñåìüÿ ïîëó÷èò âåðíîãî âàññàëà â [target_unlanded_friend.GetHersHis] ëèöå.;;x
EVTDESC_ZE_22800;It is clear to you that [Root.Liege.GetTitledFirstName]'s commanders are nothing more than rabble - all brawn and no finesse. You, on the other hand, are an experienced tactician and a great teacher to boot! Perhaps you should offer to train [Root.Liege.GetFirstName]'s commanders in the hopes of gaining [Root.Liege.GetHerHis] favor?;;;;;;;;;;;Î÷åâèäíî, [Root.Liege.GetTitledFirstName] íå ìîæåò ïîõâàñòàòüñÿ îðãàíèçîâàííîñòüþ ñâîèõ âîéñê. [Root.Liege.GetHersHisCap] ïîëêîâîäöû - íå áîëåå ÷åì ãðóáàÿ ÷åðíü, íè÷åãî íå ñìûñëÿùàÿ â âîåííîì äåëå. Íî Âû - îïûòíûé òàêòèê è ìîãëè áû îáó÷èòü èõ è òîãäà, âåðîÿòíî, ýòîò ïîñòóïîê çà÷ò¸òñÿ Âàì â áóäóùåì.;;x
EVTDESC_ZE_22801;To my liege, the [GetFromRootCompliment] [Root.GetFirstName],\nIt has not escaped me that several of your commanders lack formal training in military tactics. I would like to offer my services by training [commander_one.GetFirstName], [commander_two.GetFirstName] and [commander_three.GetFirstName] in the use of advanced battlefield stratagems!\n\nRegards,\n[From.GetTitledName];;;;;;;;;;;[Root.PrimaryTitle.GetFOA],\nÒðóäíî íå çàìåòèòü, ÷òî íåêîòîðûå èç Âàøèõ ïîëêîâîäöåâ ìàëî ÷òî ïîíèìàþò â âîåííîé òàêòèêå. ß ïðåäëàãàþ Âàì ñâîè óñëóãè - [commander_one.GetFirstName], [commander_two.GetFirstName] è [commander_three.GetFirstName] ìîãóò íàó÷èòüñÿ ó ìåíÿ èñêóñíûì ñòðàòåãè÷åñêèì ìàí¸âðàì íà ïîëå áîÿ.\nÑ óâàæåíèåì,\n [From.GetTitledName];;x
EVTDESC_ZE_22802;To my loyal subject, the [GetFromRootCompliment] [Root.GetFirstName],\n\nYour offer is most generous! I graciously accept your offer and will remember this good deed in the future.\n\nRegards,\n[From.GetTitledName];;;;;;;;;;;[Root.GetComplimentAdjectiveCap] [Root.GetFirstName],\nÁëàãîäàðþ çà ñòîëü ùåðäðîå ïðåäëîæåíèå è ïðèíèìàþ åãî. Áóäüòå óâåðåíû, ÿ íå çàáóäó îá ýòîì. Åñëè ÿ ÷òî-íèáóäü ìîãó äëÿ Âàì ñäåëàòü, òîëüêî ïîïðîñèòå.\nÑ óâàæåíèåì,\n [From.GetTitledName];;x
EVTDESC_ZE_22803;To my subject, the [GetFromRootInsult] [Root.GetFirstName],\n\nYour offer is obviously nothing but thinly-veiled deception. That you would even suggest that my commanders are anything but the very best is an insult!\n\nRegards,\n[From.GetTitledName];;;;;;;;;;;[Root.GetInsultAdjective] [Root.GetFirstName],\nÎ÷åâèäíî, Âàøà çàòåÿ - íå ÷òî èíîå, êàê ëîâêî çàâóàëèðîâàííûé ïîâîä âîñïîëüçîâàòüñÿ ìîèì ïîëîæåíèåì â ñâîèõ èíòåðåñàõ. Äà è êàê Âû âîîáùå ïîñìåëè îñêîðáëÿòü ìîèõ îôèöåðîâ?!\n [From.GetTitledName];;x
EVTOPTA_ZE_22300;Release him! Now, do not forget what I did for you...;;;;;;;;;;;Îòïóñòèòå åãî! Íå çàáûâàéòå î ìî¸ì ìèëîñåðäèè...;;x
EVTOPTA_ZE_22400;Thank you! I do truly owe you in return!;;;;;;;;;;;Áëàãîäàðþ! ß ïåðåä Âàìè â äîëãó.;;x
EVTOPTA_ZE_22410;Now, when to call in the favor...;;;;;;;;;;;Êòî çíàåò, ÷åì [From.GetSheHe] ñìîæåò ìíå ïîìî÷ü â áóäóùåì...;;x
EVTOPTA_ZE_22420;Ingratitude is the world's reward.;;;;;;;;;;;Âñåãäà ïîæàëóéñòà!;;x
EVTOPTA_ZE_22500;You would do that for me? I am in your debt!;;;;;;;;;;;Âû ñäåëàåòå ýòî äëÿ ìåíÿ? ß ïåðåä Âàìè â äîëãó!;;x
EVTOPTA_ZE_22510;Excellent, I can make use of this favor.;;;;;;;;;;;Ëîâëþ [From.GetHersHis] íà ñëîâå.;;x
EVTOPTA_ZE_22520;No better than a heretic...;;;;;;;;;;;Òàêîé ÷åëîâåê íè÷åì íå ëó÷øå åðåòèêà...;;x
EVTOPTA_ZE_22600;Yes, I will write [target_foreign_voter.GetHerHim]!;;;;;;;;;;;ß íàïèøó [target_foreign_voter.GetHerHim] ïðÿìî ñåé÷àñ!;;x
EVTOPTA_ZE_22610;A touching request, I will help you!;;;;;;;;;;;Êàê òðîãàòåëüíî. Êîíå÷íî, ÿ ïîìîãó [From.GetHerHim].;;x
EVTOPTA_ZE_22620;Truly a great [From.GetManWoman]!;;;;;;;;;;;Âîèñòèíó âåëèêèé ÷åëîâåê!;;x
EVTOPTA_ZE_22630;I was foolish to ask...;;;;;;;;;;;Íàèâíî áûëî ïûòàòüñÿ...;;x
EVTOPTA_ZE_22650;Perhaps I was too harsh in my response...;;;;;;;;;;;Âîçìîæíî, ìîé îòâåò áûë ñëèøêîì ðåçêèì...;;x
EVTOPTA_ZE_22660;Truly a fool...;;;;;;;;;;;[GetRootFromInsult]...;;x
EVTOPTA_ZE_22670;Well, when you put it like that!;;;;;;;;;;;Íó âîò... ñîâñåì äðóãîå äåëî!;;x
EVTOPTA_ZE_22680;I knew some gold would loosen [From.GetHerHis] tongue!;;;;;;;;;;;Çîëîòî òâîðèò ÷óäåñà!;;x
EVTOPTA_ZE_22690;It was worth a try...!;;;;;;;;;;;Ïîïðîáîâàòü ñòîèëî...;;x
EVTOPTA_ZE_22702;I shall offer [target_unlanded_friend.GetHerHim] land!;;;;;;;;;;;ß ïðåäëîæó [target_unlanded_friend.GetHerHim] ýòó çåìëþ.;;x
EVTOPTA_ZE_22800;I shall send [Root.Liege.GetHerHim] a letter offering my services!;;;;;;;;;;;ß îòïðàâëþ [Root.Liege.GetHerHim] ãîíöà ñ ïèñüìîì.;;x
EVTOPTA_ZE_22801;A most generous offer, for this I will owe [From.GetHerHim]!;;;;;;;;;;;Âåñüìà ùåäðîå ïðåäëîæåíèå, ÿ ïåðåä Âàìè â äîëãó.;;x
EVTOPTA_ZE_22802;Excellent! Now I have leverage on [From.GetHerHim]...;;;;;;;;;;;Ëîâëþ Âàñ íà ñëîâå.;;x
EVTOPTA_ZE_22803;This was not what I meant to happen!;;;;;;;;;;;Âû ìåíÿ íåïðàâèëüíî ïîíÿëè!;;x
EVTOPTB_ZE_22300;Being of noble birth means nothing. To the dungeons with him!;;;;;;;;;;;Çàêîí åäèí äëÿ âñåõ. Áðîñüòå åãî â òåìíèöó!;;x
EVTOPTB_ZE_22400;Bah! I would have won that argument by myself!;;;;;;;;;;;Ñïàñèáî, íî ÿ ìîãó çà ñåáÿ ïîñòîÿòü!;;x
EVTOPTB_ZE_22500;No, there is no place for [Root.Religion.GetScriptureName] in politics!;;;;;;;;;;;Ïûëüíûì ìàíóñêðèïòàì íå ìåñòî â ïîëèòèêå!;;x
EVTOPTB_ZE_22600;No, why bother...;;;;;;;;;;;Çà÷åì äîêó÷àòü ÷åëîâåêó ïî âñÿêèì ïóñòÿêàì...;;x
EVTOPTB_ZE_22610;Fraternizing with the enemy? I think not!;;;;;;;;;;;[From.GetHersHisCap] ñòðàíå?! Çà êîãî [From.GetSheHe] ìåíÿ ïðèíèìàåò?;;x
EVTOPTB_ZE_22630;Why the...! [From.GetSheHeCap] dares to insult me when I ask for help?;;;;;;;;;;;Äà êàê [From.GetSheHe] ñìååò îñêîðáëÿòü ìåíÿ?!;;x
EVTOPTB_ZE_22670;No amount of gold will help your cause.;;;;;;;;;;;Âû çàáèðàåòå ñâî¸ çîëîòî è êàòèòåñü êî âñåì ÷åðòÿì.;;x
EVTOPTB_ZE_22702;Alas, [target_unlanded_friend.GetFirstName] was never meant to rule...;;;;;;;;;;;Óâû, ïðàâèòåëü[target_unlanded_friend.GetEndNitsa] èç í[target_unlanded_friend.GetHersHis] íèêàê[target_unlanded_friend.GetAyaOy]...;;x
EVTOPTB_ZE_22800;It is not worth it.;;;;;;;;;;;Ó ìåíÿ íåò íà ýòî âðåìåíè.;;x
EVTOPTB_ZE_22801;No! [From.GetSheHeCap] is just trying to gain leverage on me!;;;;;;;;;;;Õîòèòå ïîëó÷èòü ðû÷àã äàâëåíèÿ íà ìåíÿ? Íó óæ íåò!;;x
EVTOPTC_ZE_22630;Perhaps some money will change [From.GetHerHis] tone?;;;;;;;;;;;Ïðåäëîæó [From.GetHerHim] çîëîòî. Ó âñåõ åñòü ñâîÿ öåíà...;;x
EVTTITLE_ZE_23157;Attended feast together;;;;;;;;;;;Oáùèé ïðàçäíèê;;x
