EVTDESC_ZE_23000;Being on your liege's council is not always easy. You have a huge amount of work that needs attention and there is so much to do. The list seems endless. Just as you are about to give up, [target_help_councillor.GetTitledFirstName] steps through the door and asks if you want any help. As tempting it may be, you would be in [target_help_councillor.GetHerHis] debt for it.;;;;;;;;;;;"Çàñåäàòü â ñîâåòå ñþçåðåíà íå òàê ïðîñòî, êàê êàæåòñÿ íà ïåðâûé âçãëÿä. Óäèâèòåëüíî, ñêîëüêî ïëàíîâ, ðàññìîòðåíèé è îáñóæäåíèé ìîæíî âûäóìàòü, òîëüêî ÷òîáû èçîáðàçèòü áóðíóþ äåÿòåëüíîñòü ñîâåòà - ýòîò ñïèñîê ""âàæíûõ"" äåë íèêîãäà íå êîí÷èòñÿ... Âû áûëè óæå íà ãðàíè íåðâíîãî ñðûâà, êîãäà [target_help_councillor.GetTitledFirstName] ïîäîø[target_help_councillor.GetLaYol] ê Âàì è ïðåäëîæèë[target_help_councillor.GetEndA] ñâîþ ïîìîùü. Êàêîå îáëåã÷åíèå. Íî â ïîëèòèêå íè÷òî íå äåëàåòñÿ ïðîñòî òàê.";;x
EVTDESC_ZE_23001;When casually strolling around the premises, as one often does, you come across [From.GetTitledFirstName] sitting at [From.GetHerHis] desk, overburdened with work. Seeing this as the perfect opportunity to help [From.GetHerHim] out and perhaps gain a favor in return, you offer a helping hand. [From.GetSheHeCap] looks at you with heavy eyes and after a moment, decides to accept your offer!;;;;;;;;;;;Ïðîãóëèâàÿñü ïî ïûëüíûì êîðèäîðàì, Âû, êàê îáû÷íî, çàãëÿíóëè â îäíî èç ñëóæåáíûõ ïîìåùåíèé è çàìåòèëè, êàê [From.GetTitledFirstName], ïîãðóçèâøèñü â ðàáîòó, âîò-âîò ãðîõíåòñÿ íà ðàáî÷èé ñòîë îò óñòàëîñòè. Ïðåêðàñíàÿ âîçìîæíîñòü ïîìî÷ü êîëëåãå, âåäü â äîëãó [From.GetSheHe] íå îñòàíåòñÿ. Òÿæåëûé âçãëÿä, ïîëíûé îáðå÷¸ííîñòè ñìåíÿåò óëûáêà - [From.GetSheHe] ïðèíÿë[From.GetEndA] Âàøå ïðåäëîæåíèå.;;x
EVTDESC_ZE_23002;When casually strolling around the premises, as one often does, you come across [From.GetTitledFirstName] sitting at [From.GetHerHis] desk, overburdened with work. You see this as a great opportunity to help [From.GetHerHim] out and gain a favor in return. But to your surprise, [From.GetSheHe] not only refuses your help but has the nerve to insult you for it!;;;;;;;;;;;Ïðîãóëèâàÿñü ïî ïûëüíûì êîðèäîðàì, Âû, êàê îáû÷íî, çàãëÿíóëè â îäíî èç ñëóæåáíûõ ïîìåùåíèé è çàìåòèëè, êàê [From.GetTitledFirstName], ïîãðóçèâøèñü â ðàáîòó, âîò-âîò ãðîõíåòñÿ íà ðàáî÷èé ñòîë îò óñòàëîñòè. Ïðåêðàñíàÿ âîçìîæíîñòü ïîìî÷ü êîëëåãå, âåäü â äîëãó [From.GetSheHe] íå îñòàíåòñÿ. Âû òàê äóìàëè... Íî â îòâåò óñëûøàëè ëèøü ãíåâíûé âûïàä ñ ïðîñüáîé íå îòâëåêàòü îò [From.GetHersHis] îò âàæíûõ äåë!;;x
EVTDESC_ZE_23005;Every ruler needs to go out and meet the peasants in person from time to time. Just to make sure that they know you still exist if nothing else. As you visit the locals of [helping_vassal.Capital.GetName], you speak very frankly about what you think of them. Something that they took great offense in it seems. You look back to ensure that your guards are there to keep you out of harm's way, only to notice that they have all gone into the local tavern! Before you know it, the peasants begin to throw things at you!;;;;;;;;;;;Ëþáîé ïðàâèòåëü âðåìÿ îò âðåìåíè äîëæåí îòêðûòî âñòðå÷àòüñÿ ñ ïðîñòûì íàðîäîì. Õîòÿ áû äëÿ òîãî, ÷òîáû îíè çíàëè - îí äî ñèõ ïîð ñóùåñòâóåò. Íà ñåé ðàç ýòî [helping_vassal.Capital.GetName], èíòåðåñíîå è ñàìîáûòíîå ìåñòå÷êî. Ìåñòíûå õîðîøî âñòðåòèëè Âàñ, íî â ïðîöåññå áåñåäû Âû äàæå íå ïîíÿëè ÷åì èìåííî èõ îñêîðáèëè. Îáåðíóâøèñü â ïîèñêàõ ñâîåé îõðàíû, Âû îáíàðóæèëè, ÷òî ýòè áåçäåëüíèêè äàâíî óøëè â òàâåðíó! Ñíà÷àëà ïîëåòåëè òóõëûå îâîùè, à ïîòîì ïðåäìåòû ïîòÿæåëåå.;;x
EVTDESC_ZE_23006;You are calmly minding your own business, when you suddenly hear an awful ruckus outside. You open the door to see [From.GetTitledFirstName] running towards you with a mob of angry peasants at [From.GetHerHis] heels! If you would offer [From.GetHerHim] a place to hide, [From.GetSheHe] would truly be in your debt.;;;;;;;;;;;Âû ñïîêîéíî çàíèìàëèñü ñâîèìè äåëàìè è Âû âäðóã óñëûøàëè óæàñíûé øóì - ýòî ãäå-òî íà óëèöå. Âû îòêðûëè äâåðü è óâèäåëè, êàê [From.GetTitledFirstName] áåæèò ê Âàì íàâñòðå÷ó, ñïàñàÿñü îò ðàçúÿð¸ííîé òîëïû! Åñëè Âû ïðåäëîæèòå [From.GetHerHim] óáåæèùå â òàêîé ìîìåíò, [From.GetSheHe] áóäåò ïåðåä Âàìè â äîëãó.;;x
EVTDESC_ZE_23007;As you get closer you can see [From.GetTitledFirstName] standing in a doorway waving at you! You hurry towards [From.GetHerHim] and once inside, [From.GetFirstName] quickly closes the door. Safe at last. Who would ever have thought that peasants would be so easily insulted?;;;;;;;;;;;Óáåãàÿ îò òîëïû, Âû óâèäåëè, êàê [From.GetTitledFirstName] ìàøåò Âàì ÷åðåç îòêðûòóþ äâåðü! Âû ïîáåæàëè ê í[From.GetHerHim] è åäâà îêàçàâøèñü â [From.GetHersHis] äîìå, êðåïêî çàêðûëè çà ñîáîé äâåðü. Íàêîíåö-òî Âû â áåçîïàñíîñòè. Êòî áû ìîã ïîäóìàòü, ÷òî ýòè ëþäè òàêèå îáèä÷èâûå...;;x
EVTDESC_ZE_23008;Running as fast as you possibly could, you see [From.GetTitledFirstName] standing in a doorway. But instead of offering you a safe place to hide, [From.GetSheHe] quickly closes the door right in front of you! Leaving you to fend for yourself!;;;;;;;;;;;Óáåãàÿ îò òîëïû, Âû óâèäåëè, êàê [From.GetTitledFirstName] ïðèîòêðûë[From.GetEndA] äâåðü, ÷òîáû ïîñìîòðåòü, ÷òî ïðîèñõîäèò. Âû ïîìàõàëè [From.GetHerHim], íî çàìåòèâ Âàñ, [From.GetSheHe] âìåñòî òîãî, ÷òîáû ïîìî÷ü òóò æå çàêðûë[From.GetEndA] çà ñîáîé äâåðü!;;x
EVTDESC_ZE_23101;I can send equipment of higher quality to the troops of [From.PrimaryTitle.GetName] in order to change its troop composition and make them perform better in combat.;;;;;;;;;;;ß ìîãó ïîñëàòü íîâîå ñíàðÿæåíèå ñâîèì âîéñêàì, ÷òîáû èçìåíèòü èõ ñîñòàâ è ïîâûñèòü áîåñïîñîáíîñòü. [From.PrimaryTitle.GetName] ïîëó÷èò åãî â êðàò÷àéøèå ñðîêè.;;x
EVTDESC_ZE_23106;I have the possibility to send troops to [From.GetFirstName] and his [From.PrimaryTitle.GetName] to reinforce them.;;;;;;;;;;;ß ìîãó ïîñëàòü ïîäêðåïëåíèå ñâîèì âîéñêàì, ÷òîáû óñèëèòü èõ. [From.GetFirstName] è [From.GetHersHis] [From.PrimaryTitle.GetName] ïîëó÷àò åãî â êðàò÷àéøèå ñðîêè.;;x
EVTDESC_ZE_23152;While being in your service, [From.GetTitledFirstName] has been speaking to you about his employer, [merc_band_employer.GetTitledFirstName]. So far you have only heard good things about [merc_band_employer.GetHerHim] and it has made you intrigued. Perhaps one should try to establish contact and offer a pact or a meeting?;;;;;;;;;;;Âñòðå÷àÿñü ñ Âàìè ïî äîëãó ñëóæáû, [From.GetTitledFirstName] ðàññêàçûâàåò Âàì î ñâîèõ íàíèìàòåëÿõ. Ñåé÷àñ ýòî [merc_band_employer.GetTitledFirstName], è Âû ñëûøèòå òîëüêî ïîõâàëüíûå îòçûâû. Âåðîÿòíî èìååò ñìûñë îðãàíèçîâàòü âñòðå÷ó, ÷òîáû îáñóäèòü âîçìîæíûå ñîãëàøåíèÿ.;;x
EVTDESC_ZE_23154;To the [GetFromRootCompliment] [Root.GetFirstName],\n\nYour servant [FromFrom.GetTitledFirstName] has been speaking a great deal about you and your virtues. I would be delighted to meet you face to face and as such, I invite you to a grand feast to be held in your name.\n\n[From.GetTitledName];;;;;;;;;;;[Root.GetComplimentAdjectiveCap] [Root.GetFirstName],\n[FromFrom.GetTitledFirstName] î÷åíü õîðîøî îòçûâàåòñÿ î Âàñ. Åñëè Âû íå ïðîòèâ, ìû ìîãëè áû âòðåòèòüñÿ è îáñóäèòü íàøå ñîòðóäíè÷åñòâî ñ ãëàçó íà ãëàç. ß îðãàíèçóþ ïðàçäíèê â Âàøó ÷åñòü.\n [From.GetTitledName];;x
EVTDESC_ZE_23155;To the [GetFromRootCompliment] [Root.GetFirstName],\n\nI received your letter and read it with much joy. I would love to attend your feast, and will make preparations to depart shortly.\n\n[From.GetTitledName];;;;;;;;;;;[Root.GetComplimentAdjectiveCap] [Root.GetFirstName],\nÁëàãîäàðþ Âàñ çà ïðèãëàøåíèå. Êîíå÷íî, ÿ ïðèäó! Îòäàì ðàñïîðÿæåíèå íà÷àòü ïðèãîòîâëåíèÿ ê ñêîðåéøåìó îòáûòèþ.\nÑ óâàæåíèåì,\n [From.GetTitledName];;x
EVTDESC_ZE_23156;To the [GetFromRootCompliment] [Root.GetFirstName],\n\nI appreciate your letter and the effort you put into it. Unfortunately, I am afraid that I am unable to attend at this time.\n\n[From.GetTitledName];;;;;;;;;;;[Root.GetComplimentAdjectiveCap] [Root.GetFirstName],\nÁëàãîäàðþ Âàñ çà ïðèãëàøåíèå, íî ê ñîæàëåíèþ ÿ íå ñìîãó ïðèåõàòü ê Âàì â áëèæàéøåå âðåìÿ.\nÑ óâàæåíèåì,\n [From.GetTitledName];;x
EVTDESC_ZE_23157;When [FromFrom.GetTitledFirstName] arrived, you welcomed [FromFrom.GetHerHim] with great splendor and expressed your happiness of having [FromFrom.GetHerHim] there. The two of you ate and spoke at great length about all sorts of things. When it was time for [FromFrom.GetFirstName] to leave, you had not only decided on a non-aggression pact, but could also depart as friends!;;;;;;;;;;;Âû è íå äóìàëè, ÷òî êîãäà [FromFrom.GetTitledFirstName] ïðèáóäåò ê Âàì íà ïðàçäíèê, âñ¸ ïðîéä¸ò íàñòîëüêî õîðîøî. Âû åëè, ïèëè è âåñåëèëèñü, áåñåäóÿ íà ðàçíûå òåìû, à êîãäà ïðàçäíèê ïîäîø¸ë ê êîíöó, Âû ðàññòàëèñü õîðîøèìè äðóçüÿìè è ïîäïèñàëè ïàêò î íåíàïàäåíèè.;;x
EVTDESC_ZE_23158;When you arrived, [From.GetTitledFirstName] was there to welcome you in the most grandeur of ways. [From.GetSheHe] showed you inside, where you ate and spoke at great length and had a great time together. Both of you decided on a non-aggression pact and could also depart as friends!;;;;;;;;;;;Êîãäà Âû ïðèáûëè íà ïðàçäíèê, òî è ïîäóìàòü íå ìîãëè, ÷òî [From.GetTitledFirstName] òàê õîðîøî âñ¸ îðãàíèçóåò. Âû åëè, ïèëè è âåñåëèëèñü, áåñåäóÿ íà ðàçíûå òåìû, à êîãäà ïðàçäíèê ïîäîø¸ë ê êîíöó, Âû ðàññòàëèñü õîðîøèìè äðóçüÿìè è ïîäïèñàëè ïàêò î íåíàïàäåíèè.;;x
EVTOPTA_ZE_23000;I suppose I could use some help...;;;;;;;;;;;Áëàãîäàðþ, ïîìîùü ìíå íå ïîìåøàåò...;;x
EVTOPTA_ZE_23001;I wasn't doing anything important anyway.;;;;;;;;;;;Âñ¸ ðàâíî ó ìåíÿ ñåé÷àñ íåò ðàáîòû.;;x
EVTOPTA_ZE_23002;Ha! Well good luck with that work of yours!;;;;;;;;;;;Õà! Íó óäà÷è ñ ðàáîòîé!;;x
EVTOPTA_ZE_23005;I could run to [helping_vassal.GetTitledFirstName] and hide there!;;;;;;;;;;;[helping_vassal.GetTitledFirstName]. Íàäî íàéòè [helping_vassal.GetHersHis]!;;x
EVTOPTA_ZE_23005_custom_tooltip_a;Run for safety at the nearby residence of [helping_vassal.GetTitledFirstName] and hope that [helping_vassal.GetSheHe] will help.;;;;;;;;;;;Íàäåÿòüñÿ, ÷òî [helping_vassal.GetTitledFirstName] ïîìîæåò è áåæàòü ê [helping_vassal.GetHersHis] áëèæàéøåé ðåçèäåíöèè.;;x
EVTOPTA_ZE_23005_custom_tooltip_b;[Root.GetTitledName] getting away safely;;;;;;;;;;;[Root.GetTitledName] èçáåæèò îïàñíîñòè è ñêðîåòñÿ;;x
EVTOPTA_ZE_23006;Quickly! Over here!;;;;;;;;;;;Ñêîðåå! Ñþäà!;;x
EVTOPTA_ZE_23007;Thank you! I owe you one.;;;;;;;;;;;Âû ñïàñëè ìåíÿ! ß ó Âàñ â äîëãó.;;x
EVTOPTA_ZE_23008;Why that little...;;;;;;;;;;;[GetRootFromInsult]!;;x
EVTOPTA_ZE_23101;Send equipment for heavy infantry.;;;;;;;;;;;Ñíàáäèòü òÿæ¸ëóþ ïåõîòó;;x
EVTOPTA_ZE_23106;Send more soldiers.;;;;;;;;;;;Ïîñëàòü ñîëäàò;;x
EVTOPTA_ZE_23152;I shall write a letter at once!;;;;;;;;;;;ß íàïèøó [merc_band_employer.GetHerHim].;;x
EVTOPTA_ZE_23154;Of course I shall attend!;;;;;;;;;;;Èíòåðåñíî! Äóìàþ, ìíå ñòîèò ïîéòè.;;x
EVTOPTA_ZE_23155;Splendid!;;;;;;;;;;;Ïðåêðàñíî!;;x
EVTOPTA_ZE_23156;How disappointing.;;;;;;;;;;;Î÷åíü æàëü.;;x
EVTOPTA_ZE_23157;Let us do this again sometime!;;;;;;;;;;;Íàäî êàê-íèáóäü ïîâòîðèòü!;;x
EVTOPTA_ZE_23158;I was glad to have accepted your invitation!;;;;;;;;;;;Áëàãîäàðþ çà âå÷åð! Äî íîâûõ âñòðå÷!;;x
EVTOPTB_ZE_23000;No! I can manage!;;;;;;;;;;;Íåò! ß ñïðàâëþñü!;;x
EVTOPTB_ZE_23005;Maybe I can just outrun them?;;;;;;;;;;;Ïîðà áåæàòü!;;x
EVTOPTB_ZE_23006;I'm not getting involved in this!;;;;;;;;;;;Ìíå íå íóæíû ïðîáëåìû!;;x
EVTOPTB_ZE_23101;Send equipment for pikemen.;;;;;;;;;;;Ñíàáäèòü êîïåéùèêîâ;;x
EVTOPTB_ZE_23106;Send more cavalry.;;;;;;;;;;;Ïîñëàòü êîííèöó;;x
EVTOPTB_ZE_23152;This person is of no interest to me.;;;;;;;;;;;Ýòî ìíå íåèíòåðåñíî.;;x
EVTOPTB_ZE_23154;I have no interest in such an arrangement.;;;;;;;;;;;Ìíå ýòî íå íóæíî.;;x
EVTOPTC_ZE_23101;Send equipment for heavy cavalry.;;;;;;;;;;;Ñíàáäèòü òÿæ¸ëóþ êîííèöó;;x
EVTOPTD_ZE_23101;I changed my mind.;;;;;;;;;;;Íî ýòî áåññìûñëåííî;;x
EVTDESC_ZE_22300;While passing judgement onto criminals from the safety of your throne, a young noble is brought before you. You quickly come to the conclusion that the man is indeed guilty. Condemning him might not be the wisest choice, as he is of noble birth. If you were to pardon the man he might prove himself useful to you, as he would be in your debt.;;;;;;;;;;;Ïîëüçóÿñü ïðèâèëåãèåé ïðàâèòåëÿ, Âû, êàê ýòî îáû÷íî áûâàåò, ñóäèòå ïîäîçðåâàåìûõ â ïðåñòóïëåíèÿõ. Ïåðåä Âàìè ïðåäñòàë ìîëîäîé àðèñòîêðàò è âñêîðå Âû ïîíÿëè - ýòîò ÷åëîâåê íåñîìíåííî âèíîâåí. Íî âîçìîæíî, â ïîäîáíîé ñèòóàöèè ïðàâîñóäèå - íå ñàìîå ìóäðîå ðåøåíèå. Âåäü åñëè ïîìèëîâàòü áëàãîðîäíîãî ÷åëîâåêà, îí áóäåò ïåðåä Âàìè â äîëãó.;;x
EVTDESC_ZE_22400;During a particularly heated argument in the council, [target_saved_voter.GetTitledFirstName] stepped in as you were about to make a fool out of yourself. [target_saved_voter.GetSheHeCap] was able to argue for your point, not only saving your face but also winning the argument for you! It is obvious that [target_saved_voter.GetFirstName]'s smooth talking was the sole reason for your success, and denying that fact would likely paint you in a bad light.;;;;;;;;;;;Â ñîâåòå æàðêèå ñïîðû, è âîò [target_saved_voter.GetTitledFirstName] âçÿë[target_saved_voter.GetEndA] ñëîâî êàê ðàç â òîò ìîìåíò, êîãäà Âû ÷óòü áûëî íå âûñòàâèëè ñåáÿ â äóðíîì ñâåòå, åäâà íå óñïåâ ëÿïíóòü êàêóþ-òî ãëóïîñòü. Óâåðåííûìè è óáåäèòåëüíûìè àðãóìåíòàìè, [target_saved_voter.GetFirstName] íå òîëüêî ñïàñ[target_saved_voter.GetNoneE] Âàøó ðåïóòàöèþ, íî è ïîáåäèë[target_saved_voter.GetEndA] â ñïîðå! Î÷åâèäíî, ÷òî [target_saved_voter.GetHersHis] êðàñíîðå÷èå - åäèíñòâåííàÿ ïðè÷èíà Âàøåãî óñïåõà.;;x
EVTDESC_ZE_22410;During a particularly heated argument in the council, you stepped in as [From.GetBestName] was making a fool of [From.GetHerselfHimself]. You managed to soothe the debaters and win the argument for [From.GetHerHim]. This turned out to be a great move on your part, as [From.GetSheHe] now feels indebted to you!;;;;;;;;;;;Â ñîâåòå æàðêèå ñïîðû, è Âû âñòðÿëè êàê ðàç â òîò ìîìåíò, êîãäà [From.GetBestName] ñîáèðà[From.GetLasLsya] âûñòàâèòü ñåáÿ â äóðíîì ñâåòå, ëÿïíóâ êàêóþ-òî ãëóïîñòü. Âû ïîáåäèëè â ñïîðå è ñïàñëè [From.GetHersHis] ðåïóòàöèþ. Îêàçàëîñü, ýòî áûë ìóäðûé øàã ñ Âàøåé ñòîðîíû, âåäü [From.GetSheHe] òåïåðü â äîëãó ïåðåä Âàìè!;;x
EVTDESC_ZE_22420;During a particularly heated argument in the council, you stepped in as [From.GetBestName] was making a fool of [From.GetHerselfHimself]. You managed to soothe the debaters and win the argument for [From.GetHerHim]. Though this only infuriated [From.GetHerHim], as [From.GetSheHe] wanted to win the argument by [From.GetHerHis] own means! Throwing a tantrum like this has publicly shamed [From.GetFirstName].;;;;;;;;;;;Â ñîâåòå æàðêèå ñïîðû, è Âû âñòðÿëè êàê ðàç â òîò ìîìåíò, êîãäà [From.GetBestName] ñîáèðà[From.GetLasLsya] âûñòàâèòü ñåáÿ â äóðíîì ñâåòå, ëÿïíóâ êàêóþ-òî ãëóïîñòü. Âû ïîáåäèëè â ñïîðå è ñïàñëè [From.GetHersHis] ðåïóòàöèþ. Íî â èòîãå ýòî åù¸ áîëüøå ðàçîçëèëî [From.GetHersHis], è íåëåïûé áàëàãàí, ïîñëåäîâàâøèé çà âñåì ýòèì ñòàë [From.GetHersHis] ëè÷íûì ïîçîðîì.;;x
EVTDESC_ZE_22500;As the council meeting ends, [target_pious_voter.GetTitledFirstName] pulls you to the side. [target_pious_voter.GetSheHeCap] talks to you at length about the need to respect the authority of [Root.Religion.GetScriptureName] when making decisions in the council. Apparently the council is in agreement on you having neglected to do so, but fortunately [target_pious_voter.GetFirstName] offers to help you!;;;;;;;;;;;"Çàñåäåíèå ñîâåòà ïîäîøëî ê êîíöó, è [target_pious_voter.GetTitledFirstName] ïîçâàë[target_pious_voter.GetEndA] Âàñ íà ïàðó ñëîâ: ""Òàê íåëüçÿ! [Root.Religion.GetScriptureName] - âåëèêèé èñòî÷íèê ìóäðîñòè! Âàì íóæíî ÷àùå ïðèñëóøèâàòüñÿ ê ñâÿòîìó ñëîâó â ïðèíÿòèè âàæíûõ ðåøåíèé."" Ñîâåò òàê æå ñ÷èòàåò, ÷òî Âû ïåðåãíóëè ïàëêó, íî [target_pious_voter.GetFirstName] õî÷åò Âàì ïîìî÷ü.";;x
EVTDESC_ZE_22510;The council agreed that [From.GetBestName] had been acting in a very impious way, ignoring many wisdoms of [Root.Religion.GetScriptureName]. Being a pious [Root.GetManWoman] you decided to help [From.GetHerHim] not repeat the same mistakes. [From.GetFirstName] was very grateful for this help, and told you that [From.GetSheHe] was in your debt!;;;;;;;;;;;Ñîâåò ñ÷èòàåò, ÷òî [From.GetBestName] âåä¸ò ñåáÿ êðàéíå íåáëàãî÷åñòèâî, [Root.Religion.GetScriptureName] äëÿ í[From.GetHersHis] - ëèøü ñîáðàíèå ãëóïûõ ñêàçîê. Âû - ÷åëîâåê íàáîæíûé è õîòèòå ïîìî÷ü [From.GetHerHim] íå ïîâòîðÿòü ïðåæíèõ îøèáîê. [From.GetFirstName] âûðàçèë[From.GetEndA] Âàì ñâîþ ïðèçíàòåëüíîñòü è óâåðèë[From.GetEndA], ÷òî Âû ìîæåòå ðàñ÷èòûâàòü íà îòâåòíóþ óñëóãó ñ [From.GetHersHis] ñòîðîíû.;;x
EVTDESC_ZE_22520;The council agreed that [From.GetBestName] had been acting in a very impious way, ignoring many wisdoms of [Root.Religion.GetScriptureName]. Being a pious [Root.GetManWoman] you decided to help [From.GetHerHim] not repeat the same mistake. Though, [From.GetFirstName] was infuriated by what [From.GetSheHe] assumed to be you trying to trick [From.GetHerHim]!;;;;;;;;;;;Ñîâåò ñ÷èòàåò, ÷òî [From.GetBestName] âåä¸ò ñåáÿ êðàéíå íåáëàãî÷åñòèâî, [Root.Religion.GetScriptureName] äëÿ í[From.GetHersHis] - ëèøü ñîáðàíèå ãëóïûõ ñêàçîê. Âû - ÷åëîâåê íàáîæíûé è õîòèòå ïîìî÷ü [From.GetHerHim] íå ïîâòîðÿòü ïðåæíèõ îøèáîê. Íî [From.GetFirstName] ÿñíî äàë[From.GetEndA] Âàì ïîíÿòü, ÷òî íå èçìåíèò ñâî¸ ìíåíèå î ðîëè ðåëèãèè â ãîñóäàðñòâå.;;x
EVTDESC_ZE_22600;Word has reached you of a [target_foreign_voter.GetJobTitle] in a foreign realm who is of masterful skill and handles [target_foreign_voter.GetHerHis] tasks with ease. Seeing as your own abilities are often doubted by the rest of the Council, perhaps you should write a letter to this '[target_foreign_voter.GetBestName]' and ask for [target_foreign_voter.GetHerHis] advice?;;;;;;;;;;;Äî Âàñ äîøëè ñëóõè, ÷òî ãäå-òî â äàë¸êèõ êðàÿõ åñòü [target_foreign_voter.GetJobTitle] ñ õîðîøèìè íàâûêàìè - [target_foreign_voter.GetBestName] ëåãêî ñïðàâëÿåòñÿ ñî ñâîåé ðàáîòîé, íå òî ÷òî Âû. Âîçìîæíî ñòîèò íàïèñàòü [target_foreign_voter.GetHerHim] è ïîñîâåòîâàòüñÿ?;;x
EVTDESC_ZE_22610;To the masterful [Root.GetTitledFirstName],\nI am [From.GetTitledFirstName], [From.GetJobTitle] of [From.Liege.GetTitledFirstName].\nYour skill as a [Root.GetJobTitle] on the Council of [Root.Liege.GetTitledFirstName] is known far and wide. I implore you to advise me in matters of politics, so that I may serve my liege as admirably as you serve yours.\n\nRegards,\n[From.GetTitledName];;;;;;;;;;;Ïðèâåòñòâóþ, [Root.GetTitledFirstName].\nÂàì ïèøåò [From.GetTitledFirstName], [From.GetJobTitle] [From.Liege.PrimaryTitle.GetAdjective]ñêîãî Ñîâåòà.\nÂàøè âûäàþùèåñÿ íàâûêè øèðîêî èçâåñòíû â íàøèõ êðàÿõ, è ÿ ñìèðåííî ïðîøó Âàñ äàòü ìíå äåëüíûé ñîâåò ïî âîïðîñàì ïîëèòèêè, ÷òîáû ïîñëóæèòü ñâîåé ñòðàíå òàêæå õîðîøî, êàê ýòî äåëàåòå Âû.\nÑ óâàæåíèåì,\n [From.GetTitledName];;x
EVTDESC_ZE_22620;To the [GetFromRootCompliment] [Root.GetFirstName],\n\nI agree to lend you advice on how to serve on the Council more effectively. Along with this letter I have enclosed a book which treatise my own experience as a [From.GetJobTitle], I hope its contents will serve you well!\n\nRegards,\n[From.GetTitledName];;;;;;;;;;;"[Root.GetComplimentAdjectiveCap] [Root.GetFirstName].\nß ñ ðàäîñòüþ ïîìîãó Âàì. Ê ýòîìó ïèñüìó ÿ ïðèëàãàþ íåáîëüøóþ êíèãó. ""[From.GetLordLadyCap] [From.GetJobTitle]"" îïèñûâàåò ìîé ëè÷íûé îïûò â äîëæíîñòè ñîâåòíè[From.GetTsyKa]. Íàäåþñü, ýòî ïîìîæåò Âàì íà ñëóæáå.\nÑ óâàæåíèåì,\n [From.GetTitledName]";;x
EVTDESC_ZE_22630;To the [GetFromRootInsult] [Root.GetFirstName],\n\nDo you really think I would convey my secrets to you? You are a pathetic [From.GetJobTitle] and I do not see that changing soon!\n\nSincerely,\n[From.GetTitledName];;;;;;;;;;;[Root.GetInsultAdjective] [Root.GetFirstName].\nÂû ïðàâäà äóìàåòå, ÷òî ÿ âûäàì Âàì ñâîè ñåêðåòû? Âû - ïîñðåäñòâåííîñòü... Íàäåþñü, [From.Liege.GetTitledFirstName] è [From.GetCouncilName] ïðîäîëæàò èãíîðèðîâàòü ñåé î÷åâèäíûé ôàêò.\nÏîäïèñü:\n [From.GetTitledName];;x
EVTDESC_ZE_22640;To the [GetFromRootCompliment] [Root.GetFirstName],\n\nKnow that I will never forget what you did for me! Please do not hesitate to ask if there is anything I can do for you, and know I will treat you like the dearest of friends.\n\nSincerely,\n[From.GetTitledName];;;;;;;;;;;[Root.GetComplimentAdjectiveCap] [Root.GetFirstName].\nÇíàéòå, ÿ íèêîãäà íå çàáóäó òîãî, ÷òî Âû äëÿ ìåíÿ ñäåëàëè! Åñëè ÿ ÷òî-òî ìîãó äëÿ Âàñ ñäåëàòü, ïîæàëóéñòà, îáðàùàéòåñü â ëþáîé ìîìåíò.\nÑ óâàæåíèåì,\n [From.GetTitledName];;x
