#CODE;ENGLISH;;;;;;;;;;;RUSSIAN;;x
EVTDESC_HF_12001;"For [Root.Society.GetName]! I proclaim, raising my glass. The cheers around the table are boisterous and the air hangs heavy with anticipation. ""There is nothing left here to conquer!"" someone laughs. Raising an eyebrow conspiratorially, [fellow_hero_1.GetFirstName] murmurs: ""Have you ever been to [target_title.GetName]?""";;;;;;;;;;;— Çà [Root.GetSocietyNameGEN]! — âîñêëèêíóë[Root.GetEndA] ÿ, ïîäíÿâ ñâîé áîêàë. Âîêðóã ðàçäàëèñü áóðíûå àïëîäèñìåíòû, â âîçäóõå ïîâèñëà òÿæåñòü ïðåäâêóøåíèÿ.\n— Òåïåðü íå îñòàëîñü íè÷åãî, ÷òî ìîæíî áûëî áû çàâîåâàòü! — âûêðèêíóë êòî-òî è ðàññìåÿëñÿ.\n— Âû êîãäà-íèáóäü áûâàëè â [target_title.GetAdjective]ñêèõ êðàÿõ? — ïðîáîðìîòàë[fellow_hero_1.GetEndA] [fellow_hero_1.GetFirstName], çàãîâîðùè÷åñêè ïðèïîäíÿâ áðîâü.;;x
EVTDESC_HF_12002;[original_hero.GetTitledFirstName] has declared that the highest ranking members of [Root.Society.GetName] are to go on an adventure, into [target_ruler.PrimaryTitle.GetName], the lands of [target_ruler.GetTitledFirstName]. After the cheers have gone around the table, I am left with my thoughts.;;;;;;;;;;;[original_hero.GetTitledFirstName] îáúÿâèë[original_hero.GetEndA], ÷òî ñàìûå âûñîêîðàíãîâûå [Root.Society.GetName] äîëæíû îòïðàâèòüñÿ â [target_ruler.PrimaryTitle.GetAdjective]ñêèå çåìëè â ïîèñêàõ ñëàâû è ïðèêëþ÷åíèé. Óñëûøàâ îäîáðèòåëüíûå âîçãëàñû, ÿ îñòà[Root.GetLasLsya] íàåäèíå ñî ñâîèìè ìûñëÿìè.;;x
EVTDESC_HF_12005_A;"[giving_member.GetTitledFirstName] approaches me, as I am poring over some maps of [target_title.GetName]. A servant alerts me to [giving_member.GetHerHis] visit, and as I glance up from the table, I notice they are carrying something wrapped in fine fabric. ""For the battles to come"", the [giving_member.GetManWoman] says, without further ceremony.";;;;;;;;;;;[giving_member.GetTitledFirstName] ïîäîø[giving_member.GetLaYol] êî ìíå, ïîêà ÿ áûë[Root.GetEndA] ïîãëîùåí[Root.GetEndA] èçó÷åíèåì [target_title.GetAdjective]ñêèõ êàðò. Ñëóãà îïîâåñòèë ìåíÿ î [giving_member.GetHersHis] âèçèòå è, ïîäíÿâ âçãëÿä îò ñòîëà, ÿ çàìåòèë[Root.GetEndA], ÷òî îí ïðèíåñ[giving_member.GetNoneE] ÷òî-òî çàâåðíóòîå â òîíêóþ òêàíü.\n— Äëÿ ãðÿäóùèõ áèòâ, — áåç ëèøíèõ öåðåìîíèé ñêàçàë[giving_member.GetEndA] [giving_member.GetSheHe].;;x
EVTDESC_HF_12006;"My history in battle is known to many, but there are still those who could benefit from learning more about my experiences. ""Like that time you chopped someone's head off?"" [fellow_member.GetTitledFirstName] asks, in response to my idea. ""A feast, where you regale your court with the stories!"" [fellow_member.GetSheHe] continues. I consider the spirits it could lift, as I soon depart for [target_title.GetName].";;;;;;;;;;;Èñòîðèÿ ìîèõ áèòâ èçâåñòíà ìíîãèì, íî åñòü òå, êòî ìîã áû óçíàòü áîëüøå, ïåðåíèìàÿ ìîé îïûò.\n— Ýòî êàê â òîò ðàç, êîãäà òû ñíåñ[Root.GetNoneE] êîìó-òî áàøêó â áîþ? — êàê-òî ðàç ñêàçàë[fellow_member.GetEndA] [fellow_member.GetTitledFirstName] â îòâåò íà ìîþ èäåþ.\n— Îáîæàþ òâîè áàéêè, êàê è âåñü òâîé äâîð! — ïðîäîëæèë[fellow_member.GetEndA] [fellow_member.GetSheHe].\nÄóìàþ, ýòî íåïëîõî ïîäíèìàåò áîåâîé äóõ ïåðåä ïóòåøåñòâèåì â [target_title.GetAdjective]ñêèå çåìëè.;;x
EVTDESC_HF_12007;"To bolster [fellow_member.GetHerHis] confidence for our adventure into [target_title.GetName], I am showing [fellow_hero_1.GetTitledFirstName] around my trophy room. ""You are... a collector of skulls then"", the [fellow_hero_1.GetManWoman] comments, before interrupting [fellow_member.GetHerselfHimself]: ""Oh, but this one would make a fine chalice!"".";;;;;;;;;;;[fellow_hero_1.GetTitledFirstName] îöåíèë[fellow_hero_1.GetEndA] òðîôåéíóþ êîìíàòó, êîòîðóþ ÿ [fellow_hero_1.GetHerHim] ïðîäåìîíñòðèðîâàë[Root.GetEndA], ÷òîáû ïîäêðåïèòü [fellow_member.GetHersHis] óâåðåííîñòü â íàøåì [target_title.GetAdjective]ñêîì ïîõîäå.\n— Çíà÷èò, Âû... êîëëåêöèîíèðóåòå ÷åðåïà, — ïðîáîðìîòàë[fellow_hero_1.GetEndA] [fellow_hero_1.GetSheHe], à ïîòîì äîáàâèë[fellow_hero_1.GetEndA]. — Èç ýòîãî ïîëó÷èëñÿ áû îòëè÷íûé êóáîê!.;;x
EVTDESC_HF_12008;"Out [Root.GetRidingMarching] with [fellow_member.GetTitledFirstName], my eagle by my side, the [fellow_member.GetManWoman] showers both me and my bird with compliments. ""You make a great team"", [fellow_member.GetTitledFirstName] concludes.";;;;;;;;;;;Êîãäà ìû ïðîãóëèâàëèñü ïî îòêðûòîé ìåñòíîñòè, [fellow_member.GetTitledFirstName] âûðàçèë[fellow_member.GetEndA] âîñõèùåíèå ìîèì îðëîì.\n— Èç âàñ ïîëó÷èëàñü îòëè÷íàÿ êîìàíäà, — îòìåòèë[fellow_member.GetEndA] [fellow_member.GetSheHe].;;x
EVTDESC_HF_12009;"The time has come for us to move into enemy territory. [fellow_member.GetTitledFirstName] and I are toasting once more, to [Root.Society.GetName]. ""We shall find their most experienced warriors, and show them what it means to be [Root.Culture.GetName]!"" I declare. ""Everyone shall know our name!"" [fellow_member.GetSheHe] agrees, slamming [fellow_member.GetHerHis] fist into the table.";;;;;;;;;;;Ïðèøëî âðåìÿ íàì âòîðãíóòüñÿ íà âðàæåñêóþ òåððèòîðèþ. [fellow_member.GetTitledFirstName] è ÿ ñíîâà ïîäíÿëè êóáêè çà [Root.GetSocietyNameGEN].\n— Ìû íàéä¸ì ñàìûõ îïûòíûõ âîèíîâ è ïîêàæåì èì âñþ íàøó ìîùü! — âîñêëèêíóë[Root.GetEndA] ÿ.\n— Êàæäûé óçíàåò î íàñ! — ñîãëàñè[fellow_member.GetLasLsya] [fellow_member.GetSheHe], óäàðèâ êóëàêîì ïî ñòîëó.;;x
EVTDESC_HF_12010_A;We are camped [target_ruler.Capital.GetInOn] the [target_ruler.Capital.GetTerrain], on our way to [target_title.GetName]. While I am scouting the perimeter, I hear the sound of fighting. As I lean out from behind a [target_ruler.Capital.GetTreeRockFence], I spot a [my_duel_target.GetManWoman] wrestling a [target_ruler.Capital.GetRegionalBigAnimal]! And winning...!;;;;;;;;;;;Ìû ðàçáèëè ëàãåðü [target_ruler.Capital.GetInOnWonderTerrain] [target_ruler.Capital.GetWonderTerrainPREP] ïî ïóòè ê [target_title.GetAdjective]ñêèì çåìëÿì. Â êàêîé-òî ìîìåíò, êîãäà îñìàòðèâàë[Root.GetEndA] îêðåñòíîñòè, ÿ óñëûøàë[Root.GetEndA] çâóêè áèòâû. Âûñóíóâøèñü èç-çà [target_ruler.Capital.GetTreeRockFenceGEN], ÿ óâèäåë[Root.GetEndA], êàê [my_duel_target.GetAgedPerson] ñðàæà[my_duel_target.GetLasLsya] ñ[target_ruler.Capital.GetEndORegionalBigAnimalINS] [target_ruler.Capital.GetRegionalBigAnimalINS]! È ïîáåäèë[my_duel_target.GetEndA] åãî!;;x
EVTDESC_HF_12010_B;"Having spent the evening drinking and talking around the campfire with my traveling companions, I finally bid them good night. On my way back to my sleeping spot, I pause. Nearby, leaning against a [target_ruler.Capital.GetTreeRockFence], is a [my_duel_target.GetManWoman] tending to nature's call. ""An enemy!"" I yell, more surprised than alarmed.";;;;;;;;;;;"Ïðîâåäÿ âå÷åð çà íàïèòêàìè è ðàçãîâîðàìè ó êîñòðà ñ ìîèìè ïîïóò÷èêàìè, ÿ, íàêîíåö-òî, ïîæåëàë[Root.GetEndA] èì ñïîêîéíîé íî÷è. Íà îáðàòíîì ïóòè ê ñâîåé ïàëàòêå ÿ çàìåòèë[Root.GetEndA] [my_duel_target.GetAgedPersonACC], ñòîÿâø[my_duel_target.GetUyuEgo] âîçëå [target_ruler.Capital.GetTreeRockFenceGEN], âíèìàÿ çîâó ïðèðîäû. ""Çäåñü âðàã!"" — óäèâë¸ííî ïðîêðè÷àë[Root.GetEndA] ÿ.";;x
EVTDESC_HF_12010_C;"Walking through the streets of a village in [target_ruler.Capital.GetName], the locals seem eager to point out how foreign I am. They have clearly never seen a [Root.GetManWoman] like me before, and while some are adoring my armor and confident stride, it does not take long before I encounter open hostility. ""Go home!"" one [my_duel_target.GetManWoman] barks.";;;;;;;;;;;Ïðîõîäÿ ïî [target_ruler.Capital.County.GetAdjective]ñêèì óëèöàì, ÿ îáðàòèë[Root.GetEndA] âíèìàíèå, êàê ìåñòíûå æèòåëè îòìå÷àþò ìî¸ èíîñòðàííîå ïðîèñõîæäåíèå. Î÷åâèäíî, îíè íèêîãäà íå âèäåëè òàê[Root.GetUyuOgo] [Root.GetAgedPersonACC], êàê ÿ, è õîòÿ íåêîòîðûå âîñõèùàþòñÿ ìîèìè äîñïåõàìè è óâåðåííîé ïîõîäêîé, ïîðîé ÿ ñòàëêèâàþñü ñ îòêðûòîé âðàæäåáíîñòüþ.\n— Âàëè äîìîé! — ïðîêðè÷àë[my_duel_target.GetEndA] êàê[my_duel_target.GetAyaOy]-òî [my_duel_target.GetAgedPersonM].;;x
EVTDESC_HF_12010_D;Having turned in for the night, I find myself wide awake listening to the snoring of [fellow_member.GetTitledFirstName]. Just as I am about to get up and do something about my irritation, I hear a rustling in the bushes. Before I can get to my feet, I find a [my_duel_target.GetManWoman] leaning over me, eying me suspiciously, a weapon aimed at my throat.;;;;;;;;;;;[fellow_member.GetTitledFirstName] çàõðàïåë[fellow_member.GetEndA] òàê ãðîìêî, ÷òî ÿ ïðîñíó[Root.GetLasLsya]. Ðàçäðàæ¸ííî ïðîáóð÷àâ ñåáå ïîä íîñ, ÿ óæå ñîáðà[Root.GetLasLsya] âñòàòü, êàê âäðóã óñëûøàë[Root.GetEndA] ñòðàííûé øîðîõ â êóñòàõ. Íå óñïåë[Root.GetEndA] ÿ îáåðíóòüñÿ, êàê íàêîíåö çàìåòèë[Root.GetEndA] [my_duel_target.GetAgedPersonMACC], ñêëîíèâø[my_duel_target.GetUyuEgo]ñÿ íàäî ìíîé è íàïðàâèâø[my_duel_target.GetUyuEgo] íà ìåíÿ îðóæèå.;;x
EVTDESC_HF_12010_E;"The finest warrior around? Well, that would be [my_duel_target.GetTitledFirstName], [Root.GetMasterMistress], a little [Root.GetBoyGirl] says. [fellow_member.GetFirstName] fishes a coin from [fellow_member.GetHerHis] pockets, rewarding the urchin for the information. ""There [my_duel_target.GetSheHe] is!"" the child suddenly cries, pointing at a [my_duel_target.Culture.GetName] [my_duel_target.GetManWoman] down the street.";;;;;;;;;;;— Ëó÷øèé âîèí â îêðóãå? Ýòî [my_duel_target.GetTitledFirstName], — îòâåòèë ìàëü÷èøêà. [fellow_member.GetFirstName] âûóäèë ìîíåòó èç êàðìàíà, íàãðàäèâ îáîðâàíöà çà èíôîðìàöèþ.\n— Âîò [my_duel_target.GetSheHe], [Root.GetUncleAuntFOA]! — êðèêíóë ïàðíèøêà, óêàçàâ ïàëüöåì íà [my_duel_target.GetAgedPersonMACC] äðóãîé ñòîðîíå óëèöû.;;x
EVTDESC_HF_12010_F;"Walking through the streets of a village in [target_ruler.Capital.GetName], the locals seem eager to point out how foreign I am. They have clearly never seen a [Root.GetManWoman] like me before, and while some are adoring my armor and confident stride, it does not take long before I encounter open hostility. ""Go home!"" one [my_duel_target.GetManWoman] barks.";;;;;;;;;;;Ïðîõîäÿ ïî [target_ruler.Capital.County.GetAdjective]ñêèì óëèöàì, ÿ îáðàòèë[Root.GetEndA] âíèìàíèå, êàê ìåñòíûå æèòåëè îòìå÷àþò ìî¸ èíîñòðàííîå ïðîèñõîæäåíèå. Î÷åâèäíî, îíè íèêîãäà íå âèäåëè òàê[Root.GetUyuOgo] [Root.GetAgedPersonACC], êàê ÿ, è õîòÿ íåêîòîðûå âîñõèùàþòñÿ ìîèìè äîñïåõàìè è óâåðåííîé ïîõîäêîé, ïîðîé ÿ ñòàëêèâàþñü ñ îòêðûòîé âðàæäåáíîñòüþ.\n— Âàëè äîìîé! — ïðîêðè÷àë[my_duel_target.GetEndA] êàê[my_duel_target.GetAyaOy]-òî [my_duel_target.GetAgedPersonM].;;x
EVTDESC_HF_12010_X;"I have been following a rumor, trying to track down what is supposed to be the most feared fighter in [target_ruler.PrimaryTitle.GetName]. A deadly fencer, I'm told. ""You go to your death!"" an innkeeper warns. Yet, when [combatant_2.GetSheHe]'s pointed out to me, I find myself face to face with a hunched elderly [combatant_2.GetManWoman], eyeing me suspiciously.";;;;;;;;;;;"ß âíèìàòåëüíî ñëåäèë[Root.GetEndA] çà ñëóõàìè, ïûòàÿñü íàéòè òîãî, êòî ÿêîáû ÿâëÿåòñÿ ñàìûì îïàñíûì áîéöîì â [target_ruler.PrimaryTitle.GetAdjective]ñêèõ çåìëÿõ. Ñìåðòîíîñíûé ôåõòîâàëüùèê, êàê ìíå ñêàçàëè. ""Òû èä¸øü íà ñìåðòü!"" — ïðåäóïðåäèë ìåíÿ òðàêòèðùèê. Îäíàêî, êîãäà ìíå óêàçàëè íà í[combatant_2.GetHersHis], ÿ îêàçà[Root.GetLasLsya] ëèöîì ê ëèöó ñî ñãîðáëåíí[combatant_2.GetOyYm] ïîæèë[combatant_2.GetOyYm] [combatant_2.GetAgedPersonINS], êîòîð[combatant_2.GetAyaYy] ñìîòðåë[combatant_2.GetEndA] íà ìåíÿ ñ ïîäîçðåíèåì.";;x
EVTDESC_HF_12010_Y;"I've partaken in a local tournament, and I have been knocking out [target_ruler.Culture.GetName] fighters with ease. Grinning, I search the crowd for the face of [fellow_member.GetFirstName], who has been cheering me on. I find [fellow_member.GetHerHim] looking a bit pale. Turning to face my final foe I hear someone shouting an introduction: ""[combatant_2.GetBestName]!""";;;;;;;;;;;"Ó÷àñòâóÿ â ìåñòíîì òóðíèðå, ÿ ñ ë¸ãêîñòüþ ïîáåæäàë[Root.GetEndA] [target_ruler.PrimaryTitle.GetAdjective]ñêèõ áîéöîâ. Óõìûëüíóâøèñü, ÿ íàø[Root.GetLaYol] â òîëïå çíàêîìîå ëèöî - ýòî áûë[fellow_member.GetEndA] [fellow_member.GetFirstName], êîòîð[fellow_member.GetAyaYy] ðàíüøå ïîäáàäðèâàë[fellow_member.GetEndA] ìåíÿ. [fellow_member.GetSheHeCap] âûãëÿäåë[fellow_member.GetEndA] íåìíîãî áëåäí[fellow_member.GetOyYm]. Ïîâåðíóâøèñü ëèöîì ê ñâîåìó ïîñëåäíåìó ïðîòèâíèêó, ÿ óñëûøàë[Root.GetEndA] êàê êòî-òî êðèêíóë: ""[combatant_2.GetTitledFirstNameWithNick]!""";;x
EVTDESC_HF_12010_Z;"Rumors of my adventures have been spreading here in [target_title.GetName] and I have received a personal invite from [target_ruler.GetTitledFirstName], to appear at [target_ruler.GetHerHis] court. ""To the brute [Root.GetFirstName]. If you insist on causing trouble like this, you will fight someone I choose"", the pompous messenger reads.";;;;;;;;;;;"[target_title.GetAdjective]ñêèå çåìëè ïîëíÿòñÿ ñëóõàìè î ìîèõ ïðèêëþ÷åíèÿõ. [target_ruler.GetTitledFirstName] ïðèãëàñèë[target_ruler.GetEndA] ìåíÿ ê ñâîåìó äâîðó. ""Æåñòîê[Root.GetAyaIy] [Root.GetFirstName]. Åñëè Âû ïëàíèðóåòå è âïðåäü ïðè÷èíÿòü ïîäîáíûå íåïðèÿòíîñòè, ÿ ñàì[target_ruler.GetEndA] âûáåðó Âàì îïïîíåíòà!"", — âîñêëèêíóë ïîñëàííèê.";;x
EVTDESC_HF_12011;"[original_hero.GetTitledFirstName] has declared that the highest ranking members of [Root.Society.GetName] are to go on an adventure, into [target_ruler.PrimaryTitle.GetName], the lands of [target_ruler.GetTitledFirstName]. ""You still have some growing to do, [Root.GetFirstName]"", [original_hero.GetSheHe] tells me, before raising [original_hero.GetHerHis] mug again.";;;;;;;;;;;[original_hero.GetTitledFirstName] îáúÿâèë[original_hero.GetEndA], ÷òî ñàìûå âûñîêîïîñòàâëåííûå [Root.Society.GetName] äîëæíû îòïðàâèòüñÿ â ïðèêëþ÷åíèå â [target_ruler.PrimaryTitle.GetAdjective]ñêèå çåìëè, êîòîðûìè ïðàâèò [target_ruler.GetTitledFirstName].\n— Âàì åù¸ åñòü íàä ÷åì ïîðàáîòàòü, [Root.GetFirstName], — ñêàçàë[original_hero.GetEndA] ìíå [original_hero.GetSheHe], ïðåæäå ÷åì ñíîâà ïîäíÿë[original_hero.GetEndA] ñâîþ êðóæêó.;;x
EVTDESC_HF_12012;"As I am soon to be off into the lands of [target_title.GetName], my [Root.GetMyMarshalName] [marshal_character.GetTitledFirstName] is concerned for our troops being without leadership. ""Might I suggest you leave your [target_artifact.GetName] behind, as a token of your continued guidance?"" [marshal_character.GetSheHe] offers. ""If nothing else, you should have that thing sharpened, my [Root.GetLordLady]"" [marshal_character.GetSheHe] frowns.";;;;;;;;;;;ß ñêîðî îòïðàâëþñü â [target_title.GetAdjective]ñêèå çåìëè, è [Root.GetMyMarshalName] [marshal_character.GetTitledFirstName] îáåñïîêîåí[marshal_character.GetEndA] òåì, ÷òî íàøè âîéñêà îñòàëèñü áåç ðóêîâîäèòåëÿ.\n— Ìîãó ëè ÿ ïðåäëîæèòü Âàì îñòàâèòü ýòî êàê ñèìâîë Âàøåãî ðóêîâîäñòâà? — ñïðîñèë[marshal_character.GetEndA] [marshal_character.GetSheHe]. ß çàäóìà[Root.GetLasLsya]... [target_artifact.GetName] ìîæåò îêàçàòüñÿ âåñüìà êñòàòè.\n— Åñëè óæ íà òî ïîøëî, Âàì ñëåäóåò ïðèâåñòè ýòó øòóêó ê íàäëåæàùåìó âèäó, ì[Root.GetOyaOy] [Root.GetLordLady], — íàõìóðèâøèñü äîáàâèë[marshal_character.GetEndA] [marshal_character.GetSheHe].;;x
EVTDESC_HF_12102;"My travel companion and fellow [Root.GetSocietyRank] [From.GetTitledFirstName] has been taken prisoner by [enemy_captor.Culture.GetName] [enemy_captor.GetTitle], after challenging [enemy_captor.GetHerHim] to one on one combat...! ""Not quite as planned"", I mumble to myself, as I struggle to fall asleep tonight.";;;;;;;;;;;Ìîé êîìïàíüîí è ñîðàòíè[From.GetTsaK] [Root.GetSocietyRank] [From.GetTitledFirstName] áûë[From.GetEndA] âçÿò[From.GetEndA] â ïëåí. [enemy_captor.PrimaryTitle.GetAdjective]ñê[enemy_captor.GetAyaIy] [enemy_captor.GetTitle] ïðèíÿë[enemy_captor.GetEndA] [From.GetHersHis] âûçîâ íà ïîåäèíîê è ïîáåäèë[enemy_captor.GetEndA]!\n— Âûøëî ñîâñåì íå ïî ïëàíó, — ïðîáîðìîòàë[Root.GetEndA] ÿ ïðî ñåáÿ, ïûòàÿñü çàñíóòü ñåãîäíÿ íî÷üþ.;;x
EVTDESC_HF_12102_B;"While out on their raid into foreign territory, the [From.GetSocietyRank] [From.GetTitledFirstName] has been taken prisoner by [enemy_captor.Culture.GetName] [enemy_captor.GetTitle], after challenging [enemy_captor.GetHerHim] to one on one combat...!\n""I thought we only sent our brightest"", I mutter to the servant delivering the news.";;;;;;;;;;;Âî âðåìÿ ñâîåãî ðåéäà íà ÷óæóþ òåððèòîðèþ [From.GetSocietyRank] [From.GetTitledFirstName] áûë[From.GetEndA] âçÿò[From.GetEndA] â ïëåí áûë[From.GetEndA] âçÿò[From.GetEndA] â ïëåí. [enemy_captor.PrimaryTitle.GetAdjective]ñê[enemy_captor.GetAyaIy] [enemy_captor.GetTitle] ïðèíÿë[enemy_captor.GetEndA] [From.GetHersHis] âûçîâ íà ïîåäèíîê è ïîáåäèë[enemy_captor.GetEndA]!\n— ß äóìàë[Root.GetEndA], ÷òî ìû îòïðàâèëè òîëüêî ñàìûõ óìíûõ, — ïðîáîðìîòàë[Root.GetEndA] ÿ ñëóãå, äîñòàâèâøåìó íîâîñòè.;;x
EVTDESC_HF_12102_B_other_reason;"While dreaming of fighting [From.GetHerHis] way through foreign territory, the [From.GetSocietyRank] [From.GetTitledFirstName] has instead been taken prisoner by [enemy_captor.GetTitledFirstName]!\n""How the mighty have fallen"", a servant chimes, before I shush at him.";;;;;;;;;;;Ìå÷òàÿ î ñëàâå íà ÷óæîé òåððèòîðèè, [From.GetSocietyRank] [From.GetTitledFirstName] âìåñòî ýòîãî ïîïàë[From.GetEndA] â ïëåí, è [enemy_captor.GetTitledFirstName] òåïåðü äåðæèò [From.GetHersHis] â çàòî÷åíèè!\n— Êàê ïàëè ñèëüíûå ìèðà ñåãî, — âîñêëèêíóë ñëóãà, ïîêà ÿ íå øèêíóë[Root.GetEndA] íà íåãî.;;x
EVTDESC_HF_12102_other_reason;One moment we were dreaming of fighting our way through foreign lands, and the glory that awaited us back home. The next, [From.GetTitledFirstName] has instead been taken prisoner by [enemy_captor.GetTitledFirstName]! I admit, it does not quite fit  the story I was hoping we'd tell.;;;;;;;;;;;Ìû ìå÷òàëè î áîðüáå çà ÷óæèå çåìëè è î ñëàâå, êîòîðàÿ æä¸ò íàñ äîìà. Âìåñòî ýòîãî [From.GetTitledFirstName] ïîïàë[From.GetEndA] â ïëåí, è [enemy_captor.GetTitledFirstName] òåïåðü äåðæèò [From.GetHersHis] â çàòî÷åíèè! Ïðèçíàòüñÿ, ýòî íå ñîâñåì ñîîòâåòñòâóåò òîé èñòîðèè, êîòîðóþ ÿ íàäåÿ[Root.GetLasLsya] ðàññêàçàòü.;;x
EVTDESC_HF_12103;[From.GetTitledName] has perished during [From.GetHerHis] adventurous journey through foreign lands. Everyone who fought alongside [From.GetHerHim] know that [From.GetSheHe] died a warrior.;;;;;;;;;;;[From.GetTitledFirstName] ïîãèá[From.GetNoneE] âî âðåìÿ ñâîåãî àâàíòþðíîãî ïóòåøåñòâèÿ ïî ÷óæèì çåìëÿì. Âñå, êòî ñðàæàëñÿ âìåñòå ñ í[From.GetEyuIm], çíàþò, ÷òî [From.GetSheHe] óìåð[From.GetNoneE], êàê âîèí.;;x
EVTDESC_HF_12200_A;"The [target_ruler.Capital.GetRegionalBigAnimal] dead on the ground, the [other_combatant.GetManWoman] braces for my attack. I call out: ""For [Root.Society.GetName]!"", my [Root.GetDuelWeapon] swooshing, nay, singing through the air. With the trees as our audience, and only witness to my deed, I have soon seen to [other_combatant.GetWeaponInjuringBlow].";;;;;;;;;;;"Ïîêà [target_ruler.Capital.GetRegionalBigAnimalW] ëåæàë ì¸ðòâûì íà çåìëå, [other_combatant.GetAgedPersonM] äåðæàë[other_combatant.GetEndA] îðóæèå íà ãîòîâå. ß êðèêíóë[Root.GetEndA]: ""Çà [Root.GetSocietyNameGEN]!"", è âñêîðå [other_combatant.GetWeaponInjuringBlow].";;x
EVTDESC_HF_12200_B;Albeit under the influence, the battle stance comes naturally to me. My opponent staggers backwards in surprise, almost tripping over the [target_ruler.Capital.GetTreeRockFence]. Before [other_combatant.GetSheHe] has time to catch up, I [Root.GetKillingBlow].;;;;;;;;;;;Õîòü è íå áåç óñèëèé, áîåâàÿ ñòîéêà äëÿ ìåíÿ åñòåñòâåííà. Êîãäà [other_combatant.GetAgedPersonM] óäèâë¸ííî ïîïÿòè[other_combatant.GetLasLsya] íàçàä, ÷óòü íå ñïîòêíóâøèñü î [target_ruler.Capital.GetTreeRockFenceACC], ÿ ðåøèë[Root.GetEndA] âîñïîëüçîòüñÿ ñèòóàöèåé è [Root.GetKillingBlow].;;x
EVTDESC_HF_12200_C;I draw my weapon, without hesitation. The crowd scatters around us and my opponent and I fall into circling one another. The ensuing fight is more even than I care to admit. At the end, I am sending a quiet prayer to [Root.Religion.GetHighGodName], as I take in the cheers of our audience, and slam my weapon against [other_combatant.GetHerHis] head.;;;;;;;;;;;ß áåç êîëåáàíèé äîñòàë[Root.GetEndA] ñâî¸ îðóæèå. Òîëïà ðàññåèëàñü âîêðóã íàñ, è ìû íà÷àëè êðóæèòü äðóã îêîëî äðóãà. Ê êîíöó ñðàæåíèÿ ÿ òèõî ïîìîëè[Root.GetLasLsya] [Root.GetReligionHighGodDAT], è ïîä àïëîäèñìåíòû ïóáëèêè íàíåñ[Root.GetNoneE] çàâåðøàþùèé óäàð ïî ãîëîâå ïðîòèâíè[other_combatant.GetTsyKa].;;x
EVTDESC_HF_12200_D;"As soon as the camp is out of earshot, my opponent draws [other_combatant.GetHerHis] weapon. Wind moves over the moonlit meadow, the grass bending in waves, causing it look as if the ground itself is breathing, under our feet. ""This is too easy"", I murmur. Then I [other_combatant.GetWeaponInjuringBlow].";;;;;;;;;;;"Ìû ïîäàëüøå îòîøëè îò ëàãåðÿ, [other_combatant.GetAgedPersonM] äîñòàë[other_combatant.GetEndA] ñâî¸ îðóæèå. Âåòåð ãóëÿë ïî çàëèòîìó ëóííûì ñâåòîì ëóãó, âîëíàìè ðàñêà÷èâàÿ òðàâó. Êàçàëîñü, ÷òî çåìëÿ äûøèò ó íàñ ïîä íîãàìè. ""Ýòî ñëèøêîì ëåãêî"", — ïðîáîðìîòàë[Root.GetEndA] ÿ è [other_combatant.GetWeaponInjuringBlow].";;x
